,sentences
0,"前 카카오 TV PD, 現 트위치 스트리머로 후원이 없던 다음팟에서 2013년부터 방송을 시작했고 약 5년 동안 마이크 없이 방송을 했었다."
1,"카오스, 아 키 에이지, 2012년 ~2014 년 리그 오브 레 전드, 2016 년 오버 워치, 2017년 ~2018 년 배틀 그라운드 등 그 해에 가장 인기를 끌었던 게임마다 파고들면 최상 위권을 달성할 정도로 여러 게임을 잘해서 유명 해졌다."
2,한 때 유행한 리그 오브 레 전드 유명 플레이어 관전 방에서 파 카 관전하기 vs 페 이 커 관전하기 나오면 백이면 백 전자를 선택할 정도로 도파나 일부 홈쇼핑 광고를 제외하면 파카가 항상 팟통령을 점령하였다.
3,그 인기를 증명하듯 tv 팟의 유일 무이한 팟 국가 #를 탄생시켰다.
4,방송 시간과 요일은 순수하게 랜덤이다.
5,새벽 4시가 넘어서 켤 때도 있고 방송 시간 또한 내키는 데까지 하는 편이다.
6,평균적으로는 4~5 시간 정도 하며 길면 7~8 시간 정도이다.
7,다만 새벽 3시 전에 방송을 끄는 규칙은 있다고
8,한다.
9,"본인이 채팅 방 관리를 못한다는 것이 그 이유. 주로 리그 오브 레전드를 플레이하며 배 틀 그라운드나 스팀 패키지 게임, 다른 온라인 게임을 방송한다."
10,  자 세한 내용은 PAKA/ 방송 이력 문서를 의 번째 문단을의 부분을 참고하십시오.
11,"이재 석 : 카오스 갤러리 지인으로 이재 석이 방송 중 연패를 하자 친구 목록에 있는 파카를 보고 "" 얘는 미친 듯이 잘한다"" 하면서 관전 몇 판을 하고 얘는 다리 없어도 게임 잘하는데 다른 애들은 뭐냐"
12,는 식으로 하반신 불구 이미지가 생겼고 재 스기와 듀오를 하면서 미친 캐리력을 보여주어 팤 선장이라는 별명이 생겼다.
13,한 때는 이재 석의 챌린저 승급 전 1 세트는 적으로 만 나 우 디 르로 폭파시키고 2 세트에서 또다시 적 팀으로 큐가 잡히자 이 재석을 위해 과감히 닷 지하는 훈훈한 모습을 보였다.
14,이재 석이 정지를 먹으면 새 아이디를 들고 와서 방송을 하던 시절이 있었는데 파카의 즐겨 찾기에는 ( 잡종 1 잡종 2 잡종 3 잡종 4)이 재석의 방송 닉네임만 있었다.
15,또 다른 일화로는 이재 석이 방송 중 파카에게 돈을 빌려 달라 하자 바로 입금을 해 주기도하고 광복절 발언 때문에 이재 석이 욕을 한창 먹고 있을 때 전화로 오 또케~ 오또케~ 하며 걱정해 줘서 감동 먹었다고
16,한다.
17,"트위치에 와서는 아예 이 재석 방송에 하루종일 상주하면서 같이 롤 토 체스를 하기도 하고, 본캐 부캐 두개를 동시에 돌리며 저격을 하는 등 한결같은 재석 사랑 개의 모습을 보인다."
18,파카 자랑하는 재 스기 파카와 삔 또 상한 이재석 대화재 스기 팔굽혀 펴기 감상하는 파카 이재 석 매 드무비를 감상하는 파카도 파 : 파카를 마이크 키게 한 장본인이라고 할 수 있다.
19,노 마이크로 도파와 배틀 그라운드를 하는 게 너무 답답한지 마이크를 사용하기 시작했다.
20,"기가 막힌 에임 배틀 그라운드 파카 불러 개그 듀오 모자란 듀오, 스타#, 워크 유 즈맵#, 프 랜즈 마블# 마블 송# 등 등 게임을 같이 하기도 했다."
21,도파도 파카가 3 일간 잠수 타자 따로 디스코 드로 파카를 찾는 등 파카와 잡담과 게임하는 것을 즐기는 편이다.
22,새벽부터 파카를 찾았던 도파 도파와 파카의 말투가 서로 비슷 해지는 모습까지 보이고 있을 정도이다.
23,랄로와 함께 셋이 친 해져서 종종 도파 집에서 자고 밥을 얻어먹는다#. 랄로 : 오래전부터 알 던 사이지만 공익시절이 던 랄로와 배틀 그라운드를 하면서 친해 졌고 그 이후 코 인을 같이 하면서 파카 집에 올 정도로 사이가 가까워 졌다.
24,"랄로의 생일날에 파카 집에 서 파카의 어머니가 차려 준 생일상을 얻어먹을 정도로 친한 사이다. 통칭 ' 소문 난 두 오'. 얼핏 보면 롤 실력이 퇴물이 되어 버린 랄로가 트롤할 것 같지만 실상은... 랄로의 슈퍼 똥꼬 쇼 둘이 잡담을 해도 쉴새없이 낄낄거릴 정도로 오디오가 비지 않는 콤비. 또 랄로 한테 삐진 파카 짜장면으로 만담 분리수거 토론 5년마다 이불에 오줌 지리는 사람## 실제로 둘이 만나서 술 마시고 노래방에 부른 붉은 노을 녹음을 공개했다.. 팟뱅( 파 카& 랄로)- 붉은 노을 괴물 쥐 : 파카가 노 마이크일 때부터 데 바데, 오버 워치 등 여러 게임을 같이 했었고 공익시절이 던 괴물 쥐와 배틀 그라운드를 자주 했었다."
25,괴물 쥐에게 카카오 배 그를 선물해 줬는데 파카의 배 그 닉네임인 Cartman9를 따라 Hooingman9 로 지었다.
26,파카가 사용하는 전자 담배는 괴물 쥐에게 추천 받은 거라고 한다.
27,오버 워 치와 롤 듀오 고백해서 혼 내주기 ASMR 파카 괴물 쥐 괴물 쥐님 너무 무서워 서브 웨이 인 싸 처 럼 주문하는 법 뼈 맞은 괴물 쥐 의리의 사나이### 괴물 쥐에게 대전 풀코스를 약속 받았다.
28,인 섹 : 배 틀 그라운드를 자주 했었다.
29,스타 유즈맵과 롤 토 체스도 같이 하기도 했다.
30,대게팟에 같이 포함되어 있기도 하다.
31,송 진리 : 배 틀 그라운드를 자주 했었고 같이 수다 떠는 걸 좋아한다.
32,롤 챔스 시즌 대회기간이 끝나면 배그 하러 파카방송에 찾아오곤 한다.
33,자기보다 더 살살 싸기를 잘하는 사람이라고 ...2020 년에 아프리카 프릭스로 이적함에 따라 아프리카 티비로 넘어갔고 둘 다 방송 중인 상황에서 파카가 말을 걸자 장난으로 모르는 척을 했다.
34,아프리카로 이적한 검은 머리 사나이#### 곧 소문날 것 같은 패작 두 오피 닉스 박 : 배그 합방과 롤 듀오를 했었다.
35,#### 2020년에는 배 그를 하지 않아 간간이 롤 두 오를 하는 중. 새벽에 피닉스 박 방송에 출몰해 자주 채팅을 치기도 한다.
36,아직 서로 직접 만난 적은 없는 듯. 2020년 하반기 영원 회귀: 블랙서 바이 벌 출시 후 꾸준히 피닉스 박 방송에 나타나 듀오를 하고 있다.
37,1등을 못했을 시 로비에서 이루어지는 피드백 손 박대전이 보는 맛이 있다.
38,얍 얍 : 다음팟시절부터 알던 사이며 엄청나게 얍 얍 을 좋아한다.
39,"서로도 방 스토커 얍 얍 이와 함께 오버 워치 트버워치 대회 트레겐 지악성 얍 줌 마, 데 바데#, 섯 다#, 포 아 너#, 배틀 그라운드#, 포트 리스# 등 등 여러 게임을 같이 했었고 마이크를 쓰지도 않으면서 스카이프로 대화도 종종 했었다."
40,스카이 프 꾸지람 듣는 파카 80 점 찍고 얍 얍 놀 리 기 자신의 방송에서 당시 구독자가 8400명인 얍 튜브 구독 좀 눌러 달라는 홍보와 도파에게도 얍 얍 이 홍보를 열심히 한 적이 있다.
41,얍 얍 시 러를 외치던 팟수에게 정색은 덤. 또 다른 정색. 언젠가 한번은 방송이 꺼진 걸 모르고 얍 얍 이 방송을 보며 깔깔대기도 했다# 얍 얍 이도 파카에게 트위치에서 방 송하라고 이야기를 많이 했었다고
42,한다.
43,그러나 얍 얍 이 말하길 방송으로 돈 벌 생각이 없나
44,보다라고..# 얍 얍 이 트위치로 이적한 후에도 가끔 씩 파카 이야기를 한다.
45,얍 얍 이 말하는 파카인 욱이 화 이 팅! 손인 욱 씨에게 도움 받은 썰# 19년도에는 자 낳대
46,관련 탑 챔프 추천 좀 해 달라고 물어봤다고
47,한다.
48,"# 치킨 쿤, 호무 새, 공 혁 준 : 다음 팟 시절부터 아는 사이며 오버워치와 데 바데 등 게임을 같이 했었다."
49,"스카이 프## 파카, 얍 얍, 치킨 쿤, 호무 새로 팀을 만들어 오버 워치 스트 리머 배 틀에 같이 나가기도 했었고 트버워치 대회에서는 파카 얍 얍 vs 공 혁 준. 치킨 쿤. 호무 새 적 팀으로 붙기도 했었다."
50,## 가재 맨 : 카오스 갤러리 시절부터 아는 사이다. 가재 맨의 형과 파카가 아는 사이 여서 파카가 반말을 한다.
51,파카가 반말하는 몇 안되는 사람 중 한명이다.
52,반말 쓰는 파카 파카한테 존댓말하고 재석이한테 반말하는 이유## 막내 현진 : 롤 바 텀 듀오를 했었다.
53,듀오가 너무 달달 해서 그 이후로 막내 현진은 시청자들에게 불 여시라는 별명을 얻었다.
54,"방송을 안 할 때도 듀오를 하거나, 공포게임도 같이 했었다."
55,"후두암, 다리가 없다, 휠체어 맨 처음 방송을 시작한 2013년부터 마이크를 키지 않는 이유에 파카는 후두암에 걸려서 목소리를 낼 수 없다는 팟수의 드립이 채팅 창에서 흥하면서 시작되었다."
56,이 후두암 드립은 이후 파카가 30시간 연속 방송을 하는 등 오래 방송을 하자 이제는 휠체어를 타고 다녀서 밖에 나갈 수 없어 자연스럽게 방송만 시키게 된다는 드립으로 진화하였다.
57,## 팤 운 금( 파 카 운전 금지) 많은 게임에 재능을 보여 상당한 실력을 자랑하는 파카이지만 유독 카트 라이더를 못하는 모습을 방송에서 보여준 적이 많다.
58,이후 배 틀 그라운드를 하면서 파카가 운전을 하면 꼭 차량을 전복시키거나 심지어는 교통사고로 스쿼드를 전멸시키는 끔찍한 모습을 보여준 적이 많다.
59,게다가 오토바이를 애마라고 부르면서 오토바이 운전에 집착하는 모습도 여러 번 보여준 적이 있다.
60,오토바이를 타도 혼자 의문의 교통사고 사망을 보여준 적이 많다.
61,피해자는 항상 도파다
62,(...) 파카가 운전 금지된 이유##### 말을 굉장히 순하게 하는 것과 더불어 화를 거의 내지 않는다.
63,고의 트롤을 당해도 팀원 중 한 명 이상이라도 게임을 포기하지 않으면 끝까지 자신이 맡은 바를 수행하려 한다.
64,[28] 도네로 어 그로를 끄는 것보다 채팅 창이 불타오르는 것을 더 싫어한다.
65,그런 점을 노려 일부러 그런 도네를 쏘는 악질 시청자가 있다.
66,그러니 그런 어 그로에 휩쓸려 채팅 창을 망치지 말자. 방송하면서 받는 스트레스 중 하나인 듯 하니 그런 도네를 보면 웃어 넘기는 시청자가 되자. 자기 마음대로 챔피언들의 이름을 바꿔 부른다.
67,"볼 리 베어는 볼라 베어, 뽀삐는 뽀뽀 또는 삐뽀, 트린 다 미어는 트란 다 미르, 룰루는 루루, 아트 록스는 에이트 록스, 릴 리 아는 릴 리, 사 일러 스는 살 루스, 말 파이트는 바우 [29], 카이사는 카이사 르 등 이렇게 바꿔서 말하고 팀원이 못 알아들으면 영국식이라고 한다."
68,팤 클 라스 방송 중 자주 잔 기침을 한다.
69,기관지가 좋지 않은 편인 듯. 흡연자이고 전자 담배 코크맛을 핀다고 밝혔다.
70,2020년 8월 30일 방송에서 위장이 안 좋아 잔기침이 잦다고
71,말했다.
72,자기 목소리에 컴플렉스가 있다 고한다.
73,농담으로 목소리 굵게 하기 위해서 담배를 핀다고.. 현재까지 밝혀진 가족관계는 부모님과 형. 형의 기타를 가지고 연습을 하고 있다고
74,방송 중에 언급했다.
75,집이 상당히 풍족한 편인 듯. 집에 1000만원 가량의 자전거가 있다고
76,한다.
77,"주식을 취미로 하시는 어머니께서 파카가 코 인에 1억을 쓴 것을 알게 되었는데, 1500만원을 주시며 그 돈을 어떻게 하든 마음대로 쓰고 그 돈을 쓰면 코 인을 끊으라고 했다고"
78,한다.
79,파카의 1억을 본인에게 주었으면 중국 주식에 투자해 줬을 텐데 하고 얘기하기도 했다고.
80,"여담으로 저 1500만원은 이미... 랄로의 삼억 슨 과 비교하는 채팅이 올라오자, 랄로는 3억을 벌었다가 날린 거고 자신은 애초부터 얻지도 못하고 원금 1억을 순수하게 날린 거라고 말했다."
81,굉장히 깔끔한 성격과 위와 같은 에피소드로 인해 돈과 관련 얘기나 나오면 채팅 창이 도련님으로 도배되는 모습을 흔히 볼 수 있다.
82,기타를 배우기 시작한 후부터 여러 기타 유튜버들의 연주를 보며 기타를 배우고 있던 도중 정 성하와 인연을 맺게 되었다.
83,[30] 디스코 드로 서로 기타 연주를 들려주고 전화 번호도 교환한 상태다.
84,정성 하의 팬인 듯 엄청 기뻐하는 모습을 보여주었다.
85,자신은 종교는 없지만 불교에 가깝다고
86,말했다.
87,스스로 한량 같은 성격이라 한다.
88,이는 방송 시간에서도 읽을 수 있다.
89,정해진 시간 없이 그때그때 온다.
90,"본인도 주기적, 규칙적으로 방송해 보려 했으나 도저히 안됐다고."
91,트위치 코리아에서 이적 오퍼를 넣었을 때도 본인의 게으름 때문에 안 간 것이나 마찬가지라고 한다.
92,"유일하게 규칙적으로 하는 것은 재 스기 의 방송을 보는 것 정도인 듯... [31] 배틀 그라운드 스쿼 드중 송 진리의 입대 상담을 하는데 말하기를 "" 들어가기 전까진 굉장히 친절한 곳"" 이라는 명쾌한 답변을 해 주었다."
93,파카 본인은 육군 작전 병으로 복무하였다고
94,한다.
95,"군대 얘기만 나오면 "" 작전 병은 힘든 보직"" vs "" 그거 커피 병 아니냐"
96,""" 라고 시청자들과 배 틀을 벌인다."
97,송 진리에 따르면 롤 드컵 통역 누나로 유명한 박 지선 통역사가 파카의 팬이라고 한다.
98,술자리에서 슬며시 다가와 전해 달라고 했다고..
99,방송 도중 운전면허 2 종 보통을 가지고 있다고
100,밝혔다.
101,"책상 정리는 보름에 한 번, 바닥 정리는 주에 한 번 한다고 한다."
102,쓰레기를 쓰레기통에 넣는 것이 귀찮아서 그냥 바닥에 둔다고. 바닥 정리는 그 쓰레기들을 치우는 것이라고 한다.
103,질색하는 시청자들에게 이렇게 하고 한 번에 치우는 게 이득이라며 아 펠리오 스의 만월 총과 화염 포로 비유해 더욱 경악하게 만들었다.
104,"또, 분리수거는 잘한다고 한다."
105,[32] 그럼 바닥에 분류해 놓는 거냐
106,는 물음에 맞다고
107,답변했다.
108,(..?) 공감하는 사람이 없다며 오히려 본인이 놀랐다.
109,연예인 중 박 보영을 좋아한다.
110,자연에 의하면 박 보영이 나오기 때문에 파카가 늑대 소년을 보러 갔다고
111,한다.
112,"스팀 프로필 사진이 박 보영인 점, 방송 중 박 보영의 ' 피 끓는 청춘' 을 가끔 듣는다는 점, 메모 장의 글씨체가 박보 영이 홍보한 초록 우산 어린이재단의 글씨체인 산 돌 초록 우산 어린이 체임을 미루어 볼 때 맞는 것 같다."
113,"한식보다는 간단하게 먹는 걸 선호하는 듯 하다. ( 주로 샐러드, 샌드위치, 시리얼 같은 부류) 16년 여름에 스타 관전방송 중 ' 뭐 먹는 중이라 양해 바랍니다"
114,' 라는 말에 시청자들이 뭐 먹냐고 물어보자 ' 샐러드입니다
115,' 라고 한 적이 있었다.
116,# 가끔 본인이 한 요리나 먹고 있는 식사 등을 사진으로 찍어 화면에 보여주기도 한다.
117,일명 듀 라 한식 먹 방 .2018 년 7월 7일 랄로와 함께 더 포 레스트를 하던 중 마이크를 끄는 걸 깜박 하고 자리를 비우면서 여자 혼자 파카 집에 온 게 들킨 적이 있다.
118,파카의 웃음소리와 대화 내용 중 파카가 ' 반 바지 사 왔어?
119,' 라는 말을 하여 반바지 사건이라고 한다.
120,랄로가 도중에 방해하여 자세한 대화내용은 유출되지 않았다.
121,# 이 후 돌아온 파카는 친척이라고 해명하였다.
122,물론 아무도 믿지 않는다.
123,공중파에도 진출했다.
124,# 노래방에서 ' 플라워' 의 노래들을 주로 부른다고 한다.
125,턱걸이 3개까지 가능하다고
126,한다.
127,노 점프 턱걸이라고 강조했다.
128,이 정도면 업계 상위 0.1%라고 덧붙였다.
129,어렸을 때 작은 하늘색 앵무새를 키웠다고
130,한다.
131,앵무새 생김새만 들어도 종류를 맞출 정도로 관심이 많다.
132,익명의 카 갤러가 파카 방에 후원한 메시지에 의하면 앵무새의 이름이 ' 나이 수' 였다고
133,하는데 파카가 예전부터 써 오는 대부분의 아이디에 'skdltn' 가 포함되어 있다.
134,하지만 앵무 새 이름을 본인이 밝힌 적은 없다.
135,파카의 과거를 얘기할 때 항상 거론되는 것이 2014년 다음팟에서 방송하던
136,"PD 소녀를 12 시간 저격 큐를 돌린 적인 데, 먼저 종 종 저격 큐를 돌리던 이재 석이 말하길 "" 나는 니들 방송해 주고 재밌으라고 하지만 쟤는 그냥 지가 한 거 라니 까? 악질이야."
137,"악질 "" 이라 말한 적이 있고 자연이 말하기를 소녀가 전챗으로 그만 좀 쫒아다니라고 말하자 ' 우연히도 만 낫 내요 ' 라며 받아쳤다고"
138,한다.
139,소녀는 그 이후 재 스기보다 진짜 진짜 상 또라이가 파 카라며 말한 적이 있다.
140,"소녀 파카 대화 이러한 얘기에 자신은 소녀님 롤 친 추, 카 톡 친구에 전화번호도 가지고 있고, 아는 사람( 방송인들 끼리) 외에는 저격하지 않는다고"
141,한다.
142,2020년 8월 27 일자 방송에서 저격에 관련된 이야기를 하다가 결혼 후 방송을 그만둔지 5년 이상 넘어가는데 이제 일반인이 된 소녀에 대한 언급을 자제해 달라고 부탁했다.
143,더불어 장 균 님 저격은 상호 합의 하에 진행하는 것이니 시청자들이 왈가왈부하는 것은 괜한 참견이다.
144,고등학교 시절 이과였다고
145,한다.
146,"과 탐 선택과목은 생 1, 생 2. 백호 선생님 수업을 들었다고"
147,한다.
148,"방송을 하기 전 2010년 17살 고등학생 시절엔 카오스 jKbK 클 랜 소속으로 CCB에 출전해 CCB13 24 강, CCB16 8 강에 진출한 적이 있고 기사 jKbK 클 랜 전 시즌 준우승 팀 꺾고 승자 조 진출 영상 카 갤 내에서 갤러들 의 롤 실력을 평가하는 글에서도 항상 최상 위권을 차지하고 있었다."
149,아 키 에이지에 빠져 살던 때는 화려한 컨 과 골 때리는 악행들 로 살짝 이름을 날리기도 했다.
150,자연에 의하면 이때 당시 아 키 에이지에서 아재들이 파카에게 잘 보이려고 공물을 바치듯 아이템을 막 퍼 주기도 했다고
151,한다.
152,"이후 롤을 시작하면서 다음팟에서 방송을 켰는데, 매 게임 할 때마다 소름 돋는 피지 컬 을 선보이며 팟수들에게 충격을 가져다주며 유명세를 날리기 시작한다."
153,"이때까지만 해도 롤 내부에서만 좀 유명한 플레이어였는데, 이후 오버워치가 출시되고 겐 지 플레이가 유명 해지면서 가끔 오버 워치 커뮤니티에서도 실력자로 언급된다."
154,"카 갤러들의 증언에 의하면 과거 고등학생 때 카 갤 마인 크래프트 서버에서 집들을 다 부셔 버리거나 군 입대 이전 아 키 에이지를 플레이할 당시 상대 세력의 배를 털어 버린 후 보스몹에 들이박거나, 상대 세력의 짐을 털어 버리는 등등 [33] 지금과 비교할 수 없는 상 또라이였다고"
155,한다.
156,방송에서 과거 마인 크래프트를 하던 시절을 회상하며 자신이 운영자를 맡게 된 서버에서 있었던 일화를 이야기 해 줬는데 내용이 어마어마하다.
157,게임에서 투시 경 모드를 사용해 지하 내부 광물과 동굴의 위치를 알 수 있는 것을 이용하여 유저들이 채광할 때 그 유저가 조만간 만나게 될 다이아를 철광석으로 바꿔 치기하면서 반응을 보는 것을 즐겼다고
158,한다.
159,그리고 지칠 때 쯤에 다이아를 발견하도록 만들어서 계속 농락했다고
160,한다.
161,* 참고 군 입대 이전에는 아 키 에이지를 플레이했으며 누이 아 대륙 활쟁이로 네 임 드로 명성을 날렸다고
162,한다.
163,거기서 과로 사도 만났다 고... 또한 군 입대 이전 시즌 3 다이 아몬드 1 티어 100점을 유지하자 CJ 게임 단에서 프로 연습생 제의를 받았다는 썰 이 있다.
164,본인 말로는 롤 프로 게이 머 애로 우보다 먼저 제닉스에서 프로 제의가 왔다고
165,하지만 거절했다고
166,한다.
167,썸 썸 편의점을 하면 안되는 이유를 나열하다가 본인의 취향(?) 을 밝혔다.
168,흑색 장발이라고 한다.
169,이분? 영원 회귀: 블랙서 바이 벌에서는 시 셀 라가 마음에 든다고 한다.
170,멜론에 PAKA의 플레이 리스트를 업데이트 하는 팟수가 있다.Akaps
171,"(K-POP)# PAKA (POP)# 키보드는 커 세어 K70 은 축, 마우스는 로지텍 G304를 쓴다고 한다."
172,"헤드셋은 젠 하이 저 HD600, 모니터는 DELL 에 일리 언 웨어 AW2518H, 게임용 컴퓨터는 i7 8700k, RTX2080 SUPER, RAM 32GB라고 밝혀져 있다."
173,따로 송출용 컴퓨터를 사용한다.
174,이메일이 공개됐다.
175,soninuki@gmail .com 미야 피 셜 도파와 키가 비슷하고 머리가 엄청 작다고
176,한다.
177,금 수저처럼 생겼다고
178,MBTI는 INTP 이다.
179,어떤 게임이든지 파고들기 시작하면 최상 위권을 달성하며 엄청난 실력의 재능 충 모습을 보여줬다.
180,게임 센스가 매우 뛰어난 편이며 화려한 플레이가 자주 나오는 편이다.
181,"캐릭터가 별나며, 특히 게임을 특이하게 플레이하기를 좋아한다."
182,"마이크뿐만 아니라 채팅도 거의 하지 않았는데, 가끔 치더라도 영어로 치는 경우가 많았고, 한국어로 채팅을 해도 짧은 단어를 쓰거나 뭔 가 어색하게 말하기 때문에 마치 한국어를 구사하지 못하는 외국인이나 컴퓨터 인공지능 같은 느낌을 뿜어낸다."
183,팟수들은 파카가 채팅을 한 번 씩 할 때마다 놀라며 좋아했었다.chqkq
184,"속보 센 쵸 채팅 속보 센 쵸 2개 국어 사용 속보 파카 장 문의 한글 채팅 파카: 네 재능을 신에게 하사 받으면서 등가교환의 법칙에 따라 두 다리를 앗아 갔다는 시청자의 드립으로 다리가 없다는 밈이 생겼고, 휠체어를 타고 다닌다는 밈으로 진화했다."
185,시청자들의 아우성에도 마이크를 쓰지 않아 후두암 환자라는 별명도 붙었다.
186,그 실력을 증명하듯이 챌린저 50명이 던 시절 다이아 1 티어 99점 아이디를 무려 4개나 소유하고 있었다.
187,계정 모두 MMR 3000대로 프로 게이 머급 .14 년에는 배치 계정을 다 1까지 오직 베인 만 플레이 하여 38승 0패로 찍은 적이 있었다.
188,챌린저에 가지 않는 이유는 챌린저 티어로 올라가면 게임 서치 시간이 길어 져서 안 간다는 풍문이 있었다.
189,시청자들이 챌린저를 달지 않는 이유가 못 해서라고 까 내리자 마스터 티 어가 없던 챌린저 200명 시절 2014년 7월에 승급 전 3승 0패로 PAKA 계정을 챌린저로 올려놓고 플레이를 하지 않았다.
190,이때는 잿불 거인이 나타나기 전으로 우 디 르가 고인 챔이라는 인식이 강해 천상계에서 아무도 우 디 르를 쓰지 않았으나 우 디 르 50 판 승률 76% KDA 5.8이라는 어마어마한 수치로 챌린저에 입성했다.
191,당연히 천상계에선 원탑 우 디 르 유저. 2016년 전역 후 오버워치를 시작하였는데 노 마이크에 솔로 큐임에도 불구하고 경쟁 전 오픈 이후 90승 /0 무 /28 패 (76.3%) 로 82점을 달성하면서 인기를 끌었다.
192,2017년 초부터 대세로 떠오른 배 틀 그라운드를 시작하였다.
193,오버워치와 비슷한 FPS 게임에 재능을 보이는 파카답게 솔로/ 스쿼드를 가리지 않고 엄청난 에임을 보여주고 있다.
194,"롤 PD 들이 파카 방송에 모여 스쿼드를 자주 하였는데 [16] PD들 한두 명이 0 킬, 1 킬 을 하거나 빨리 죽어서 없더라도 멱살 잡고 우승시켜 주는 버스 기사 역할을 하였다."
195,마이크 없이 배 틀 그라운드를 하는 게 너무 답답한지 2017년 5월 4일 처음으로 마이크를 사용하기 시작했다.
196,말 한 마디 한 마디를 상당히 순하게 한다.
197,"다른 롤 스트 리머들이 습관적으로 내뱉는 욕설 [17] 은 물론, 상대방을 비하한다거나 이상한 드립. 듣기 불편한 말을 거의 하지 않을 뿐만 아니라 심지어 화도 잘 내지 않는다."
198,[18] 이런 말투가 인터넷 방송계에서 가장 분위기가 거친 플랫폼인 카카오 팟에도 퍼져 매운맛인 시청자들과 롤 PD 들 [19 ]에게 전염돼서 옛날에 비하면 말투가 순해 진 편이다.
199,물론 파카 마냥 욕설 등을 일체 사용하지 않는 건 아닌데 한창 때를 생각해 보면 정말 순해 진 편. 특히 도파가 애용한다.
200,"파카의 첫 마이크 사용 후 방송인들 끼리, 방송인과 시청자가 서로 반말하는 디시 분위기인 카카오팟에서 선생님이라는 호칭으로 부르기 시작했다."
201,방송을 하면서 개인 신상 노출을 극도로 꺼린다.
