,sentences
347,이 모든 것은 사실 붐 붐 홈 몰래 카메라였다.
348,"가이 코의 해명으로는 붐 붐 홈이 평소에 노 잼이라는 말이 많이 나오고, 붐 붐 홈이 멤버들에게 매번 까이는 모습이 보기 안 좋다는 유 튜브 시청자의 발언이 있어서 이 몰래 카메라를 계기로 붐 붐 홈을 더 이상 까지 말자는 의도와 기운을 차리게 해 주는 게 목적이였는데, 필요 이상으로 감정이 벅차오르는 바람에 몰래 카메라로 끝나는 수준이 아니게 되 버린 것인데... 로어 보이의 "" 제비가 말했다 매"" 라는 말을 필두로 가이 코와 시청자들은 크게 당황한다."
349,다시 말해서 제비가 몰 카 사실을 이미 붐 붐 홈에게 다 까발린 것이다.
350,붐 붐 홈이 삐 진척 했다고
351,생각한 가이 코와 멤버들은 결국 붐 붐 홈을 다시 통화 방에 불러서 사정을 이야기 해 주는 척 하면서 몰 카를 또 계획했다.
352,가이 코는 몰 카의 취지를 설명하면서 결국 다 몰 카라고 이야기했지만 가이 코가 아무리 부드럽게 말해도 붐 붐 홈은 왠지 화가 풀리지 않은 듯 보였다.
353,"그러나 갑자기 로어 보이가 몰 카 다 끝났으니까 연기 그만 하라고 하고 매 덕의 "" 둘 다 그만 해 이 XX( 제비 본명) 이 다 망쳤어 또"" 라는 말을 필두로 갑자기 제비의 ""야 이 개새끼들 아!!!!!"" 라는 욕을 시작으로 멤버들의 극 딜 이 펼쳐지며 상황이 아수라장이 되어 버린다."
354,사실 진실은 이러했다.
355,진실게임 직전 상황 극이 꼬였다고 판단한 제비는 붐 붐 홈에게 진실게임 전에 붐 붐 홈에게 모든 게 몰 카라고 까발렸고 여기에 역 몰 카를 제시한다.
356,다른 멤버들은 붐 붐 홈이 몰 카 사실을 알고 있었다는 사실을 알고 가이 코를 제외한 멤버들이 통화 방을 만들어 [64] 가이 코를 당황시키기 위한 작전 방을 만들었다.
357,[65] 가이 코만 모르는 상황에서 분위기는 더 심각 해지고 가이 코를 낚으려는 이 몰 카 모의는 붐 붐 홈이 채팅 방을 나갈 때 까지는 순조롭게 흘러가는 듯 했다.
358,제 비가 붐 붐 홈이 몰 카 사실을 이미 알았다는 사실을 가이 코에게 까발리기 전 까지는. 이때 제비는 이 채팅 창에 참여하지 못했던 건지 역 몰 카에 역 몰 카 제의를 하겠다고
359,붐 붐 홈의 역 몰 카 사실을 가이 코가 있는 채팅 방에 불어 버렸고 그 덕에 멤버들이 준비했던 가이 코 몰 카가 잔뜩 꼬이는 바람에 망해 버렸다.
360,뜬금 없이 상황을 복잡하게 만들어 버린 제비에게 멤버들은 사랑의 쌍 욕을 시전했고 제비: 채팅 시작부터 제비 개새끼야 이러고 시작하는데! 그에 당혹감과 빡침을 느낀 제비는 붐 붐 홈에게 역 몰 카의 역 몰 카사실을 전하면서 역 몰 카의 역 몰 카의 역 몰 카를 기획해서 한 몰 카에서 몰 카를 무려 3번이나 뒤집어 엎는 위업을 달성했다.
361,결국 마지막 붐 붐 홈 간이 몰 카까지 터지는 것을 필두로 모든 것이 다 망해 버린 것. 여기서 재밌는 사실은 상황이 미쳐 돌아가는 와중에도 붐 붐 홈은 이 모든 과정에서 상처받은 연기부터 삐진 연기까지 몰 카의 중심이 되는 연기를 멋지게 소화 해냈다는 점이다.
362,이전부터 도 연기 스펙트럼이 넓은 멤버라고 평가 받던 붐 붐 홈이었지만 이 몰 카에서는 거의 최대한계에 가까운 훌륭한 연기를 보여주어 가이 코와 시청자들을 멋지게 속아 넘겼다.
363,"즉, 붐 붐 홈이 자신의 속사정을 터는 건 온전히 본인의 연기였고 그 연기의 퀄리티가 뛰어 나서 시청자와 가이 코 그 누구도 연 기라 생각하지 못했던 것이다."
364,상황이 종료된 이후 제비는 모든 멤버들에게 온갖 극 딜을 전부 얻어맞았고 시청자들과 멤버들이 함께 웃으며 훈훈하게 마무리 되었다.
365,이후 가이 코 TV 시청자 및 팬들 사이에서는 아프리카 방송사상 시청자들을 완벽하게 속인 최고의 연기 퀄리티로 평가하고 있다 그러나 문제는 유 튜브에서 발생하였다.
366,몰래 카메라 컨텐츠 영상을 본 유 튜브 시청자들이 붐 붐 홈을 포함한 멤버들의 연기가 진짜 같아서 시청자들이 몰래 카메라 치고는 너무 비인간적이였다고
367,항의가 적지 않게 들어오자 가이 코는 다음날 녹화 본을 편집한 해명 영상 유 튜브에 올렸다.
368,"몰 카 이후, 일부 악독한 시청자가 왜곡된 시선으로 붐 붐 홈에게 계속된 욕과 비난을 하는 바람에 붐 붐 홈이 정신적인 압박을 느껴, 휴식을 위해 고 멤 탈퇴라는 상황까지 오게 되었다."
369,몇 달 뒤에서야 다시 복귀하였다.
370,지금은 개인방송으로 전환한 가이 코 방송에서 게스트로 가끔 출현하고 있다.
371,그렇게 게스트로 돌아온 그가 오랜만에 처음으로 들은 질문은 성전환 관련 질문이었다.2017
372,년 4월 1일 만우절. 1 분만에 끝나
373,버린 진짜를 찾아라
374,컨텐츠 후 [66] 방송에서 오버워치를 하기 위해 본 계정으로 오버워치를 들어갔는데 빵 사와 계정 [67] 이 로그 인 되 있는 걸 보고 곧바로 그 계정으로 들어갔다.
375,[68] 아니나 다를까 그랜드 마스터였던 계 정이 마스터로 강등됐다.. 대충 130점이나 해킹 때문에 떨어졌다.
376,"처음엔 세 븐 에게 전화를 했으나 채팅을 보면 외출 상태인 걸로 보임. 빵 사와 계정은 경쟁 전 중이였고 가이 코는 메 르시로 플레이 중인 걸 확인하고 음성 채팅으로 "" 혹시 이 계정 쓰던 사람 트롤 했어요?"
377,""" 라고 물어보자, 사람들은 "" 네 트롤했어요.."
378,""", "" 이거 자기 계정 아니라고 막 던지던데.."" 라는 반응을 보였고 가이 코는 멘 탈이 붕 괴되 버린 채 [69] 루시 우로 바꾸고 빡겜을 하자 사람들은 "" 갑자기 빡겜하네"
379,"ㅋㅋ"" 이런 반응을 보였다."
380,그 와중에 이겼다.
381,가이 코는 게임이 끝난 후 세 븐 에게 비밀번호를 바꿔 달라고 했다.
382,"당시 같이 있던 멤버들은"" 진짜 지킬 앤 하이드 실사 판이다."
383,""", "" 여러 분 이래서 로그 아웃이 중요합니다."
384,""" 라는 반응을 보였다."
385,아마도 PC 방에서 하고 제대로 로그 아웃 안한 가능성도 있어 보인다.
386,"물론 사건의 전말이 밝혀지기 전까진 위에 서술된 사건, 그 모든 일들은 멤버들의 만우절 이벤트였다!"
387,최근 가이 코가 힘들어 하는 거 같다고
388,"당시 방송에 참여했던 멤버들이 한번씩 돌아가면서 플레이 했는데, 점수가 저렇게 비참하게 되는 걸 노렸는지 아니면 올려 주려 다가 의도치 않게 저렇게 된 건지는... 글쎄... 참고로 이때 가이 코 제외 방송을 참여한 모든 멤버가 웃었다 본격 멤버들이 BJ를 고통 받게 하는 컨텐츠 위에 서술되어 있는 가 학자& 피학자 협동방송이란 게 이 걸로도 충분히... 그만둬! 가이 코의 라이프는 이미 제로야! 자세한 건 이걸 참고하자 참고로 가이 코는 개인정보 유출이 자주 되어 던 전 앤 파이터 계정, 메이 플 계정 등, 게임 계정이 자주 털리는 일이 있었다."
389,"지 못 미 2017년 6월 15일 새벽 정규 방송이 끝나고 멤버들과 배틀 그라운드를 하던 중, 한 시청자가 만두와 듀오로 1등 100만원부터 10등 10만원까지 등수에 따라 후원을 걸고 10등 안에 못 들어가면 벌칙을 받는 내기를 했다."
390,이 코는 만두와 6 대 4로 돈을 나누기로 하고 게임을 시작했다.
391,하지만 첫 판은 어이 없게 자동차 오브 젝트 사이에 껴서 시작한 지 5 분만에 끝나
392,버렸다... 벌칙은 이 코 이 코니 최신 판... 두 번째 판은 2 층에서 올라오던 적을 놀라 운 에임으로 못 맞춰서 실패. 벌칙은 폭신폭신 1분이였다 [70] [71]... 둘 다 영원히 놀림거리가 되었다... 그런데 결국 마지막에 초 진지 모드로 물 속에서 버틴다는 전략으로 일명 아쿠아 맨 메타로 결국 1등을 한다!
393,"심지어 같이 한 만두는 2 킬, 본인은 0 킬 을 기록했다."
394,그리고 이어지는 진짜 100만원 후원! 그런 데 사실 막판에 만두가 배신하면 만두가 40만원을 벌 수 있도록 그 시청자가 재빨리 내기를 만들었는데 만두가 이걸 못 봤다... 이로 인해 그 시청자는 만두를 당분간 후원 안하기로 했다고...
395,만두는 이를 안 후 짜증을 냈다.
396,이후 이 코에게 돈을 요구했다 시청자들이 도배한 40원을 보고 오해하며 돈 안 주면 멤버를 탈퇴한다고 했다.
397,하지만 이 상황은 가이 코와 만두 두 명이 일부러 상황 극 분위기를 내려고 반쯤 연기한 것이었다.
398,[72] 이 코가 곧바로 돈을 보냈는데 무려 20원이었다.
399,십원 단위가 가능한가 십원 단위는 물론 일원 단위도 이체가 가능하다 이 때 장난인 것을 잊은 만두는 이 코가 라이브로 각서를 쓰도록 했다.
400,그 후 40만원은 가이 코가 다음달에 트위치에서 돈 받고 지불하기로 되었다.
401,이 장난에서 만두가 가이 코를 평소와 다르게 이 코 씨라
402,"했고, 20원이 보 내진 관계로 당시 시청자들은 1EKC (이 코 씨) = 20원이란 공식이 생겼었다."
403,그리고 가이 코는 후원 기능에서 단위를 원 대신 EKC로 대체했다.
404,편리성의 이유로 환율은 1EKC = 1원으로 바뀌었다.2014
405,년 2월 16일 멤버 2명의 퇴출이 발표되었다.
406,"최머프는 방송 참여율이 떨어져 나가게 되었고, 스포는 멤버 간의 불화를 조장하여 나가게 되었다는 게 그 설명. 청천 벽력 같은 소식에 시청자들은 충 공 깽, 혼돈의 카오스. 다음 날 방송을 시작하고 최머프와 노가리 방송을 하면서 본인이 "" 전에 있었던 멤버들 간의 모 상황에 대해 오해가 있었고, 그 오해 때문에 감정이 격 해져 충동적으로 내린 결정이었다."
407,그 날 방송 종료 후 개인적인 고뇌와 멤 버들과의 대화로 오해를 풀고 생각이 달라졌다.
408,퇴출은 취소하고 몰래 카메라였다고
409,"치자"" 고 이야기하였다."
410,하지만 그전에 있었던 멤버 중 챌린지와 스포 간에 불화 설 또는 따돌림으로 인하여 챌린지가 멤버를 그만뒀다는 얘기도 있다.
411,"그러나 그날 마인 크래프트 방송 이후 2014년 2월 18일 새벽, 팬 카페를 통해 스포가 고정 멤버를 그만두겠다고 선언했다."
412,그 후에 가이 코가 방송에서 사건에 대해 말을 자주 바꾸는 바람에 시청자들한테 많은 혼란이 오기도 했다.
413,방송 진행할 때 퇴출이라고 통보한 것과 다르게 개인사정으로 탈퇴하는 것 같이 보였기 때문. 시청자들은 채팅 창에 물어봤으나 채팅 창 도배를 문제로 매니저들이 싸그리 벙어리를 주었다.
414,이후 팬 카페와 방송에서는 퇴출 관련 사항은 언급금지 수준에 이 르 렀 고 당시 복잡한 상황에 대한 정리가 매우 부족했다는 의견이 있다.
415,"또 한 멤버 탈퇴사건 당시 붐 붐 홈과 스포가 불화를 일으켜 시청자들이 걱정했지만 현재는 원만히 해결되어  관계가 회복됐고 스포는 2014년 7월, 최머프는 2015년 1 월부로 다시 가이 코 방송에 복귀해 다른 멤버들과 함께 방송을 진행하고 있다.2015"
416,"년 10월 22 일 붐 붐 홈, 로어 보이는 본인들이 개인생활에 집념하겠다는 이유로, 기단은 개인적인 일이 너무 바쁘고 방송 참여율이 저조해 자진 탈퇴하게 되었다고"
417,해 당 멤버들의 탈퇴를 발표하였다.
418,"그렇지만 탈퇴 멤버를 게 스트로 불러 멤버들과 함께 방송하는 모습을 보이다가 2016년 5월 11 일 붐 붐 홈이 멤버로 복귀했다가 얼마 못 가 또 다시 휴식기를 가졌고, 2017년 1월 11일에 다시 복귀했다."
419,또 한 로어 보이도 은근슬쩍 고정 멤버로 돌아왔다.
420,왠지 스포를 보는 것 같은 기분은 기분 탓이다.
421,"결국 이 탈퇴는 없던 것이 되었고, 로어 보이와 붐 붐 홈만 돌아온 걸로 아는 시청자들이 생기기 시작했다."
422,"기단은 군대로 인하여 다시 들어온 후에도 방참을 못한 것 이였고, 단체 팬 아트에도 자주 등장한다."
423,멤버 분: 기단이 는 고 멤 아니잖아!!
424,가이 코: 누가 기단이 가 고 멤 아 니래!! 기단이 나랑 노예계약 맺었 어!! 라고 컨텐츠 도중에 말한 적도 있다.2016
425,"년 8월 1일, 가이 코의 트위터로 김 블 로그의 퇴출이 먼저 공지되었고 [49] 방송국과 팬 카페에는 8월 2일에 공지되었다."
426,"경위는 7월 30 일경 김 블 로그 본인이 주변인 및 시청자들에게 긴 기간에 걸쳐 SNS 상으로 성희롱, 시청자 및 멤버 뒷담화, 멤버 사생활 폭로, 폭언 등이 정도를 넘어 섰다는 피해자들의 고발이 빗발치자 관계자들 간 회의를 통하여 김 블 로그를 퇴출한 것이다.8"
427,"월 2일 방송 콘텐츠 시작 전에 이 사건에 대해 안내했으며 김 블 로그의 문제이므로 다른 멤버들과 가이 코는 신경 쓰지 않기로 했고, 이후로는 언급하지 말아 달라고 부탁했다."
428,"이 사건에 대해 일부 사람들이 가이 코나 멤버 전체를 까 내리기도 했는데 김 블 로그 본인의 문제이므로 가이 코 및 가이 코 멤버 전체를 까 내리지 말자. 김 블 로그를 나쁘게 봤으면 나쁘게 봤지 옹호한 멤버는 없으며, 피해자들도 무고한 다른 멤버에게 영향이 가는 것을 원치 않았다."
429,"멤버 퇴출 이후, 김 블 로그 유 튜브 채널의 영상들은 전부 비공개상태이며 본인 방송국 역시 텅텅 비어 있다."
430,"하지만, 가이 코 유 튜브 채널의 동영상이 끝날 때 나오는 애니메이션에선 김 블 로그 캐릭터가 여전히 등장하고 있었다 (2016.9 .18 삭제) 가이 코 유 튜브 영상 설명 글에서 멤버 유 튜브 리스트에 김 블 로그가 포함되어 있었지만 이제는 김 블 로그가 사라지고 가이 코 본인만 등장하며 멤버 리스트에도 빠져 있다."
431,"사건 이후인 8월 8일, 오버 워치 방송 중에 갑자기 채팅에 나타나서 [50] 자신도 껴 주면 안되냐"
432,는 발언을 했다.
433,"그를 발견한 일부 시청자들이 인사를 보내자 다른 시청자들이 언급을 자제해 달라고 말했고, 김 블 로그는 ' 정규방송도 아닌데 '라고 대꾸했다."
434,그 이후 ' 심 심해 boy' 라는 채팅까지 친 걸로 보아 반성의 기미가 전혀 보이지 않았다고
435,한다.
436,물론 확실한 건 잘은 알 수 없으니 자세한 건 시간이 지난 뒤에 정황을 보는 것이 낫다.
437,"팬 카페 메인 공지에 걸려 있던 탈퇴 공지가 8월 8일, 일반 공지로 전환되었다."
438,[51] 10월 6일에 메인 공지로 다시 변했다.
439,그래도 사건 이후에는 오버 워치 방송 도중 난입해서 채팅을 친 모습 이후에는 반성한 듯 하여 다른 맴 버들과 오프라인으로 만난다는 소식으로 보아 선 합의가 어느 정도 된 것으로 보인다.
440,아래 카시와는 굉장히 다른 모습. 해당 항목 참고.
