,sentences
306,당연히 돈이 싫은 건 아니지만 필요한 만큼만 있으면 된다는 주의라고 한다.
307,사실 딱히 요구한 적도 없는데 IG 쪽에서 약간 봉급을 올려 주는 등 신경을 써 주긴 한 모양. [58] 다른 한국인 용병 선수들이 LCK보다 월등히 높은 연봉 때문에 LPL을 안 떠나는 것 [59 ]에 비해 더샤이는 방송 도중 한국에 돌아올 생각도 없지는 않다고
308,떡밥을 계속 던지는 것도 돈에 대한 큰 집착이 없어서 인 듯 하다. [60] 이 때문에 이적 시장에서 T1 같은 LCK의 대형 구단이 더샤이를 노린다는 찌라 시가 꽤 자주 돌아다닌다.
309,"다만 현재 한국에 있는 본가가 무려 3~4 층의 개인 주택이라고 밝힌 바 있는데, 생각보다 많이 안 받는다는 것 뿐이지 상당한 수준의 연봉을 받고 있거나, 본래 집안 자체가 꽤 부유한 듯 하다. [61] 여러모로 기부를 많이 하는 모양. 국내에 1억을 기부했고, 코로나 사태 때도 우 한에 기부했으며, 중국 내 유기 아동들에 대한 기부 활동에도 동참했다고"
310,한다.
311,이런 거 보면 본인의 부에는 별 관심이 없는 듯 싶다.
312,그리고 이러한 선행이 이어지며 한국 내에서도 여러모로 인정받고 있다.
313,"트위치에서 캡스가 잘할 때는 Claps( 박 수), 못할 때는 Craps( 쓰레기) 라 불리는 것처럼 더샤이는 못할 때 TheShyt 이라는 채팅이 도배되는 모습을 볼 수 있다."
314,칼바람 나락을 즐겨 하는 것 같다.
315,나루토 애니메이션에서 록 리와 마이트 가이가 같이 나이스가 이 포즈를 하는 장면이 있는데 중국의 리그 오브 레 전드 팬들이 그 장면을 너구리와 같이 롤 챔프로 변신하는 짤 로 만들어서 이로 인해 너 구' 리' 와 마이트 샤이라고 불리는 중이다.
316,"더 샤이 본인이 이를 아는지는 알 수 없으나, 마침 IG를 나간 재키 러브를 사스케에 빗 대어 나루토에 비유하는 밈 잔치가 일어나던 중국 현지에 선 선수 경기 전/ 후 인터뷰에 쓰일 정도였고 [62] 록 리로 나오는 너구리 본인도 이 밈을 알아서 인지 더샤이를 보고 가이 센 세라고 말하기도 했다."
317,이 밈이 공공연 연하게 쓰이다 보니 루 키가 더샤이에게 이 밈에 대해 알려줬다고
318,하니 본인도 알고 있는 듯하다.
319,이후 개인방송에서 ' 그 짤 봤다.
320,웃기더라
321,' 라고 하여 확인. 비슷한 시기 한국 롤 커뮤니티에서는 이상한 픽에 집착하는 더샤이와 그에 고통 받는 루 키가 일종의 밈으로 자리잡았다.
322,예시 구 글에 ' 승 록 아' 만 쳐도 따라해 봐 가 자동으로 나올 정도. 개인방송에서의 반응을 볼 때 본인도 이 밈을 잘 알고 있는 것으로 보인다.
323,본인 반응 2020 롤 드컵 4 강 전 쑤닝과 TES의 경기에서 객원 해설로 참여하였다.
324,"해 설진들과 IG 및 본인과 관련된 밈들을 주고받거나, 탑신 병자적인 코멘트로 시청자들에게 웃음을 주면서도 동시에 정식 해설들과 다르게 좋지 않은 플레이에는 돌 직구를 넣고 [63], 선수의 시각으로 집어내는 양질의 해설 내용으로 호평을 받았다."
325,경기 자체도 지루한 양상에 졸전이었다는 평가가 많아 ' 더 샤이 말할 때 외엔 졸았다' 는 이야기가 많을 정도 라 더욱 돋보였다.
326,"압권은 재키 러브가 던지고 죽을 때 "" 자주 저래서 별 감흥 없다."
327,"""라고 한 것과 밴 픽 과 판단에 대해 해설이 의견을 물어볼 때 "" 저도 이게 뭔지 잘 모르겠다."
328,"""라고 말한 것. [64] 롤 드컵에서 우승하는 것과 관련해 첫 번째 우승은 실력이 좋을 수도 있지만 그 상황이 운 일 수도 있기 때문에 두 번째 우승은 첫 번째 우승이 운이 아니었다는 걸 증명하는 것 같고 세 번째 우승은 진짜 자신이 실력이 있는 사람 임을 입증하는 것 같다고"
329,언급한 적이 있다.
330,같은 팀의 미드라 이너 루 키와의 관계가 매우 깊다.
331,"오죽하면 천문학적인 오퍼를 받았다는 루머가 돌았던 스토브 리그에서도 자신은 돈에 대한 욕심이 크지 않으며 팀이 마음에 들어서 IG에 남았고, 20 시즌 IG가 부진하고 더 샤이 본인도 프로 게이 머로 서 매너리즘에 빠진 듯한 모습을 보였고, 실제로 21 시즌엔 휴식을 고민한다는 뉘앙스의 말을 방송에서 한 적이 있었는데 곧바로 의 진이 형 (루 키) 이 내년이 마지막 일지도 모르니까 어지간하면 IG에서 마지막으로 뛸 것 같다 라는 말을 했다."
332,"더샤이가 루 키를 얼마나 신뢰하고 있는지 알 수 있는 부분. 실제로 루 키도 개인방송에서 더샤이에 대해 언급하며 "" 걔는 나한테 뭐라고 못한다."
333,내가 워낙에 잘해 주는 형이다.
334,"""라고 말하는 등, 신뢰를 드러내는 말을 했다.Q."
335,혹시 존경하거나 롤모델인 탑 라이너가 있는가?A.
336,더 샤이와 기인이 가장 잘한다고 생각하는데 그 중에서도 나는 더 샤이 쪽을 닮고 싶다.
337,상대 팀이 보는 것만으로도 상대가 압박을 느낀다 쵸 비 # 더 샤이 선수 플레이 보고 배우기도 하고(...) 더 샤이 선수는 1대 2를 정말 잘하더라구요.
338,갱이 오더라도 그 상황에서 대처 같은 게 정말 깔끔하게 잘하시더라구요.
339,1대 2를 자신 있게 잘하는 그런 능력 치가 진짜 뛰어난 것 같아요.
340,"너구리 #IG 경기를 보면 탑만 보고 있는데, 게임만 봐도 느껴져요."
341,아 잘하는구나
342,하고. 좀만 보다 보면 느껴져요.
343,뭔 가 데스도 많고 킬 도 나고 치고 박고 하는데 질 것 같지 가 않다?
344,그런 느낌을 받아요.
345,너구리 # 유럽 선수들 로부터 더샤이를 상대하는 이야기를 들어보면 거의 악몽이다.
346,아는 거의 모든 상성에서 한계를 알고 아슬아슬 한 플레이를 잘한다.
347,원 더 # 이 모든 혼돈 속에 살고 있는 최고의 선수 중에 하나인 것 같다.
348,모든 캐리 탑 솔 러들이 모두 그를 주시하며 쓰러 드릴 수 있을지 지켜보고 있다.
349,더블 리프트 # 더 샤이는 정말 1대 5를 할 수 있다.
350,베 티 # 그는 항상 팀을 패배 직전에서 되돌릴 수 있다.
351,그가 케넨이나 블라 디 미르 같은 챔피언을 할 때면 모두가 불가능하다고
352,"생각 하는 일을 해내는데, 그래서 내가 그와 플레이할 때는 대체 무슨 일이 일어나고 있는지 모른다는 느낌만 받는다."
353,바 오란 # 더 샤이 선수는 롤의 신인 것 같아요.
354,"롤을 너무 잘하는 것 같아요,"
355,"볼 때마다. 케리 아 #IG 는 G2를 믿을 수 없을 정도로 압도하며 3-0 우세를 가져왔고, 2018년 어느 팀이 가장 강력한 솔로 라이너들을 보유하고 있는 지에 대해서는 의심의 여지가 없다."
356,루 키와 더샤이는 완전히 다른 레벨에 존재하고 있다.Azael
357,라 이엇 캐스터 # (2018 년) 한 해 내내 제기된 질문은 누가 세계 최고의 탑 라이너라는 것이었다.
358,"칸, 스멥, 더 샤이. 그리고 여기 아직 살아남아 있는 사람이 바로 그 답이다.Raz"
359,전 LPL 해설 # 더 샤이는 사람일 리가 없다.
360,나는 이 합법 적인 리그 오브 레 전 드용 로봇이 어떻게 무대에 올라와 있는지 조사해 볼 걸 요청한다.Azael
361,라 이엇 캐스터 # 탑 라이너 중엔 ' 더 샤이' 강 승 록 선수가 정말 잘한다고 생각한다.
362,한계가 없는 느낌이다.
363,일단 들어가고 본다.
364,상대가 당황하는 순간 그 상대는 이미 망하기 시작한다.
365,임팩트 # 나는 직업 상 수많은 프로선수들을 만나는 입장이고 때문에 특정한 한 선수의 팬이 되는 일은 거의 없었다.
366,그러나 더 샤이는 다르다.
367,나는 더 샤이의 플레이를 보면서 사랑에 빠졌다.
368,야마 토 캐논 # (LPL 최고의 탑 3명을 뽑으라고 한다면?) 첫째는 더 샤이. 둘째는 더 샤이. 세 번째도 더샤이다 .랑 싱 # (IG 와의 결승전 대결을 앞두고) 솔직히 더샤이와 맞상대 하고 싶지 않았다.
369,내가 얻어 터질까 봐 두려워서 그렇다.
370,369와 대결하고 싶었다.
371,그가 상대라면 할 만 했을 것 같다.
372,"줌 #"" 내가 보기에 탑을 하는 모든 유저들은 더샤이가 되고 싶어 할 것 같다."
373,그런 데 결국은 렛 미가 되더라
374,"( 웃음). 샤이 형 자신이 세계 일등이라고 말하지는 않았지만, 만약 그가 자신이 세계 2등이라고 하면 누가 감히 자신을 세계 제일이라고 말할 수 있을까?"
375,""" 렛 미 # 한 타를 대승리 하며 'It 's Rookie and Theshy! '를 외쳤고 그때 머 릿 속에서는 우리가 루 키와 더샤이가 된 느낌이었다."
376,"우리가 스웨덴 더샤이와 스웨덴 루 키가 된 느낌을 받았고, 힘이 넘친다고 느낄 때 자신이 더샤이와 루 키가 된 기분이 된다.LEC"
377,"Rogue 탑 Finn과 미드 Larssen # 내가 상대하기 싫은 타입은 거의 대부분의 챔피언을 사용할 수 있는 선수들인데 예를 들자면 더샤이다. 리 븐 을 고를까, 루시안을 고를까?"
378,아니면 케일인가?
379,안절부절 할 수밖에 없다.
380,그는 자기가 원하는 건 뭐든지 선택할 수 있다.LEC
381,Fnatic 탑 브위 포 # 탑은 경기에서 중요하지 않다.
382,"더샤이를 만난다면 중요하겠지만. 가장 영향력이 적은 라인을 꼽는 LCS 프로 선수들 설문조사 중 나온 코멘트 #2020 년 10월 19일, 트위치에서 생존신고를 했고, 한국 팬들과 소통하기 위해 유 튜브를 개설했다."
383,"주 컨텐츠는 롤 챔피언 공략을 비롯한 게임 컨텐츠일 것이라고 하며, 간혹 자신의 취미인 피아노 등을 올릴 것이라고 공지했다."
384,중국어 베이스에 한국어와 영어를 섞은 기묘한 언어를 사용하면서 방송을 진행하며 광대 그 자체인 모습을 보이고 있다.
385,"# 해당 채널에는 내가 저거 들고 탑 가면 안될 거 같은데 탑 솔로 등장하는 별의 별 챔피언들이 수두룩하며 [43], 시청자들은 송형 드립을 치고 있다."
386,"방송에서는 중국어는 거의 사용하지 않는데 [44] 어찌어찌 알고 찾아온 중국 팬들도 꽤 있는지 방송 시 채팅, 유 튜브 덧글에서 중국어도 볼 수 있다."
387,"방송에서 게임을 하던 도중 스트리밍을 한다는 걸 알게 된 팀원이 이름이 뭐냐고 물어봤는데, 이 때 더샤이라는 대답을 듣고 믿지 못하자 사실 ' 그릴라 뿜빰' 이라는 이름으로 방송을 한다고 채팅을 친 것이 원인이 되어 제 2의 이름으로 불리고 있다."
388,"[45] 중국에선 후야 TV로 송출하는데, 대륙이다 보니 시청자가 백만 단위에 하루에 도 네이션이 수십만 위안( 한국 돈 수천만원) 터진다고 한다."
389,"앞서 말한 것처럼 워낙 이상한 챔프들 로 탑을 가다 보니 루시안, 칼리스타 같은 기존(?) 탑 챔프들은 아예 국밥 챔으로 불리고 있고 오른으로는 초 공격적인 플레이로 상대 탑을 박살 내다보니 채팅 창엔 ' 칼 챔' 이라는 반응이 도배된다."
390,유 튜브 개설 이후 구독자 10만명 달성 기념 Q&A를 진행하였으며 11월 29일에는 10만명 기념 썸 썸 편의점 엔딩을 봤다!
391,방 예나 루트로 장장 7 시간의 대장정 끝에 성공했으며 더샤이의 과 몰입과 트수들의 드립 [46] 이 콜라보를 이루며 성황리에 막을 내렸다.
392,유 튜브에 올라온 7 시간 풀 영상
