,sentences
312,개리 형이 방송을 쉬고 나서 복귀할 때 괴물 쥐도 같이 쉬었다가 복귀를 하던 참 이어서 같이 복귀하면서 듀오를 했다 개리 형의 마스터 승격 전에서 상대로 만나기도 했다.
313,나라 카 일개 리 형과 듀오를 진행한 최강 미드 라이너 BJ. 전적은 아쉽게도 1승 2 패이나 명성에 맞게 엄청난 플레이를 선보였다.
314,"당시 플레이한 챔피언은 나라 카 일의 시 그니 처 픽 이었던 사일 러스, 제 이스, 아지 르. 칸 개리 형 유 튜브 누적 조 회수 2위 (2020-11-09 기준 228만) 의 주인공 이자 개리 형의 인지도를 높여 준, 개리 형 본인 피 셜 유 튜브 성장의 1등 공신. 2020년 11월 7 일자 마침내 듀오를 성사시켰다."
315,"시간 부족 등으로 봇 듀오 한판, 칸이 미드 루시안 한판으로 총 두 판밖에 플레이하지 못했다."
316,개리 형이 처음으로 개최한 장인대전이다.
317,"패치 버전은 9.23이며, 하이퍼 X가 메인 스폰서로 참여했다."
318,"개리 형이 2 번째로 개최한 장인대전으로, 2021년 1월 4일과 1월 5일 총 이틀에 걸쳐 진행했다."
319,"패치 버전은 10.24b 이며, 어 그로가 메인 스폰서로 참여했다."
320,또 한 이야
321,"공, 현 솔, 개인 팟, 익산 누 누, 헤 이스트, 캐인, 빵 재는 지난 장인대전에 이어 이번에도 참가했다."
