,sentences
167,"이전 년도 랜 파고 이후 매번 토스 전은 잘 했으나 대회 직전 보혜에게 0:4 로 패배한 점이 마음에 걸렸는데, 조커 최강 자인 랜딩을 확실히 이기기 위해 허 진석은 전진 게이트 초반 날 빌 전략과 가스 러시 전략을 썼고, 그 동안 겪어 보지 않은 날빌에 당황한 랜딩은 투배럭을 올렸으나 질럿도 늦게 제거되고 마린 사업도 이루어지지 않고 벙커도 늦게 박아 몰아치는 허 진석의 병력에 의해 결국 GG를 선언하였다."
168,가스 러시를 당했으면 역으로 치즈 러시를 가거나 가스통을 빨리 깨는 게 중요했음에도 몰아치는 질럿에 당황해서 그렇게 된 것으로 보인다.
169,다만 2:2 팀 밀리에서는 나머지 멤버와 잘 협력해서 이겼다.
170,다행히 팀은 4:2 로 이겨서 멸망 전 두 번째 결승에 진출하게 되었다.
171,랜딩은 결승에서 하얀 눈길과 붙었는데 지지난 시즌 결승과 달리 이번에는 하얀 눈길도 만만치 않았다.
172,"하얀 눈길이 생 더블, 랜딩은 배럭더블로 시작하였는데 랜딩이 빌 드의 불리함을 좁히기 위해 본인의 특기인 드랍쉽 견제를 시도하였으나 하얀 눈길이 무난하게 막았으며 재차 들어오는 견제도 적절하게 커트하는데 성공하여 유리함을 가져왔다."
173,그러나 하얀 눈길이 병력 물량 차이를 믿고 끝내기 타이밍 러 쉬를 시도하였으나 스테이 시스 필드를 뒷쪽 탱크가 아닌 앞쪽 탱크에 쓴 것이 셀프 길 막을 하여 병력을 모조리 헌납하였고 승기가 완벽하게 랜딩 쪽으로 기울게 되었다.
174,하지만 랜딩도 무리하게 끝내기를 시도 하다가 탱크를 잃게 되면서 다시 격차가 좁혀 졌으며 하얀 눈길의 회 심의 2 연속 리콜 파상공세로 하얀 눈길의 병력이 본진에 떨어지는 동시에 4 커맨드를 병력으로 파괴하는데 성공하였다.
175,결국 랜딩이 gg를 선언하였다.
176,"다만 그 다음 경기 팀 밀리에서 남 덕 선과 함께 보 혜, 하얀 눈길 쪽 본진을 엘리 시켰으며 김 택용, 최호선네도 이 영호, 전 태양 네 언덕을 장악하여 승리를 얻었다."
177,결국 팀이 4:2 로 우승했다.
178,"랜딩, 김 택용은 멸망 전 출전 2번 우승하게 되었다.89E"
179,스포츠 팀 수장이다.
180,처음에 랜딩을 뽑으면서 염 보성에게 배운 게 그거밖에 안되냐고 하니 본인은 그 새끼가 알려주다가 군대로 갔어요라고 유쾌하게 받아쳤다.
181,랜딩이 스크림 전에서 민 찬기의 랠리를 지적하자 끝나고 빡찬기를 유도해 웃기기도. 2020년 늙은 E 스포츠 때도 김 택용의 픽업으로 참가하였다.
182,이 과정에서 ASL S10 24 강 광 탈을 디 스당
183,"한 건 겸. 오 메 킴도 그렇지만 본인도 89E 스포츠끼리 모이고 싶어 하는데 김 택용이 소극적이 여서, 나중에 모이자고"
184,하는 김 택용보고 입 벌 구라고 하기도 한다.
185,스타를 처음에 애 공보다 못했으나 알파고 특 훈 이후 이겼다고
186,한다 대배우 앞에서 입담을 뽐내는 포스 나는 빡찬기야 빡이라고 불러. 어 빡 아. 어감이 그렇네.
187,어 빡 아 빡딩 디스코 드조합이 정말 찰지다.89e
188,"스포츠 팀, 빡 치면 브신다 등 멸망 전을 두 번 연속 같이 하고 있다."
