,sentences
207,미몽 멤버인지 몰랐는데 어느 순간 멤버가 되어 있었다고
208,한다.
209,현재는 멤버가 아니다.
210,당시 뚜 띠와 러브라인이 있었다.
211,손등 여성 멤버이다.
212,비 안 여성 멤버이다.
213,위의 손등과 같이 정보가 잘 없다.
214,김 리틀 멤버는 아니다.
215,컨텐츠에서 사회자를 맡았다.
216,지 누( 現 감 블러 )2014 년 램 램의 방송에 출연했었던 전 멤버(?) 공식적으로는 멤버로 활동한 적이 없다.
217,공식 멤버였던 삐 부보다 출연 횟수가 많다 실제로 방송에 출연한 빈도는 매우 적으며 인원 보충을 위해 출연한 것이 대부분이다.
218,현재 트위치와 유 튜브에서 활발한 활동을 이어 나가고 있다.
219,불사신 아내 스승의 날 학교 상황 극 강도 상황 극 모텔에서의 하루 [24] 냄새 왕 쫀 득 식인종이 사는 무인도 상황 극층 간 소음 상황 극 인성병원 상황 극 퇴 마사 상황 극학교 시리즈 상황 극 : 이건 매주 일요일 7시에 한다.
220,많이 우려 먹었다(...) 램 램 말로는 20편까지... 사골 국부 산행 패러디 울산 행 초등학교 상황 극 터널 상황 극 주차전쟁 상황 극유희 왕 상황 극 포켓 몬 상황 극 초강력 뱀파이어 상황 극 살인자 혼 내 주기 상황 극 슬 랜 더 맨 상황 극학교폭력 하는 친구 복수 상황 극 도쿄 구울 모드 포켓 몬 모드웅이 모드 사막 여행 모드에 일리 언 모드 돌연변이 모 드하 이브 모드 진격의 돼지 모드 디지몬 모드 마인 스크롤 모드 멤버 꼬예유의 자작 모드 원 펀 맨 모드 정신이상 모드 슈퍼를 지켜라!
221,"원피스 특집 : 2016년 1월 14일부터 램 램 TV 최초로 공갈, 이윤 열, 양배추, 김에 카 이 4명의 BJ 와 장기 컨텐츠 방송을 시작했다."
222,애니 노래와 명대사를 맞춰 라! 전설의 레 전 드프리 즌 브레이크 특집 천사 vs 악마 럭키 블럭 현실 모드 : 조합 특집능력 찾아 삼만 리 : 프라이머리 특집 프로젝트 X 모태 솔로 수용소 : 일기 특집 뱀파이어 나이트 죽음의 투표 서 바이 벌 3.1 운동 독립 투사 특집 THE LEVEL : ALL KILL! 럭키 블럭 현실 모드 : 어 쌔신 크리 드더 테러 라이브현실 모드 : 우주 전쟁 편 THE LEVEL : 대 해적 닌 자시대 천공대전 꽃전쟁 공포 특집 램 램 놀래키기! 악마의 열매 특집 잃어버린 보물을 찾아서! 램 어웨이 탈출 맵배 틀 로얄 서 바이 벌 기생도 양털을 찾아라!
223,톰과 제리 악마의 열매 서 바이 벌 원피스 룰렛: 랜덤 열매능력 찾아 우주로 러 시안 룰렛 달걀 도박 전쟁 초능력 술래잡기능력 찾아 삼만 리 추 노 눈치를 보며 침투하기! 하늘에서 핵이 떨어져 요목 욕탕 물을 막아라!도
224,플 갱어 강화게임 : 맵을 몇 번이나 바꾸었다고
225,한다.
226,빙고게임 도둑들 경찰과 해커 마법의 숲요리 킹 조리 킹 인 타임 폭풍의 증권 시장 신들의 전쟁 어택게임 배달의 민족 파 오캐 서 바이 벌 시한 폭탄 서 바이 벌 The Summer : 더위 특집 넥서스 뿌시기! 쓰레기를 버려 라! 미니 슈퍼를 지켜라!
227,천공 대전 분신 사냥현실 모드 서 바이 벌 능력자 서 바이 벌! 브금 술래잡기 드래곤 vs 인간 캐치 마인드 암살자 데 바데( 데드 바이 데이 라이트 공포의 섬) 하늘에서 메테 오가 떨어져요.
