,sentences
0,트위치에서 주로 게임 방송을 하고 있는 스트 리머 이자 샌 드박스 네트워크 소속 크리에 이 터이다.
1,"트위치에서 하는 모든 게임은 유 튜브에 올리지 않으며, 다시 보기도 남겨 놓지 않는다."
2,"주로 하는 게임은 마인 크래프트. 가끔 씩 게 리 모드, 바인딩 오브 아이 작, 겟앰프드, GTA 5 등을 멤 버들과 플레이한다."
3,방송은 2011년 8월 1일에 시작했으며 [12] 유 튜브도 꾸준히 운영하고 있다.
4,[13] 현재는 거의 마인 크래프트만 한다.
5,"평일에는 4~5 시 사이에, 주말에는 9~10 시 사이에 유 튜브 영상이 올라오며 방학 시즌엔 이 보다 빠른 시간에 업 로드 된다."
6,방학 시즌엔 위에 나온 시간보다 빠른 시간에 업 로드 된다.2016
7,"년 2월 25일 아프리카 TV 파트너 BJ가 되었고, 얼마 되지 않아 3월 초에 샌 드박스 네트워크의 크리에 이 터가 되었지만 2017년 2월 29일 아프리카를 떠나게 되었다."
8,거주지는 인천광역시이다.
9,광명에서 살다가 2020년 인천에서 자취를 시작했다.
10,실제로 광명에서 유명한 게 뭐 있냐고 물어본 시청자의 질문에 램 램 이요 라고 대답한 적이 있다.
11,멤버인 늑도 광명에 산다.
12,팬 닉으로는 ^-^ ♡를 사용하고 있다.
13,"예전 매니저가 만들어 줬으며, 팬닉이 길다는 말에 새로운 팬닉으로 바꿨으나 다른 분과 겹쳐서 다시 원래 쓰던 걸로 했다."
14,"과거 아프리카 TV 시절에는 유목민, 트위치에서는 빵모자 단 등등 여러 애칭이 있었으나 최근 트위치 방송에서 팬 애칭이 램프가 되었다."
15,트위치에서 매주 주말마다 생방송을 진행하고 있으며 가끔 평일에도 켠다.
16,방송의 시작을 알리기 위해 카 톡 오픈 채팅 방도 만들었다.
17,"그 곳에서는 오로지 램 램만 채팅을 칠 수 있으며, 다른 시청자가 치는 건 금지되어 있고 이를 어길 시 강 퇴를 당하게 된다."
18,램 램의 유 튜브는 현재 저 연령층을 타깃으로 두고 꾸려 나가고 있다.
19,"그래서 옛날 영상들 중 수위가 조금 있거나 욕이 있는 건 다 삭제하거나, 비공개로 돌렸다."
20,[14] 이에 대해 옛날 팬들은 재미를 잃었다며 얘기를 했지만 영상이 삭제됐을 때 총 조 회수는 별로 낮아 지지 않았다고
21,말했다.
22,저 연령층을 타깃으로 두니 유 튜브 댓 글에 악플과 욕이 줄어 좋다고
23,말했다.
24,확실히 엄청 줄었다.
25,이제 케이블 TV에서도 램 램 TV를 만날 수 있다.
26,매 회 차마다 인트로가 다 다르고 시즌 1은 26회로 구성되어 있다.
27,케이블 TV 외에 옥수수 TV 어플에서도 볼 수 있다.
28,방송 초창기엔 gta4 와 게 리 모드를 하였다.
29,"예전에 비 욘 세 TV에서 비 욘 세, 장파, 두 칠, 토비 마루, 이 윰, 페럴, 뽑호쪼 옥, 채린 등과 같은 사람들과 클럽에 있기도 했지만, 국장이 던 비욘세가 돌연 클럽을 해체하고 잠수를 타며 와해되었다."
30,흔히 방송에서 말하는 영재클럽이 이 시절이다.2017
31,년 2월 26 일부로 아프리카 TV를 떠나게 됐다.
32,새롭게 방송할 플랫폼은 유 튜브. 멤버들의 변경은 없고 방송시간도 비슷할 것이라고 하나 일주일에 1~2 번만 방송할 예정이라고 한다.
33,하지만 현재 건강문제와 더불어 멤버들이 바빠서 한 달에 1번 방송을 할까 말까 한다.
34,그 때문에 카페 활동도 뜸하다.
35,멤 버들과 램 램은 과거에 비해 카페를 방문하는 횟수가 줄었고 카페에는 하루에 글 3~4 개가 최대이며 현재 카페 등급은 계속 하락 중이다.
36,램 램 말에 의하면 카페보단 트위치 트게 더를 더 자주 확인한다고 했다.
37,"트게더에 댓 글도 달고, 방송에서도 가끔 노가리를 까며 트게 더를 확인한다."
38,아쉽게도 올라오는 글이 그리 많지 않지만 꾸준히 글을 올리는 사람들은 있다 시청자들의 트게 더를 확인하냐
39,는 질문에 확인은 하지만 부끄러워서 글을 못 쓴다고 했다.
40,"최근 트게 더 와 카페를 확인하지 않는 걸로 알고 있는 사람들이 많은데, 램 램은 매일 트게 더 와 카페를 확인한다고 한다."
41,"댓 글을 달지 않을 뿐, 매일 매일 확인하고 어떠한 불특정한 게시 글에 랜덤으로 댓 글을 다는 것이 자주 목격된다."
42,과거의 애청자들을 생각해 준 것인지 가끔 씩 트위치 스트리밍을 멤버들과 해 준다.
43,그는 방송에서 시청자들을 아끼고 사랑하는 마음이 한눈에 보인다.
44,평소 귀염 둥이라며 2018년 4월 초에 유 튜브나 트위치 방송에서 시청자들에게 “ 사랑합니다
45,” 라는 말을 자주 한다.
46,시청자들은 시청자를 까는 것과 자기애가 강한 램 램의 행동을 재밌어 하고 좋아한다.
47,"[15] 램 램은 시청자의 “?” 채팅에 희열감을 느끼는 듯 하고, 시청자는 램 램을 괴롭히는 것과 램 램이 시청자를 까는 것에 희열감을 느끼는 것 같다."
48,"램 램은 "" 아마도"" 라는 말이 거슬린다고 했으며, 본인은 시청자들을 사랑한다고 했다."
49,"공포게임을 한 적이 있지만 램 램은 귀신의 등장 소리보단 트위치 후원 소리, 팔로 우 소리에 더 놀랐으며, 귀신을 농락하며 겁 없는 모습을 보여줘 팬들이 슬퍼하자 한 박자 느리게 ‘' 끼요 옷~!”, ” 끼야 악~!” 이라며 소리를 질러 놀라는 척 하는 모습을 보여줬다."
50,그리고 그는 귀신에게 훈수와 꾸중을 뒀다.
51,"램 램은 2018년 4월, 5월에 방송을 10일, 또는 20일에 한 번 씩 켰었다."
52,"그 때문에 간혹 몇몇 시청자들은 방 종할 때 10일 씩 추가하며 "" 며칠 뒤에 봐요"
53,""" 라는 채팅을 남긴다.2018"
54,년 6월 18 일 램 램은 생일이 끝나기 약 1시간 전에 방송을 켰으며 원래는 생일 날 키면 너무 속물적으로 보일까 봐 안 키려고 했지만 한 트위치 클립을 보고 키기로 마음 먹었다고
55,했다.
56,"이 날 램 램은 방 종하기 전, 욕해 달라는 시청자들의 요구에 욕을 귀엽게 순화시켜서 했다."
57,"램 램은 26일 동안 방송을 켜지 않아 시청자 애를 태웠으며, 방송을 키고 안 킨 날짜를 확인한 뒤 30일 못 채워서 아쉽다는 듣던 시청자 피를 말리다 못해 남김없이 태워 증발시키는 소리를 했다."
58,현재 램 램은 한 시청자의 말에 의하면 바쁘다는 이유로 방송을 몇 달 간 못 키고 있다고
59,트게더에 글을 썼었다.
60,"램 램의 방송은 이제 한 달에 한번씩 켜기로 정해졌었지만 계절에 한번씩 키자고 장난 식으로 말을 했다, 장난이 아닌 것 같다."
61,하지만 심심하거나 방송용 물품들을 살 때 아주 짧게 나 마 방송을 켠다.
62,"최근 램 램은 방송에 좀 더 힘을 써 보고 싶다며 일주일에 한번, 많게는 2~3 번을 켠다.2019"
63,"년 3월 3일에는 쫀 득, 늑, 뿡이, 칸 쵸, 자 칼, ( 잠깐 출현한 빵 떡) 과 함께 합방을 했지만 램 램은 "" 이젠 내가 쫀 득을 기다려야 해"" 라며 램 램은 장난 식으로 쫀 득이 불편 하다고 했다."
64,유 튜브 램 램 TV는 키즈 존이지만 트위치 램 램_ 은 노 키즈 존이다.
65,트위치 생방송 중 키즈가 들어오면 램 램이 쫒 아 낸다.
66,진짜다.2019
67,"년 4월 6일 컴퓨터 문제로 1 시간 반정도 하고 방종, 램 램은 미안 하다며 평일 오전에 한번 켜겠다고"
68,약속했지만 역시나 램 램이 램 램했다.
69,그는 오지 않았다... 램 램은 유 튜브에서 초보 vs 고수를 찍을 때마다 초보 역을 맡은 게 연기가 아니라 찐 인 것 같다.
70,"램 램은 방송에서 마크를 하며 울타리, 색 입힌 유리, 등등 만드는 법을 몰라 패스를 했으며, 주민에게 뚜들겨 맞았다."
71,"내다 버린 8년 2019년 5월 31일 수 빈 님 외 자 칼님, 늑 님, 시청자 분들과 마크를 했다."
72,야생을 하려 했지만 다이 아가 나오지 않아 중간에 치트를 써 망해 버려 시청자가 만든 집을 구경했다.
73,방송을 시작하게 된 이유는 수 빈 이 매일 밤마다 옛날 영상을 램 램 카톡에 보내며 ' 옛날이 그리워 ㅠㅠ '라고 매일 보내서 방송을 켰다고
74,한다.
75,최근 트위치 방송인 친구들이 조금씩 생기며 방송을 옛날보다 조금 더 자주 킨다.2017
76,년 초 램 램 TV의 플랫폼 변경 이후 접점이 사라졌던 램 램 TV 멤버들이 모이면서 램 램이 만든 디스 코드 채널. 상주하는 인원은 다음과 같다.
77,램 램 김 뚜 띠 쫀 득 늑 김 뿡 김자 칼 러브 새 키한 예찬 규호( 現 곽 두 팔) 이 사람은 멤버가 아닌데?
78,김자 칼 [23] 생방송 GTA 등에 참여한다.
79,램 램 TV 대표 노예이다.
80,방송 안에서도 도움을 많이 주기에 사실상 고정 맴 버라 봐도 무방할 수준. 개인 유 튜브에서 옛날 램 램 tv 영상들과 램 램 트위치 방송 분등을 편집 중이다.
81,유 튜브 트위 치에서 개인 방송을 진행하고 있으며 가끔 씩 램 램 트위치 생방송에 채팅으로 참여한다.
82,트위치 TV에 힘 노농이 램 램 TV의 대표 건축담당. 어 그로 성 제목과 썸 네 일 유 튜브 영상에서 어 그로를 끌기 위한 자극적인 내용의 썸 네 일과 제목을 자주 이용하며 댓 글에도 이를 껄끄럽게 여기는 사람들이 많다.
83,"[25] 예시 1, 예시 2, 예시 3 표 절 의심 외국 유튜버들의 영상이나 영상 썸 네 일을 표절했다는 의견이 있다."
84,"[26] [27] 예시 1( 물 감옥 함정, 내용) - 램 램, cubey, 예시 2( 동물과 몬스터가 죽으면 가는 곳, 썸 네 일) - 램 램, orepros, 예시 3( 친구를 괴롭히는 방법, 내용과 썸 내일) - 램 램, Grian 비트 코 인이 한창 유행하던 시절 천만원 이상 날렸다고"
85,한다.
86,방송에서 원금 800이 몇 십만원으로 변한 걸 공개하자 시청자들에게 많은 놀림을 받았으나 이건 일부라고 다른 곳에 더 있다고
87,밝혔다... 멤버들의 말을 잘 못 알아듣는 경향이 있다.
88,"나이 들어서 그래 한때 아주 짧게 친 램 램 파와 반 램 램 파로 나눠 져 나무 위 키 수정전쟁이 일어났었으며, 그 장면이 라이브로 보여 졌었던 적이 아주 짧게 있었다."
89,"몸상태가 더 안 좋아진 램 램은 피티도 끊고 [28], 싫어하던 과일들도 몸 건강을 위해 억지로 먹고 있다고"
90,했으며 방송에서 파인애플을 먹는 모습을 보여줬다.
91,초등학교 때 굉장히 악동이었던 것 같다.
92,"수업시간에 걸려서 선생님이 나오라 고 했는데, 선생님이 학생의 잘못은 잘못 가르친 선생의 잘못이라며 손을 내밀었고, 순수했던 램 램은 선생님을 회초리로 무자비하게 때렸다고.."
93,편식도 심했던 듯 하다. 미역국에 홍합이 싫어서 요구르트에 홍합을 모두 걸러서 넣었는데 걸려서 선생님이 다 먹였다고..
94,야인 시대 놀이를 한다며 오야 붕 거리면서 애들을 치고 다니다가 혼났다고
95,한다.
96,아주 오래 전 캠 방을 한 적 있다.
97,2016년 광주 웹 콘텐츠 페스티벌에서 빨간 머리에 마스크까지 쓰고 멤버들과 함께 공식 석상에 등장한 적도 있다.
98,"검정 고무신에 나오는 여자 캐릭터를 모아 이상형 월드컵을 한 적이 있었는데, 놀랍게도 램 램의 이상형은 ( 암 컷) 방아 깨비 [29] 였다."
99,혹시 라도 나중에 램 램을 꼬실 계획이 있다면 이 점을 참고하자. 램 램의 특이한 취향에 시청자 대부분이 경악을 금 추지 못하였다.
100,2020년 인천 이사 이후 집을 두채 사용한다.
101,스튜디오로 사용하는 집과 생활을 위한 집으로 둘 다 월세라고... Minecraft Live 2020에 인사말을 남겼다.
102,"# 최근 들어 타 스트 리머들의 트위치 생방송에서 자주 모습이 보이고 있는데, 우연히 배그 합방을 했던 실프와 친해진 후 실프에 김 뿡, 탬 탬버린과 배그 합방을 하다 처음 만난 당일에 급속도로 친해진 탬 탬버린이 합방 멤버 로 램 램을 자주 초대하고 자신의 오랜 지인 스트 리머들 과도 이어 주었으며, 그 중 한 명인 지 누도 최근 합방 멤버 로 램 램을 부를 때가 많아서 여기저기 신나게 초청 받고 있는 중이며, 매번 합방에 참여할 때마다 엄청난 예능 감을 선보이고 있는 중. 행복 방 멤버들이 트위치에서 열심히 방송하는 모습을 보여줄 때마다 멤버들의 채널들을 하나하나씩 전부 신고하고 다닌다고 밝혔다(..) 말은 이렇게 하지만 사실 그 누구보다도 멤버들을 아끼는 츤 데 레 맏형이다.2021"
103,"년 새해를 맞아 방송을 켰는데, 본인 나이에 본인보다 한두 살 어린 멤버들과 겟앰프드를 즐기는 것을 매우 쪽팔려 하며 겟앰프드를 끊을 나이가 되었다고"
104,본인 입으로 선언하였다.
105,개구 라 날짜 간격상 세 내용 2018년 2월 15일 첫 생 방 2018년 x 월 xx 일방송을 켰음 2018년 6월 18 일 램 램 생일 2018년 x 월 xx 일방송을 켰음 2018년 x 월 xx 일 1 달에 한 번 씩 방송 2018년 x 월 xx 일한 주에 2-3 회 방송 201x 년 x 월 xx 일한 주에 1회 방송 2019년 4월 20일 7 일 램 램의 직업은 배우다 2019년 4월 27일 7일 아이작을 1시간 반을 넘게 했다 2019년 5월 5일 8일 똥 겜하다가 컴퓨터가 튕겨 방송이 꺼졌다가 노가리 방송을 짧게 한 뒤 다시 보기 영상도 지웠다 2019년 5월 18일 13일 5월 달은 바쁘다며 2주 만에 켰고 잘 못하는 배 그를 했다 2019년 5월 24일 6일 토요일에 약속이 있다며 방송을 켰으며 마크를 했다.
106,[16 ]2019 년 5월 31일 7일 추억에 젖은 수 빈 [17] 의 요청에 일찍 방송을 켰다.2019
107,년 6월 7일 7일 몸 상태가 좋지 않았지만 일주일에 한번하는 방송인지라 켰다고
108,한다.
109,썸 네 일을 만드는 방송을 했다.2019
110,년 6월 15일 6일 시청자들과 마크를 했으며 늑과 빵 떡은 약 3시간 동안 경보를 했다.2019
111,년 6월 22일 7일 11시 쯤 방송을 켰으며 노가리 방송을 하다가 마크를 했다.2019
112,년 7월 5일 13 일 저번 주 방송은 개인 사정으로 쉬었으며 2주 만의 방송에서 노가리를 깠다.2019
113,년 7월 29일 24일 그동안 아파 방송을 못 켜 월요일 낮방송을 했다.2019
114,"년 8월 25일 27일 그동안 바빠 방송을 켜지 못해 오늘 근황 방송, 생존신고 방송을 짧게 했다.2019"
115,년 9월 8일 14일 생각 외로 일찍 방송을 켰으며 마크 랠름 서버 뚜 띠의 모 티 서버에 들어가 마
116,크를 했다.
117,"그는 추석 때 방송을 한번 더 켠다고 했지만, 역시나 켜지 않았다.2019"
118,년 11월 10 일약 2 달 생존신고 겸 방송을 짧게 켰다.2019
119,년 11월 14일 4일 전 방송 때 녹화할 탈출 맵을 보내주면 방송을 키겠다고
120,말했다가 진짜로 맵을 보내주셔서 방송을 켰다.2019
121,년 11월 17일 3 일방송을 날로 먹으려 다 꽤 많은 사건들이 일어났다.
122,춘 향님께 차인 날 2019년 11월 23일 6일 잠을 깨기 위해 켰다.
123,최근 트위치 방송인 친구들이 조금 생겨 내일 11월 24 일 합방을 하기로 했다.2019
124,"년 11월 24일 1일 이날 합방을 하기로 했으나 윤 설의 김장으로 인해 파토 난 합방을 규식, 땡 지, 애 덕과 함께 마크로 재판했다."
125,재판이 끝난 후 자 칼과 함께 GTA를 플레이했다.2019
126,"년 11월 29일 5일 목요일에 있었던 무노, 뚜 띠, 쫀 득, 자 칼, 예 유, 김 뿡, 늑 과의 현실 합방 썰을 풀었다.5"
127,차까지 달렸다고
128,한다.
129,이 만남으로 어색했던 사람들과 다시 친분이 깊어진 듯하다.
130,그리고 샌 드박스 파티에 갈 의사가 있음을 밝히고 쫀 득의 팬 미팅에 온다고 한다.
131,- 쫀 득: 차라리 램님 팬 미팅을 하세요- 그리고 방송 도중 강 지의 깜짝 등장으로 둘의 예전 친분을 확인하며 디 코 아이디도 교환했다고
132,한다.
133,강지가 초면에 얼굴을 그려 주었으며 개새끼야 라고 카 톡도 했다.2019
134,"년 12월 8일 9일 과거 램 램 tv 최고 전성기를 함께 했던 멤버들( 뚜 띠, 쫀 득, 김 뿡, 늑, 김자 칼, 꼬예 유, 러브 새 키) 과 오랜만에 GTA5 합방을 진행하여 레 전드 방송을 기록하게 되었다 [18]. 24 시간 방송을 건 레이스에서 모두가 힘을 합쳐 램 램을 방해하였고, 결국 24시간 벌칙에 걸리게 되었다."
135,이후 사다리 타기로 함께 할 사람을 고르지만 김 뿡( 김 뿡) 과 동시에 자신의 방송시간을 12 시간 늘려 버려 36 시간 방송 [19] 을 기약하게 되었다고
136,한다.
137,"2부 겟엠에서는 4 명의 후보( 김 뿡, 쫀 득, 뚜 띠 *2) 중 김 재현과 김 뚜 띠 2번 걸려 12 시간을 걸리며 큰 웃음을 자아내기도 하였다.2019"
138,"년 12월 13일 5일 3년 만에 참석한 샌 드박스 파티에 대한 썰을 푸는 방송을 진행함. 샌 드박스 파티 이후 감 블러, 김 뚜 띠, 실 프, 막이 마기, 김 뿡, 삐 부, 꼬예 유, 꽃 핀과 함께 한 어색했던 썰을 풀며 실프와의 케 미(? )를 보이며 "" 광명 포테이토 남"" 이라는 별명을 가지게 되었다.2019"
139,년 12월 14일 1 일방송을 시작하고 잠시 썰을 풀고 컨텐츠를 시작하였는데 방송에 문제가 생겨 리 방을 하였다.
140,"오랜만에 뚜 띠, 쫀 득, 김 뿡, 늑, 김자 칼, 꼬예 유와 "" 양털을 찾아라"
141,"""를 bj 버프 없이 마인 크래프트 합방을 진행하였다."
142,"2부로는 야생 능력자를, 3부로는 겟엠프드 [20 ]를 하며 과거의 램 램 tv와 같은 진행 순서로 추억을 떠올릴 수 있는 방송이었다.2020"
143,년 1월 5일 25 일러 끼님 과의 마인 크래프트 합방을 한 날. 전날 러 끼님과 램 램의 의사소통에 문제가 생겨 마인 크래프트 스카이 블럭을 진행하게 되었다고
144,한다.
145,[21] 마인 크래프트 크리에 이 터의 면모를 보여주려고 하다가 코 블 스톤 생성기를 만들지 못하여 과거 멤버의 중요성을 깨달은 하루가 되었다고
146,한다.
147,"[22 ]2020 년 1월 16일 11일 노가리를 까다가 자신만만하게 아이 작을 30분 내에 깬다 선언하고 아이 작 켠 왕을 하였으나, 결국 약 1시간 만에 빡 종했다.2020"
148,년 3월 16일 61일 인천에서 자취를 시작했다.
149,"그리고 방송에 민 결희 님이 찾아와 꼬예 유, 민 결희 님과 통화를 했다.2020"
150,년 3월 28일 12일 노가리를 깠다.2020
151,년 5월 2일 36일 짧게 방송을 했다.2020
152,년 5월 10일 8일 바쁘지만 시청자들이 보고 싶어 방송을 짧게 했다.2020
153,년 7월 18일 70일 내일 7월 19 일 합방이 있어 방송을 켰다.2020
154,"년 7월 19일 1일 쫀 득, 김 뿡, 실 프, 지 누, 꽃 핀, 탬 탬버린과 TV 전쟁 마인 크래프트 꼬리 잡기 합방을 진행했다."
155,쫀 득에게 탈락당해 호스팅을 하고 방종했다.
156,이후 탬 탬버린 과의 롤 1:1 공포게임 내기를 진행하기로 해 방송을 켰으나 화면 설정 방법을 몰라 탬 탬버린에게 호스팅을 했다.
157,결국 내기는 2:1 로 이겼다.
158,한 예찬 원래는 쭈니의 팬이어서 쭈니를 위한 컨텐츠도 만들어 놨는데 어쩌다가 램 램을 주고 어쩌다가 멤버가 되었다고
159,한다.
160,트위치에서 개인 방송을 하고 있다.
161,트위치 TV 개인 유 튜브를 운영하며 영상을 업 로드하고 있다.
162,유 튜브 늑 (or 에 쿠보 )2019 년 5월 기준으로 현재 램 램 유 튜브에 유일하게 자주 출연하는 멤버. 개인 유 튜브를 운영하며 영상을 꾸준하게 업 로드하고 있다.
163,"유 튜브 엘리스 실제 인물은 아니고 영상에서 늑이나 피린이 ''ellice_"" 란 닉네임에 목소리 변조하고 특정 스킨을 끼고 나온 것이다."
164,여캐가 필요할 때 쓰이는 컨셉으로 가상의 인물. 채널이 따로 존재하며 램 램이 구독하고 있다.
165,"유 튜브 램 램 TV 내부 활동이 없고, 램 램 TV 관련 인의 확실한 탈퇴 관련 언급이 없는 ' 탈퇴가 확인되지 않은' 멤버들을 서술합니다."
166,칸 쵸 ( 現 신 달래 )2016 년 중순 멤버를 탈퇴했다가 2017년 8월 6일 랑캐와 함께 복귀했다.
167,다만 현재 트위치에서 방송활동을 진행하고 있음에도 램 램 TV 내에서의 출연이 없다.
168,피 린 전 멤버. 램 램 TV의 막내. 램 램의 플랫폼 변경 이후 초기에는 자주 출연하였으나 어느 순간부터 나오지 않고 있다.
169,2020 년 램 램의 개인방송 채팅 창에서 잠시 모습을 비추면서 램 램과 매우 오랜만이라고 한 것을 보면 사실상 탈퇴한 것으로 보인다.
170,과거에 개인 유 튜브/ 생 방 송를 진행하였으나 현재는 둘 다 동결상태. 랑캐 2016년 중순 멤버를 탈퇴했다가 2017년 8월 6일 칸쵸와 함께 복귀했다.
171,"램 램 티비의 여성 멤버 중 백치미가 가장 돋보이는 멤버. 다만 따로 인터넷 방송계 관련 활동도 하지 않고, 램 램 TV에서의 출연도 없는 것으로 보아 사실상 탈퇴한 것으로 보인다."
172,빵 떡 ( 現 모양) 램 램 TV의 전 멤버. 램 램 TV에 합류한 마지막 멤버로 플랫폼 변경 이후 초기에는 램 램의 영상에 출연하였으나 어느 순간부터 출연하지 않고 있다.
173,드물게 램 램의 생방송 채팅 창에 나타나 안부인사를 주고받는 것을 보면 사실상 탈퇴. 김 뚜 띠트 위치 TV 유 튜브 현재에도 활발히 개인방송/ 유 튜브에서 활동 중이다.
174,램 램의 원 투 펀치 중 하나. 램 램 tv 출신 방송인 중 쫀 득과 함께 인지도가 가장 높은 스트 리머이다.
175,"램 램의 플랫폼 변경이후 출연하지 않으면서 탈퇴여부에 대한 추측이 돌았었고, 2018년 11월에 멤버 탈퇴가 확인되었다."
176,"쫀 득 트위치 TV 유 튜브 뚜 띠와 함께 램 램의 원 투 펀치를 이뤘던 멤버로, 현재에도 뚜 띠와 더불어 램 램 tv 출신 중 인지도가 가장 높은 스트 리머이다."
177,현재에도 활발히 개인방송/ 유 튜브로 활동 중이다.
178,램 램과 가장 처음 만난 멤버라고 한다.2018
179,년 2월 14 일 램 램 TV 탈퇴와 동시에 퀸 톨 TV 합류를 발표하였다.
180,18년 중반 이후론 퀸 톨 TV에 거의 안 나온다... 램 램과 멤버를 나간다는 통화를 하며 펑펑 울었다고
181,한다.
182,김 뿡트 위치 TV 유 튜브 전 멤버. 현재에도 활발히 트위치/ 유 튜브에서 활동하고 있다.
183,삐 부 16년도 후반 여성 맴버 보충으로 충원된 멤버. 학교 특집 오버 워치 편을 찍은 후 하루만에 개인 사정으로 탈퇴했다.
184,명목상 전 멤버로 여겨 지지만 사실상 게스트라고 봐도 무방할 정도. 이로 인해 대부분의 트위치 시청자들은 삐 부가 램 램의 전 멤버였던 것을 몰랐으나 램 램이 트위치 스트 리머들과 친해 지면서 강제로 밝혀지게 되었다.
185,무노 2019년 제대 이후 개인 유 튜브 커뮤니티에 활동 재개 소식을 알렸으나 거의 활동하지 않는 수준. 후술된 김자 칼의 개인방송에서 각자의 사정으로 인방활동을 그만두고 현생을 살기 위해 떠났음이 확인되었다.
186,개인 유 튜브를 운영하였었으나 2019년 이후 운영이 중지되었다.
187,담비 ( 前 수 빈) 전 멤버. 과거에는 Vlog 형식으로 유 튜브 활동을 한창 했으나 현재는 활동하지 않는다.
188,뽀뽀( 민 결희) 초기 멤버 중에는 유일한 여성 멤버였다.
189,아프리카 TV 시절 개인방송을 진행했었으나 오랜 기간 잠적하였다.
190,현재는 트위치에서 다시 민 결 희라는 닉네임으로 방송을 진행하고 있다.
191,트위치 TV 러브 새 키 전 멤버. 현재는 트위치 채팅 창에서 자주 등장하며 합방 날에는 거의 등장한다.
192,핑 켓 특유의 사투리로 당시 인기가 많았다.
193,하지만 램 램과 좋지 않은 일이 있어 탈퇴했다고
194,한다.
195,후에 방송 멤버 복귀를 한번 했었는데 얼마 안 가 다시 나가게 됐다.
196,램 램의 이야기를 들어보면 심한 잘못을 한 걸로 보인다.
197,서 티 플 램 램과 유일한 동갑 멤버였다.
198,최근 2019년 1 월 램 램의 트위치 방송에 찾아가 서 로 연락처를 주고받았다.
199,서른 플... 트위치 생방송에 직접 참여하거나 채팅으로 참여한다.
200,요 르 램 램 TV 1 기 멤버이다.
201,휴릉 램 램 TV 2 기 멤버이다.
202,"콤앙, 김 리틀과 함께 따로 방송을 하려고 멤버를 탈퇴했다."
203,조금 안 좋게 나간 걸로 보인다.
204,콤앙 램 램 TV 2 기 멤버이다.
205,램 램 TV 멤버이기 전에도 가끔 출연했었다.
206,염료 플러그인 제작자였다.
