,sentences
0,"트위치 파트너 스트 리머 이자 코스 플레이어, 게임 모델. 남자다운 귀여운 외모와 달리 글래머 러스한 몸매를 [10] 가진 미녀이며 주로 귀엽거나 섹시한 코스 플레이를 선보인다."
1,과거 프로 코 스프 레 팀 [11] 소속이었으나 현재는 탈퇴하고 개인적으로 활동하는 것으로 보인다.
2,"[12] 현재 트위치에서 스트 리머 활동도 병행하고 있으며, 방송 시간은 매주 월, 화, 목 [13] 오후 6시 30분에 시작했으나, 1월 15일부터 매주 월, 화, 수, 목 [14] 오후 6시 30분으로 변경되었다."
3,"바꾼 이유로는 사실상 금요일은 거의 방송을 했었는데, 월화 목금에 방송하다 보니 수요일에 쉬어도 쉰 것 같지 않아서 월화 수목으로 변경했다고"
4,한다.
5,3월 15일부터 일월 화수로 방송 요일을 변경하였다.
6,4월 20일부터 월화 수목으로 다시 변경하였다.
7,11월 20일 방송에서 4일 연속으로 방송을 하는 것이 힘들다고
8,느껴 방송일을 월화 목금으로 다시 변경하겠다고
9,말했다.
10,그런 데 어느 순간부터 방송을 월화 토 일로 변경하였다.2020
11,"년 3월 14일부터 월, 화, 수, 일로 변경하였다."
12,메인 컨텐츠로는 수다 방송과 게임 방송이 있다.
13,"공갈빵: 너는 속이 텅텅 빈 공갈빵이 자 너. 여자 스트 리머들에게 엄청 수출이 되어 본의 아니게 공격을 하게 되었고 [28], 공갈빵은 이 사건으로 인해 빈 유의 상징이 되어 버렸다."
14,요즘은 탈모로 놀리면 가슴으로 받아치면서 스트 리머들에게 극 딜 하는 패턴으로 바뀐다.
15,사실상 가슴 관련 공격에선 마루에 몽을 이길 자가 없기 때문에 딜 교에 있어서는 마루에 몽이 압도적으로 이길 수 밖에 없다.
16,"기꼬 단: 기미 짱의 팬들을 칭하는 말. 마루에 몽 방송을 도와주고, 마루에 몽의 과한 행동을 견제해 주는 기미 짱을 응원하는 단체로 최근 들어 부쩍 기꼬단이 증가했다."
17,뜻은 레꼬단과는 다르게 런 천 미트만 먹는 기미 짱을 응원하며 ' 기미 짱에게 꼬막 사주는 단체' 라는 뜻이다.
18,런 천 미트 대장균 발견 이후 리 챔으로 대체되었다 한다.
19,기미 짱 (): 마루에 몽의 방송에서 여러 가지 잡무를 담당 [29] 하는 사람. 평소엔 목소리만 나오지만 직접 모습을 드러낼 때도 있다.
20,"로봇처럼 여러 대가 있으며, 마루에 몽이 마음에 들지 않을 때마다 학살하고 현대판 눈물의 곡절 뉴 기미를 세우고 있다."
21,마루에 몽은 런 천 미트를 주면 말 잘 듣는 노예라고 말한다.
22,최근 더빙도 잘하는 모습을 보여준다.
23,마루에몽이 화장실을 가서 방송 화면을 비울 때 착취당하는 기미 짱에게 변 발단들은 ' 메모 장' 을 틀라고
24,말한다.
25,당근도 튼다 그리고 최근엔 마루에 몽이 방송을 끝내고 돌아간 후 시간대에 기미 미 미라는 이름으로 방송하기 시작했으며 이 탓에 포차에 사람이 없다거나 기미 미 미 팔로 워 O 명 같은 게 방송에서 언급되기도 했으며 몰래 방송하다 마루에 몽에게 걸리기도 했다.
26,기미라는 닉네임의 유래 런 천 미트 대장균 발견 이후 리 챔으로 대체되었다 한다.
27,최근 마루에 몽과 우 결 컨텐츠(?) 겸 커플이 되었다.
28,참고로 마루에 몽이 고백했다.
29,도게 자도 했다 거 사겨 주십시오
30,"제발 김 유리 씨 (): 딸꾹질할 때 조금씩 나오거나 귀여운 척 할 때 김 유리 씨 등판, 김 유리 구조 요청 등의 드립이 터진다."
31,[30] 김 팔목 (): 마루에 몽의 1회 차 원래 아저씨 인격의 이름. 쌀 국수를 좋아한다고 한다.
32,꼬민이: 마루에 몽이 2016년에 이케 아 에서 산 인형으로 가끔 씩 등장했었지만 야 돈에 인지도가 밀렸었는데 마루에 몽이 이 인형으로 문신을 하면서 인지도가 떡 상했다.
33,방송 화면을 자세히 보면 항상 작은 꼬민이 사진이 떠 있다.
34,느그 단: 마루에 몽이 변 발단을 ' 너희들' 이라고 말하는 것을 경상도& 전라도 사투리로 ' 느그들' 이라고 부르는 것에서 나온 호칭이다.
35,땅콩 잼: 아래에 있는 오리 배 썰 과 비슷하게 시청자 사연이라고 주장하면서 팬티에 실수한 것을 땅콩 잼이라고 돌려서 말한 것에서 나온 밈이다.
36,"팬 영상 비슷한 단어론 누 텔 라, 땅콩 버터가 있다."
37,돌핀 팬츠: 본인이 100 여 벌 정도 가지고 있다고
38,주장하는 바지. 방송할 때마다 항상 입고 있다.
39,"돌 팬 or 돌핀: 방송이 시작하기 전이나 끝날 때, 혹은 방송을 하지 않는 날의 방송 시간 부근에 채팅에 머물러 있는데, 이때의 마루에 몽 소환 주문이다."
40,레드 와인 섹스 (): 인 싸 가 먹는 음료수 중 하나라고 한다.
41,"쉐프에게 주문을 하며, 이 단어가 나오게 된 계기는 도네에서 Epic Sax Guy을 가르쳐 줬는데 이를 그대로 읽은 것에서 유래. 도네에도 많이 나오고, 2차 창작도 나오고 있다."
42,본인도 이제 당당히 말하고 있다.
43,"마법 봉 (): 마루에 몽이 들고 있는 요술 스패너이며, 나이는 2살이고, 야 돈과 똑같이 고통 받고 있다고"
44,한다.
45,"변 발단: 마루에 몽의 시청자들을 칭하는 말. 뜻의 의미는 변발+ 단 변 발포 차: 마루에 몽은 타 스트리머를 거의 [31] 호스팅하지 않기 때문에, 방송이 오프라인된 상태에도 채팅 창이 활성화되어 있는데, [32] 변 발단들이 방송이 켜져 있지 않을 때 상시 채팅을 하기 때문에 변 발단+ 포장마차의 준말로 쓰인다."
46,간혹 마루에 몽도 채팅 창에 참여하는 경우가 많다.
47,주 메뉴로는 마가렛트가 있다.
48,밴 발단: 변 발단 중에서는 여러 다양한 드립을 치면서 선 타기를 하는 이가 존재하는데. 이를 ' 밴+ 변발 단' 이라는 의미를 써서 밴 발단이라고 불린다.
49,"주로 탈모나 흑역사 관련으로 놀리면 들을 수 있으며, 마루에 몽이 ' 저 새 X 밴 해 라' #라고 말하는 경우도 있다."
50,"참고로 밴 발단은 아슬아슬 하게 밴 당할 행동을 하면서 블랙 코미디를 하는 사람이지, 정말로 밴을 당할 행동을 해서 밴을 당하면 밴 발단이 아닌 진심 밴이니 유의하기 바란다."
51,"병동: 마루에 몽의 방송 스타일과 그를 따르는 변 발단의 스타일이 서로 미쳐 있기 때문에, 이를 병동이라고 부른다."
52,"흔히 1, 2, 3 병 동에 이은 ' 제 4 병 동' 이라고 불리며, 제 1 병 동이 인정한 것 때문에 ' 옆 병동' 이라고 불리기도 한다."
53,뽀삐 : 마루에 몽이 둠 해 머를 들고 리액션을 할 때 기미 짱이 뽀삐? 라는 채팅을 올린 때부터 시작되어 시작 리메이크 전 뽀삐 리메이크 전 뽀삐 일 러스트가 나오면 닮았다고
54,마루에몽을 놀린다.
55,마루에몽이 화장실에 가면 채팅으로 뽀삐와 탈모가 번갈아 나온다.
56,꼭 화장실이 아니더라도 가능하다.
57,코 스프 레 [33 ]야 돈 : 마루에 몽이 방송할 때 껴안고 있는 인형이다.
58,나이는 1살이고 고통 받고 있다고
59,한다.
60,"피자 국물? 도 묻고, 다른 이상한 것 들이 묻어 있어서 더럽다."
61,심지어 항상 엉덩이에 깔고 앉아서 별 냄새가 다 난다고 한다.
62,"2018년 팬 미팅 이후, 새끼야 돈을 비롯하여 수많은 후임들이 생겼지만, 아직 까지도 매우 왕성하게 현역으로 활동하고 있다."
63,그러다 보니 이제는 꼬리 부근 곳곳에 원인 모를 구멍들까지 생겼다.
64,야 돈: ㅅ.. 살... ㄹ.. ㅕ... 주.... ㅓ... 현재는 상태가 너무 안 좋아져서 야 돈에 대해 물어보면 이렇게 대답한다.
65,유니콘 : 마루에 몽이 방송할 때 껴안고 있는 인형 2. 다이 소 출신이다.
66,"모 게임의 CF가 도네로 나왔었는데, 그 광고의 명대사에 감명 받았는지, 며칠 뒤 바로 공수해 왔다."
67,"위의 야 돈과 함께 마루에 몽의 의자에서 상주하고 있으며, 처지는 야 돈과 비슷하다.에"
68,몽이 형 (): 시청자가 마루에 몽을 부를 때 사용하는 호칭. 사실상 모든 이의 형( 공 공재) 이다.
69,스캇에 몽 (): 마루에 몽이 본인의 이야기는 아니고 시청자의 이야
70,"기라며 한강 오리 배에서 똥을 싼 이야기를 하면서 생긴 별명. 비슷한 별명으로는 ' 트위치 대표 똥쟁이' 와 ' 응가에 몽' 이 있으며, 변 발단은 다음과 같은 도네가 쏟아지고 있다."
71,오리 배 : 위에서 언급한 이야기로 인해 생긴 또 다른 별명. 똥과 조금이라도 관련된 이야기가 나오면 트수들이 이 ' 오리 배 '를 언급한다.
72,"슬 젖 날: 통 칭 ' 슬픈 젖꼭지의 날', 본인이 뭔 가 잘 안 풀리거나 텐션이 낮은 날을 칭하는 명칭으로, 비슷한 뜻으론 ' 우 젖 날( 우울한 젖꼭지의 날)' 이 있으며, 반대 말로는 뭔 가가 잘 풀리거나 텐션이 좋은 날을 칭하는 ' 기 젖 날( 기쁜 젖꼭지의 날)' 이 있다."
73,자괴감 : 자괴 감 000 프로. 스택이 계속 쌓이는 중이다.
74,이것을 보고 유입되는 사람들도 많다.
75,"자연의 소리 : 근래 마루에 몽이 화장실을 갈 때 기미 짱이 틀어 주는 소리. 종류는 폭포소리, 빗소리, 물방울 소리 등등 물과 관련된 소리부터 각종 동물의 울음소리까지 매우 다양하다."
76,"지각: 마루에 몽은 방송을 할 때에 항상 오후 6시 30분에 방송을 키는데, 이보다 조금 늦으면 사람들이 병동의 문을 쾅쾅 두드리거나 지각이라고 말한다."
77,"마루에 몽 본인은 조금만 늦으면 쾅쾅 두드리며 날뛰는 행위를 싫어하므로 자제하도록 하자. 캐치 몬 : 마루에 몽의 흑역사 중 하나이며, 도네로 영상이 틀어질 때마다 격하게 반응했었다."
78,그 외 흑역사로는 위에서 말한 도구로 가 있다.
79,이제는 익숙 해져서 크게 반응하지 않는다.
80,탈모: 본인은 이마가 넓은 것이라고 하지만 # 탈모 도네만 틀면 눈물이 나는 아재 # 탈모라고 변 발단들이 자주 놀린다.
81,# ## 그래서 변 발단들에게 탈모 빔을 시전했었다.
82,# 최근에는 앞머리가 변명 불가능할 정도로 후퇴한 탓에 스스로도 탈모임을 인정하는 듯 하다. [34] 결국 2018년 11월 1일 모 발 이식을 받았다.
83,이제 빡빡이라 못 놀린다 이식한 모발이 빠져서 여전히 놀린다.
84,2019년 3월 11일 오후 2시 병원에 가서 이식 받은 모발을 점검 받는 방송을 하며 모발 이식의 성공을 알렸다.
85,낮 방을 끄고 저녁에 방송을 켰을 때는 가발을 쓰지 않고 자기 머리로 왔다!
86,하지만 세팅하는 게 귀찮아서 앞으로도 가발을 쓰고 방송할 것이라고 한다.
87,폭포: 마루에 몽이 화장실을 갈 때 시청자들이 틀어 주는 영상 도네.
88,점점 폭포의 파워가 세지고 있다.
89,"# 이후로는 기미 짱이 직접 폭포를 틀어 주거나, 마루에 몽 미니어 쳐를 틀어 주거나 하고 있다."
90,연도 사진 링크 비고 2015 시라 누이 마이 마루에 몽 글 던 전에서 만남을 추구하면 안되는 걸까 헤스 티 아인 스타 그램 지스타 마 영전 린 블 로그 병동 미쿠 인스타 그램 확산성 밀리언 아서 샤비인 스타 그램 팬 스가 - 스타 킹 마린 룩인 스타 그램 길드 오브 아 너 클 로 디아 1 2 마루에 몽 글이 분이 나의 주인님 사와 타리 이즈 미 페이스 북 2016 한 복 촬영사진 마루에 몽 글 우리가 영웅이다 릴리스 마루에 몽 글 얼음 불꽃 애니 마루에 몽 글별 수호자 룰루 마루에 몽 글지 스타 팝스타 아리 네이버 블 로그 데스 티니 차일드 다비 미 개봉 네이버 블 로그 사 커 스피리
91,"츠 진 서희 1 2 네이버 포스트, 인 벤 글 다비, 진서 희마"
92,"루에 몽 글 온라인 게임의 신부는 여자아이가 아니라고 생각한 거야 아 코 코 스프 레 컬렉션 010 in 서울 별 수호자 럭스 별 수호자 단체( 룰루) 네이버 포스트 테일 즈 런 너 미 호 op.ggRE: 제로 렘 마루에 몽 글 나는 친구가 적다 미 카 즈 키 요 조라 1 , 2 아이 돌 마스터 - 신데 렐 라 걸 즈 - 마에 카와 미쿠 네이버 포스트 쿠키 런 치즈 케이크 맛 쿠키 1 2 인스타 그램 확산성 밀리언 아서 색동인 스타 그램 7개의 대죄 엘리자베스 1 2 인스타 그램 함대 콜렉션 시마 카 제인스타 그램 스트리트 파이터 춘 리인 스타 그램 천상의 기사단 국희 마루에 몽 글세라 복 1 2 인스타 그램 클래 시 로얄 아 처인 스타 그램 냥 제리 1 2 러브 라이브 호 노 카, 냥 제리 부르마"
93,인스타 그램 산타 인스타 그램 글 2017 바니 걸 렘 비키니 렘 마루에 몽 글 시라 누이 마이 마루에 몽 글 캐치 몬 루시안 마루에 몽 글 1 2 고스 족 애니 단체 페이스 북 니어 오토 마 타 2b로 젠 메이든 신쿠 인스타 그램 호 노 카 페이스 북 슈퍼 소니 코 소니 코 미 쿠냥 인스타 그램 기어와 라 냐
94,"루 코 양 냐루 코 마루에 몽 글 Re: 제로부터 시작하는 이 세계 생활 - 베 아트 리스 마루에 몽 글 백 리스 메이드 1 2 백 리스 니트랑 바니 걸, 뷔스티에, 메이드 마루에 몽 글 프리 파라 코믹 콘 미즈 마블 기사 테라 엘 린 1 2 3 개인촬영인 스타 그램 스쿨 미즈 1 2 대구 사복 마루에 몽 글 소녀전선 TMP 인스타 그램 디 바 수영복 2018 페 그 오 마 슈인 스타 그램 서 코 벽람 항로 벨 파스 트인 스타 그램 양 1 2 3 인스타 그램별 수호자 소라 카인스타 그램 메이드와 세라 복 강인 경 님과 2 3 4 5 6 7 8 9 10 인스타 그램 수영복 2 3 4 5 6 7 8 9 10 인스타 그램 던 전에서 만남을 추구하면 안되는 걸까 헤스 티아 2 3 인스타 그램 비키니 오버니 삭스 2 3 4 5 6 7 8 인스타 그램 비키니 미쿠 1 2 3 인스타 그램 페 그 오 하산 [35] 페이스 북 세라 미즈 2 페이스 북, 인 스타 그램 퀸 부끄 1 2 3 인스타 그램 2019 강인 경 님과 코 스프 레 1 2 3 인스타 그램 흰 티 2 3 인스타 그램 맥 심 연도 영상 비고 2015 길드 오브 아 너 ' 클 로 디아' 메이킹 필름 2016 천상의 기사단 ' 국희' 메이킹 필름아이 라이크 베이스볼 12 먹 방편이사 만루 2 KBO 중계방송 업 로드된 계정 우리가 영웅이다 ' 릴리스' 인터뷰 2017 캐치 몬 ' 루시 안' 메이킹 영상 2018 라스트 블 레스 광고 영상 트리플 S 스트 리머 대전 인터뷰 트리플 S ' 디아나' 코 스프 레 12 나를 지켜 줘 ' 유이나' 메이킹 필름 12 방송 1 2 3 이 게임의 경우 어 플 아이콘이 마루에 몽 사진이다 [36 ]2020AFK 아레나 광고 영상 자신은 소녀, 여중생, 미필이라고 주장하고 있으나, 특유의 찰진 리듬감으로 복무 신조를 외치는 군 필 아재로 보인다.1970~1980"
95,년대의 우표를 많이 가지고 있다.
96,이 우표는 인생 3회 차가 되면 값어치가 많이 오르니 그때 판다고 한다.
97,심지어 새마을 운동 수건(??? )까지 가지고 있다.
98,갑각류 알레르기가 있다.
99,핀과 제이 크의 어드벤처 타임을 좋아한다.
100,군대에 대해 지식이 해 박하다.
101,"가끔 모형 총기를 가지고 방송을 하는데, 견 착 자세도 훌륭하고 호흡 조절 후 발사하는 자세도 어디 선가 교육을 받았다는 인상을 준다."
102,심지어 채팅 창에서 총기 번호 드립이 나오자 곧바로 각인 위치를 바라보기까지 한다!
103,"이렇게 마치 실제로 군 생활을 해본 듯한 인상을 주는 터 라 트랜스 젠더라는 말까지 돌았는데 [37], 일단(?) 생물 학적 성별은 여자가 맞고 본인도 남자냐"
104,는 질문에 보기에만 좋으면 되고 맛만 좋으면 됐지라고 답했다.
105,"# 기미 짱에게 도네로 부사관이면 메모 장을 켜 달라 했는데 메모 장을 진짜 켜기도 했었고, 군가 멸공의 횃불 전주만 듣고도 제목을 맞히기도 했다."
106,이론으로 공부한 게 아니냐고 추측할 수는 있어도 그 올바른 사격 자세는 이론으로 나오는 게 아니다.
107,"유 튜브에서도 마루에 몽과 군대의 관계에 대해 여러 가지 추측이 난무했고, 대략 여성 밀 덕 후, 공군 항 공고 출신 [38], 부사관 후보생 포기자로 압축되었다."
108,3번 일 경우 적어도 고등학교 졸업 이후에 지원이 가능하고 말 그대로 훈련소에서 훈련만 받다 퇴교한 셈이다.
109,항 공고의 경우 의무 복무 기간이 부사관보다도 1년이나 더 긴 5년이므로 [39] 마루에 몽이 나이를 속이지 않는 이상 1번 일 확률이 높다는 쪽으로 의견이 좁혀 졌다.
110,마루에 몽 본인이 2018년 5월 29일 방송에서 직접 부정하기도 했다.
111,방송은 마루에 몽이 따로 마련한 개인 사무실에서 진행하며 송출용 캠은 캐논 EOS 80D 이다.
112,"그러나 방송 끝까지 배터리가 버티지는 못하는지 방송 도중 한 번 씩 배터리를 갈아야 하는데, 기미 짱이 타이밍을 잘 맞춰 배터리를 갈면 재미있는 상황이 종종 연출된다."
113,# ## 배터리 문제를 해결해서 지금은 방송 중에 배터리를 갈지 않는다.
114,몸이 약한 편이다.
115,"업무를 포함한 특별한 일이 없는 한, 병원 이외에는 되도록 집에서 나가지 않는다고."
116,과거 루 리 웹이나 오늘의 유머에 종종 출몰하여 인증 글을 올린 적이 있다.
117,페이스 북 활동도 왕성한 편. [40] 현재는 광고성 글 작성으로 인해 오늘의 유머에서 영구 차단된 상태이다.
118,컴퓨터의 고장으로 인해 임시로 핸드폰 방송을 했던 적이 있다.
119,# 손가락 욕을 중지 대신 약지를 올려 순화시켜 사용한다.
120,인천 출신인데 사투리를 사용한다.
121,"마루에몽의 부모님이 각각 경상도, 전라도 출신이라서 영향을 받았다고"
122,한다.
123,두 지역의 사투리를 섞어 쓰는 경향이 있다.
124,[41 ]12 월 4일 유 튜브에서 마루에 몽의 팬이 만든 동영상이 인기 급상승 동영상 1위를 달성하여 화제가 됐었다.
125,# 마루에 몽 본인도 즐 겨워하며 자신의 페이스 북에 인증했었다.
126,"#12 월 8 일 레 바가 주최한 연말 파티에 초대되어 참여했었는데, 도착 직후 엘리베이터 앞에 서 레 바를 만나게 되어 매우 즐거워했다#. 스트리머가 모이는 자리에 처음 간 우리의 아재 여고생은 방송에서의 이미지와 달리 다른 스트리머에게 낯을 가리는 모습을 보여주며 안타까움을 샀다."
127,아 싸 에몽의 별명이 많은 사람에게 알려 지기 시작했다.
128,[42] 처음에는 낯을 가렸지만 시간이 지나자 마루에 몽 본인이 가져온 스케치북에 싸인을 받으며 어울리는 모습을 보였다.
129,# 레 바 방송이 꺼져서 시청자들이 보지 못한 이야기가 있었으나 후기에서 들어오면 김도에게 탈모에 대해 진지하게 이야기를 나누는 등 나름 친목을 다졌다고.
130,12월 9일 방송에서 본인이 보기에 자신이 한심해 보인다는 이유로 눈물을 흘리게 되고 이 날 방송 클립이 많이 수출되며 팔로 워 수가 대폭 증가하였다.
131,레 바 연말 파티와 관련하여 악의적으로 편집된 유 튜브 영상으로 인해 참여했던 여자 스트 리머들이 마루에 몽에게 왕따시켰다는 오해가 생겨서 악플이 난무했었다.
132,"그래서 관련된 여자 스트 리머들이 해명을 했으며, 마루에 몽 본인도 이에 대해 인지하고 트게 더 댓 글을 통해 사실이 아니라고 해명하기까지 했다."
133,# 현재 문제가 되었던 유 튜브 영상은 마루에 몽의 요청으로 삭제되었다.
134,딸꾹질하는 모습이 클립으로 굉장히 많이 올라온다.
135,딸꾹질 소리는 귀엽다는 사람이 존재해 딸꾹질 빌 런들이 생겼다.
136,내면의 소녀( 김 유리 씨) 가 잠식해 버린 아저씨의 영혼과 싸우며 구조 요청을 하는 중이라는 드립이 성행 중이다.
137,"딸꾹질 스트 리머 물론 이 딸꾹질에 호불호가 갈리며, 딸꾹질이 역류성 식도염으로 나타나는 현상으로 아파 보인다는 의견도 있다."
138,그리고 영상은 많이 지워 졌지만 방귀도 뀌었다.
139,"특히 방종 방귀 영상 는 지금도 클립으로 남아 있을 정도 .도 네이션으로 귀여운 애완동물이나 하 시모 토 칸나, 현아 등의 영상을 보내주면 매우 좋아한다."
140,최근에 기미 짱의 실수로 [43] 방송 이펙트 7개를 사는 데 약 100만원을 날렸다.
141,비 타 스틱을 피운 적이 있다.
142,골프공 게임을 클리어 하고 나서 캠을 킨 상태로 피우기도 했지만 현재는 사용하지 않는다.
143,술을 좋아한다.
144,맥주 중에서는 코 젤을 가장 좋아한다.
145,가끔 음주 방송도 진행하는데 너무 달려서 통제가 안 되면 기미 짱이 사과 자막 송출 후 조기 방종을 하는 경우도 있다.
146,술 먹 방의 진수를 보여준 위스키 먹 방은 위스키로 병나발(!!!) 을 불고 [44] 완전히 미쳐 버려 다른 의미로 레전드를 찍었다.
147,방송이 없는 날에 술을 먹고 오면 실수로 부딪혀 어 딘가 멍들어 있는 모습이 보일 때도 있다.
148,주정뱅이 아저씨 2018년 4월 14 일 엘 큐브 벽람 항로 코 스프 레 행사에 참가하게 되면서 방송 이후 마루에 몽의 첫 오프라인 행사가 진행되는가
149,"했으나, 우천으로 인해 취소되었다."
150,하늘의 선 즙 필승 2018년 5월 5일 제닉스 강남 도 곡점이 강남 구청 역 앞으로 확장 이전하면서 이벤트로 마루에 몽 팬 미팅을 진행하였다.
151,공지는 5월 3일에 발표했으며 업체에서는 5월 3일부터 10일 내로 마루에 몽이 원하는 날짜에 하기로 했는데 하필 그 원하는 날짜가 어린이날이라 날 빌 테크 진행. 다행히 엘 큐브 때처럼 취소되지 않고 계획대로 진행되었다.
152,예상 외의 오프라인 참여율로 관계자들이 모두 당황했다고
153,한다.
154,약 200~250 명 정도로 참가한 것으로 추정. 그래도 기존 5시 ~7 시에서 30분 더 연장 진행하고 나름 노력하는 모습을 보이기도. 전체적으로 많은 사람들이 만족한 분위기이며 선물을 역대 급으로 많이 받게 되었다는 후문이 있다.
155,위에 취소된 엘 큐브 이벤트는 2018년 5월 12일 서울 코믹 월드에서 벨 파 스트 코 스프 레와 사인 회로 진행됐다.
156,패션 센스가 상당히 괴악하다.
157,방송에서 입는 옷은 디자인 업계 경력이 있는 기미 짱이 검수해 주고 있다고.
158,화려한 디자인을 매우 좋아하는데 매치를 잘 못하는 듯. 사람 얼굴만 보고 판단하는 것을 매우 싫어한다고 한다.6
159,월은 물 건너갔고 곧에 이유 님과의 합방이 예정되어 있다.
160,이유의 인스타에 보면 마루에 몽과 함께 술을 먹은 사진이 올라와 있다.
161,그리고 9월 추석 맞이 합방을 했다.2018
162,년 한글날 방송 중 ' 습관성 뻑 큐 증'( 줄여서 습 뻑 증) 이 도져서 약지 대신 중지로 뻑큐를 날렸다.
163,본인이 습뻑증이 있다면서 나무 위 키에 서술해 달라 하였다.
164,키에 비해 비율이 정말 좋다.
165,단지 다리가 짧.... 키도 짧.... 이거 직접 작성한 거 아닌가... 소속이 딱히 없었으나 2018년 10월 25일에 채널 좀비 왕 멤버 소개 영상에 올라오면서 채널 좀비 왕 소속이 되었음을 알렸다.
166,다만 채널 좀비 왕이 창작자 중심 채널이라 다소 뜬금없는 조합이라는 말도 꽤 나오는 모양. 현재 편집자를 칭하며 활동하던 유튜버가 [45] 개인 방송으로 탈바꿈하여서 방송을 하려고 하고 있다.
167,"팬 채널에서 탈바꿈 한 개인 채널 현재는 삭제되었으나, 마루에 몽 본인이 댓 글로 관련 영상 다 삭제해 달라 요청하였고, 유 튜브를 승계 받았다는 것 또한 금시 초문이라는 반응을 보여주었다."
168,공식 채널은 있었으나 운영이 활성화되지 않았었다.
169,"그러나 채널 좀비 왕에 들어가면서 공식 채널을 활성화 할 예정이라 밝혔고, 팬 채널은 활동을 중단했다."
170,그리고 가장 인지도 있던 팬 채널 운영자를 공식 유 튜브 편집자로 영입했다.
171,현재 공식 채널에는 채널 좀비 왕 소속 편집자와 팬 채널 운영자 두 명이 영상을 업 로드한다.
172,요즘 단신 기믹으로 고통 받고 있다.
173,"트위치 내 최 단신인데 [46], 일어서 기만 하면 짧 등의 채팅이 도배된다."
174,투보 님과 친분이 있다.
175,유 튜브 영상을 찍을 때 도움을 주기도 했고 서로 자주 연락한다.
176,채널 좀비 왕 내에서는 갱 복치 님과 친분이 있다.
