,sentences
217,"민트 초코에 대한 수백, 수천 번의 질문에도 한결같이 싫은 내색을 하는 걸 보면 보통 싫어하는 게 아닌 듯 하다. [94] 지금은 로버트 다 우니 주니어를 좋아하지만, 그 전에 좋아했던 연예인은 하 하라고 밝혔다."
218,"무한 도전 굿즈를 풀세트로 샀을 정도로 애정이 남달랐는데, 중학생 때 하 하의 결혼 소식을 듣고 적잖은 충격에 빠지며 그대로 포기했다고..."
219,[95] 유치 원생 때는 리 마리오를 좋아했다고
220,한다.
221,"가끔 씩 특이한 조합의 음식을 먹는데, 대표적인 예로 물 타 500[96] 과 탄산 수프 라이트 등이 있다."
222,"최근에는 햄버거를 먹을 때 보리차를 같이 마신다고 밝혀서 트수들을 충격에 빠트리기도 했는데, 본인은 당당 하다는 입장이다."
223,"방송에서 가끔 연애에 관련된 이야기를 할 때가 있는데, 그 때마다 트수들이 양 아지를 놀려 대지만 사실 양 아지는 모태 솔로가 아니다."
224,다만 양 아지 본인은 학생 때 연애는 연애가 아니라고 생각한다고.
