,sentences
0,대한민국의 前 카트 라이더 프로 게이 머 이자 스트 리머. 일단 달리기 시작하면 전 대웅 선수 못 지 않게 무서운 선수가 바로 이중선이거든요!
1,"정 준, 11차 리그 패자 부활 전 대저택 은밀한 지하실에서 이중선이 1위로 치고 나가자. 다시 한번 칼날 같은 주행 식칼 좌! 김 대겸, 2019 시즌 2 개 막전 아이스 부서진 빙산에서 김승래를 폭스 X의 뒷부분으로 날려 버리자. [9] 현역시절 그의 플레이 스타일은 한마디로 러너 그 자체. 비슷한 시기에 활동했던 전 대웅처럼 정말 달리는 것에 특화되어 있는 선수. 타임 어택을 휩쓸었던"
2,"그이기 때문에 주행의 기본기는 타 우승권 선수들과 비교해도 거의 압도적이였으며 여러 빌드와 기술을 개발하는 동안 쌓인 카트 시스템의 이해도, 그리고 무엇보다 칼 같았던 주행 라인이 강점이였다."
3,클래식 러너였던 이중선이 롱런할 수 있었던 것도 이 주행의 기본 기가 지속적으로 받춰 주었기 때문이다.
4,"옛날 개인전 리그 시절에는 경기 운영을 전형적인 클래식 러너 형 스타일로 가져가는, 빠르게 치고 나가 서 경기 처음부터 끝까지 1등을 잡는 식의 운영을 보여줬었다."
5,"주행의 기본기가 좋았던 그 였기에 이러한 식의 운영으로 상위권을 잘 먹으면서 항상 결승 까지는 무난하게 진출했었지만, 번번히 결승에서 주행도 비슷한 수 위급 선수들 과의 몸싸움에서 밀리는 모습을 보여주며 안타깝게 입상을 놓쳤다.9"
6,"엔진 이후 팀 전 리그 체제하에선 이중선이 더더욱 빛을 발하지 못했는데, 드래프트 시스템의 도입으로 뒷 선수들이 치고 나간 선수를 잡는 것이 쉬워 지면서 강 진우, 전 대웅 같은 클래식 러너들이 하나둘 씩 사라지기 시작하거나 플레이 스타일을 바꾸는 노선으로 현역 생활을 이어 갔다."
7,이중선도 9 엔진 초기에는 이러한 시스템에 잘 적응하지 못하였고 당시 온라인에서의 탐택은 꾸준히 휩쓸어도 듀 레 3 까지 마땅히 대회에서 입상권에 들지 못하였다.
8,"그 후 X 엔진 이후 리그에서 한 차례, 2019 시즌 2 Afreeca Freecs로 참가한 이중선은 많이 변화된 놀라운 모습을 보여주는데, 나이를 먹으면서 녹슬지 않은 주행 실력과 더불어 시야, 경험 등 여유가 더 해져서 당시 유영혁의 폼이 떨어지고 또 한 아이템 중심이였던 팀의 스피드 전을 마치 스피드 에이스처럼 홀로 캐리하는 모습이 자주 연출되었다."
9,"비록 첫 입상을 한 리그 이지만 그에게 아픈 기억과 또 한 리그 내내 제대로 지원 받지 못하고 홀로 싸우는 모습이 자주 연출되었던 것을 생각하면, 현재 시야가 넓어 진 이중선에게 좋은 스피드 멤버가 구성되었더라면 관계자들은 이중선이 더 높은 곳에 올라갈 수도 있었다고"
10,예측한다.
11,"[30] 현재 이중선의 플레이 스타일은 옛날과는 조금 변해서, 정석적인 러너는 물론 팀의 스피드 에이스 역할도 해낼 수 있는 고른 능력 치가 되었다고"
12,평가 받는다.
13,[31] 영광의 트리플 퍼펙트 시절 [32]   자 세한 내용은 이중선/ 선수 경력 문서를 의 번째 문단을의 부분을 참고하십시오.
14,아프리카 TV에서 '나 미리 선생님' 이라는 이름으로 방송을 했다.
15,덕분에 이중선의 옛날 타임 어택 영상의 영상 제목이 이중선이 아닌 나미리 선생님으로 되어 있는 경우가 많다.
16,차후 닉네임을 ' 중선이 지롱♥ '으로 바꿨다.2017
17,"년 경에는 유 튜브에 이중 대와의 케 미를 담은 형제의 난 시리즈 [33] 와 미 스틱, 에 퍼 메이 션 등의 길드 원들과 같이 게임을 하는 영상이 주로 올라왔다."
18,듀얼 레이스 3를 마친 후 2018년 11월 1일 약 1년 만에 방송을 다시 시작했다!
19,트위치와 유 튜브에서 활동 중이다.
20,타임 어택 영상도 자주 올라왔는데 광꼬 타임 어택 영상 썸 네 일을 광부에 이중선을 합성한 광부 이중선 [34 ]으로 하거나 노익 영상 썸 네 일을 외계인에 이중선을 합성한 외계인 이중선 [35 ]으로 하는 등(...) 약 빤 썸 네 일들을 많이 선보였다.2018
21,년 말부터 유 튜브를 본격적으로 성장시키기 시작했다.
22,생방송 컨텐츠도 다양 해지고 풀 영상과 타임 어택 영상을 주로 올렸던 유 튜브에도 10 분짜리 영상이 많이 올라오기 시작했다.
23,그러자 2018년만 해도 이중선 유 튜브의 구독자는 천명 대였지만 2019년 3월 무렵 구독자 5만명을 달성했다.2019
24,년 중순쯤 2019 카트리그 시즌 2에 참가 하면서 리그 멤버들 과의 스크림 영상이 주로 올라왔다.
25,"리그 팀 스폰서가 아프리카 TV 여서 트위치 방송을 잠시 중단하고 아프리카, 유 튜브 동시 송출로 방송을 진행했다."
26,"리그 은퇴 후 자신이 키운 형 독, 긍정 인처럼 예능 스트리머로 전향하고 싶다는 뜻을 밝힌 적이 있는데 현재 유 튜브, 트위치 동시 송출로 방송을 하고 있다."
27,2019년 12월 기준 일주일동안 유 튜브 영상 7개로 리그 기간과 비교하면 훨씬 영상 업 로드가 많아 졌고 친형 긍정 인 못지않은 예능 감을 뽐내는 중이다.
28,또 한 2019 시즌 2 리그 출전으로 리그 유입 팬들에게도 인지도가 많이 생기고 최근의 프릭스 게이트 사건의 여파로 이미지까지 좋아져 구독자가 급상승하였다.
29,[36] 이중선의 카트 방송인으로서의 위상이 꽤 많이 올라왔다고
30,볼 수 있는 지표다.
31,이 무렵에는 아직 유령 구독자들이 다 정리되지 않았을 무렵이어서 8만 5천명 대에서 잠시 오르내렸다.
32,"[37] 방송이 제대로 되기 시작하면서, 얌전했던 이미지를 버리고 자신의 똘끼를 유감없이 발휘 중이다."
33,"[38] 리그 연방이나 그전에는 말투가 진지했으며, 가끔 약 빤 썸 네 일을 그리거나 텐션이 높은 경우가 있었으나 지금처럼 은 아니었다."
34,"그러나 프릭스에서 방출 후 회사 복직도 못하는 상황이 되어 버려서 유 튜브에 전념하기 시작하자, 점점 중학생 시절의 까부는 이중선의 모습으로 돌아가고 있다."
35,이중선의 본 모습을 누구보다 잘 아는 이중 대 입장에선 동생의 본 모습이 드디어 드러난 것에 기뻐할 따름이다.2020
36,년 1월 8일 생 방에서 방제를 발기 찬 화요일이라고 해 놔서 시청자들을 몹시 당황하게 만들었다.
37,[39] 요즘에는 방송하면서 소리를 엄청 많이 지르는 편이다.
38,덕분에 2015년의 이중 대가 아니냐
39,는 의심도 받고 있다고...
40,이중선 매 드무비 1 이중선 매 드무비 2[40] 이 시기에는 거의 항제나 머 독 급의 급 발진으로 핵 텐션을 뿜어내는 이중선을 볼 수 있는 희귀한 시기였다.2020
41,년 3월 3일 클럽 전을 돌리다가 에퍼메이션과 강제 친선 전을 하게 되었을 때 본인과 팀원들의 계속된 실수로 인해 4판 정도를 제외하고 모조리 패배하였다.
42,"이중선은 팀원들이 실수할 때마다 미친 텐션으로 소리를 질렀고, 이때 동안 잠시 중, 고등학생 때의 미친 이중선으로 돌아갔다."
43,결국 지롱 지롱은 에퍼메이션한테 또 패배하였다.
44,"원숭아 좀 가라고!!!!!!! [41] [42] 결국 소리를 너무 많이 지른 탓에, 주민 신고와 함께 이중선의 집 앞에 쪽지가 붙었다!"
45,이와 함께 이중선은 방송과 주변 이웃들에게 피해를 주지 않기 위해 방음 부스를 구입했다고.
46,[43] 2020년 3월 31일 부스 설치를 완료했다는 유 튜브 커뮤니티 글을 올렸다.6
47,"월 달이 되어 회사 복직이 가까워지 자 회사 업무와 유 튜브 편집을 같이 할 시간이 안되는지, 편집자를 구한다는 공지가 올라왔다."
48,며칠 뒤 2020년 6월 9일 영상을 기점으로 새로운 편집자가 활동을 시작했다.2020
49,"년 6월 23일, 구독자 9만명을 달성했다."
50,빠르면 올해 안에 10만 구독자를 달성할 수 있을 것으로 보인다.2020
51,"년 9월 12일, 김 택 환, 박 민수, 문호 준, 이 중대, 김 동호, 라 넥 갓, 런 민 기, 기가 막힌 사람에 이어 한국 카트 라이더 유 튜버 역대 9 번째로 구독자 10만명을 달성했다."
52,[44 ]9 월 말부터 부쩍 어택 미션을 많이 받기 시작했다.
53,이중선도 간만에 의욕이 생겼는지 140만원이 걸렸는데 의욕이 안 생길 수가 없다 골든 파라 곤 SR-R을 타고 광 산 꼬불꼬불 다운 힐 매우 빠름 5 초대에 도전했다.
54,"계속 실패한 채 아쉬움을 품고 방송을 종료하길 며칠 째, 마침내 9월 29일 1:05 :95를 찍으면서 도전을 성공했다.2020"
55,"년 10월 5일, 실버 버튼을 받았다."
56,유 튜브 커뮤니티 박 민수 : 10년 지기 친구. 형 독이 팬 미팅에서 말하길 형 독이 한창 사 빙 공 어택을 파 던 시절 이중선 쪽에서 먼저 친 추를 걸어와 왜 자꾸 자기 기록을 잡냐고 메 신을 보내왔던 게 계기가 되어 친해 졌다고
57,한다.
58,그렇게 이중선과 먼저 친해 지고 난 뒤 자연스레 이 중대와도 친해 졌다고.
59,형 독은 처음에 이중선이 왜 자꾸 자기 기록 잡냐고 물어봤을 때 사과부터 했다 한다... 한 상현 : 에 퍼 메이 션 부 클 마로 그랑프리에서 만날 때마다 늘 골탕도 먹이면서 점수도 빼앗고 이승 교 영상 찍을 때 웃기도 했다.
60,"# 케이엘 X 컨텐츠에서 'Best 스트 리머' 팀 이 중대, 박 민수에 맞서 한 상현과 ' 쓸 품 호' 팀을 만들기도 했다."
61,형 이 중대와 비슷하게 한 상현을 자주 디스하긴 하지만 사이는 좋다.
62,"강 진우 : 은퇴한 선수들 중에서 가장 친한 형이며, Z7 시절 노 르 테 유 익스프레스 타임 어택 경쟁자 중 한 명이였다!"
63,그리고 노익 투부 구간은 많은 사람들이 이중선 영상을 통해서 이중선이 최초라고 생각하지만 사실 투부는 강진 우가 최초로 사용했으며 후에 이중선에게도 가르쳐 줬다.
64,또 한 이중선이 GK 팀에서 방출 당했을 때 강진 우가 복귀하여 같이 팀을 꾸려 보자고
65,"제안했고, 결국 듀얼 레이스 리그에 함께 나갔으며, 최근 상술된 프릭스 사건으로 인해 강 진우가 그를 감싸는 발언까지 했다."
66,박인 수 : 박인 수가 이중선을 굉장히 좋아한다.
67,[63] 박 인수가 카트 라이더를 시작한 세이버 HT LE 시절 나미 리 선생님이 영상을 많이 올리셔서 보고 따라하면서 배웠다고
68,한다.
69,많은 사람이 잘 알지 못하지만 원래 본인 팬 길드인 지롱 지롱 소속 길드 원 중 한 명이였던
70,"선 수로, 이후 온라인 실력이 좋아 듀얼 레이스 리그에 같은 팀으로 출전하기도 했다."
71,또 한 박 인수가 예전 리그에서 이중선 선수의 키보드 사용 방식을 따라했을 정도 [64] 로 좋아했다.
72,이후 2019 카트 라이더 리그 시즌 2 에서 서로 같이 사진을 찍는 모습도 볼 수 있었다.
73,"여담으로, 박 인수가 GK 소속이였을 때, 이중선이 GK에서 나왔다는 이유로 같이 나오기도 했다."
74,[65] 이중선과 이중선의 여자친구 빵이 지롱은 카트리그에서 문호 준 과 박인 수만 응원한다고 한다.
75,참고로 빵이 지롱은 박인 수가 20 시즌 1 개인 전에서 80점을 먹고 2 라운드에 못 올라가자 울었다고
76,한다.
77,박인 수가 개인방송에서 이중선을 따라하며 주행하기도 했다.
78,"# 성 대모 사, # 파 지법 방송 중에 서로 클럽 전에서 상대로 만났는데 박 인수는 식 박 듀오라고 반가워하며 클럽 전을 같은 팀으로 같이 돌렸다."
79,방송 중에 둘이 클럽 전에서 만났는데 식 박 듀오라고 서로 반가워하며 클럽 전을 같이 돌렸다 김 동호 : 미 스틱 길드 마스터이다.
80,방송에서는 별다른 접점이 없지만 미 스틱 클럽 회식에는 종종 참여하면서 미 스틱 클럽 원들과 연을 이어 가고 있다.
81,[66] 신동이 : TriplePerfect와 MysTic 클럽에서 함께 했던 사이. 최근 카트 라이더 러 쉬 플러스로 이어 달리기 컨텐츠를 했다.
82,박 천원 : 많은 사람들이 알다시피 듀얼 레이스 3 당시 박 천원이 먼저 이중선과 같은 팀을 하고픈 마음을 내비쳤고 이중선은 신중하게 생각하고 이 중대와 같은 팀으로 하는 조건으로 복귀하여 같이 이 중대 팀으로 들어갔다.
83,그러나 얼마 후 박 천원은 황 선 민 팀으로 들어가기 위해 길드 쪽에서 길드 원과 같이 나가라는 핑계를 대고 그럴 바엔 리그를 안 나겠다는 형식적인 핑계를 대고 이중선을 포함한 나머지 팀원들에게 통수를 때라고 이 적하였다.
84,다음날 박 천원의 비번 방송이 새나오면서 크게 논란이 됐었고 멘 탈이 터질 대로 터져 폭로방송까지 켰으나 1년 후 2019 시즌 1 결 승전 때 박 천원이 이중선을 찾아와 사과하였다 하였고 그 후로 유영 혁의 제안으로 둘이 같은 팀이 되었고 처음에는 어색하였으나 완전히 화해하였으니 사이 좋게 지내는 것으로 파악하였으나 박 천원이 리그 영구정지를 당해 최종적으로 같이는 출전을 못하였다.
85,"그러나 이재성 감독, 영정 듀오 유은 호와 함께 프릭스의 연습을 도와주고 있다."
86,주로 아이템 전이라는 것이 함정이 긴 하지만 박 천원은 코치로 합류하여 숙소에 들어오기도 했으니 사이좋게 지낼지도 있었지만 최근의 사건에서 OneQ 클럽의 잘못된 친목질로 여러 선수들에게 물의를 일으켰기에 사이좋게 지내는 것은 불가능에 가깝고 설령 친하게 지내더라도 쌍둥이 형인 긍정 인과의 관계는 여전히 좋지 않아 이중선과는 서로 손절할 정도는 아니지만 다시 친하게 지내기에는 어려울 것으로 보인다.
87,"유영 혁 : 이중선이 소속되어 있었던 아프리카 프릭스의 주장 이자 한때 Mystic 클럽에서 함께 했던 사이다. 이중선 본인이 "" 유 영 혁은 그래도 믿을 수 있는 사람이다."
88,""" 라고 말할 정도로 신뢰를 보내던 사이였지만 전술한 2020 리그 시즌 1 멤버 결성 과정에서 유영 혁의 소통 불응으로 인한 불화가 생겼다."
89,이중선 본인의 말로는 1차 방송 직후 연락을 취해 서로 오해를 풀고 잘 해결했다고
90,는 하지만 예전처럼 친한 사이를 유지할 수는 없을 것으로 보인다.
91,3주 동안 읽씹하다가 방송 한번에 사과하는 태도는 대체.. 자 세한 내용은 위의 문서와 유영 혁 문서를 참조. 전 대웅 : 트리플 시절에 같은 팀원이었으며 17 차리그에 Hack 이라는 팀으로 출전하였으며 이후에 친선과 길드 대회 등에서 1 군으로 항상 출전을 같이 하였으며 전 대웅이 트리플 분열을 일으켰을 때도 전 대웅 편을 들어주었을 정도였다.
92,하지만 듀얼 레이스 1 팀 결성 과정에서 전 대웅에게 배신을 당하며 관계가 멀어 졌고 최근에는 상술된 사건이 벌어진 데 다가 심지어 전 대웅과 관련된 한 가지 사건이 더 본인 귀에 들어간 이후 두 사람은 서로 손절하며 제대로 불구 대천 관계가 되었고 다시 화해할 가능성은 절대 없으며 사실상 관계가 파토 난 셈이다.
93,"[67] 빵이 지롱 : 이중선의 여자친구 이자 이중선 트위치 방송 매니저, 그리고 지롱 지롱 클럽 마스터이다."
94,아주 가끔 이중선이 스트리밍할 때 목소리로 등장하거나 이중선 채널로 실시간방송을 하면서 지롱 지롱 클럽 원들과 아이템 전을 하는 모습을 보여주었다.
95,"키보드 파 지법이 특이한 데, 일반적인 선수들처럼 좌측 시프트에 손을 올리는 것이 아니라 우측 시프트 키에 손을 올리고 게임을 한다."
96,때문에 옛날 온 게임 넷 시절에 선수들의 모습을 한번씩 비춰 주거나 할 때 이중선을 잡아 주면 매의 눈을 부릅뜨고 살벌하게 주행하는 모습과 동시에 손을 다소곳이 모으고 게임을 하는 모습이 대비되어 묘한 매력을 불러일으켰다.
97,"이와 똑같은 파 지법을 사용했던 선수로는 박 건웅, 박 인수 등이 있다."
98,요즘에는 이중선이 캠을 자주 키다 보니 이 파 지법을 자주 볼 수 있다.
99,"갑작스럽게 R 키를 누를 때 위치를 쉽게 찾지 못하고 R 키 근처를 샷 건 수준으로 내려치는 모습을 볼 수 있다 최근 "" 주행은 XXX"" 하면 많은 선수들이 떠오르지만 그 시조새는 이중선이다."
100,이름을 이용한 말장난이 많다.
101,"선수들이나 팬들이 이중선을 지칭할 때 "" ㅣ ㅣ"" 등으로 표현하는 경우가 많다."
102,선수들 끼리
103,"연방을 진행할 때 누군가 ' 몇 선?' 이라고 물어보면 가차 없이 ' 이중선' 이라 받아치고, 절 친 박민 수가 테일 램프 리뷰를 할 때 "" 선이 두 개 이중선""(...) 이라고 하였다."
104,좌표 의외로 이중선 외에 이름이 ' 선 '으로 끝나는 카트 라이더 선수가 많이 없긴 하다. 골든 파라 곤 9을 뽑는데 34만원을 썼다.
105,절 친 박 민수와도 이 중대 못 지 않게 스펙타클한 일화가 여러 개 있다.
106,"드래곤 볼 온라인이 서비스 했을 무렵, 박민 수가 이중선에게 같이 하자고 했는데 어느 서버에 캐릭을 만들지 말을 안하는 바람에 서버가 엇갈리고 말았다."
107,"워낙 레벨 업하기 힘든 게임인지라 이중선은 밤새 드온만 해서 겨우 레 벨 10을 찍고 박 민수에게 "" 우리 언제 만 나? 왜 안만 나 져?"" 하고 문자를 보냈고 이에 박 민수는 "" 레벨 20 찍어야 만날 수 있어 ""라고 거짓말을 했다."
108,"이중선은 그걸 또 믿고 밤 새서 레벨 20을 찍었는데 그제서야 뭔 가 이상한 걸 느끼고 "" 우리 서버 달라? ""라고 물어봤다."
109,"그리고 박 민수는 "" 중선 아 미안해"" 라고 답했고 그 길로 두 사람 다 드온을 접었다."
110,"또 다른 일화로는 박민 수가 그랑프리에서 이중선의 점수를 올려 주려고 앞에 달리 던 사람이 이중선인 줄 알고 보내주고 뒷사람을 계속 막았는데 알고 보니 뒤에 달리 던 사람이 이중선이었다(...). 게임 톡을 쓰고 있던 박 민수는 계속 "" 중 선아 뒤에 막았어!"
111,"""라고 말했지만 게임 톡을 안 쓰고 있었던 이중선은 게임이 끝난 뒤에야 막은 사람이 본인이라고 말할 수 있었다고..."
112,"2017년 4월 박 민수와 이중 대가 친선경기를 하던 도중 박 민수의 방에 이중선이 들어오자 "" 중 선아 우리 드래곤 볼 온라인 할래?"
113,"""라고 말을 꺼내며 이 썰 들을 풀자 이중선은 채팅 창에 들을 때마다 빡 치네"
114,X 발이라는 말로 화답했다.
115,정말 친하지 않으면 이렇게 욕을 박아 줄 수도 없다.
116,해당 영상. [71] 제일 좋아하는 캐릭터는 잠옷 코스튬을 입힌 배 찌다.
117,유 튜브 수입이 회사 수입보다 더 많다고
118,한다.
119,월 1000?20 대 중반까지 체중이 40kg대로 심각한 저체중이었다.
120,체중 때문에 공익근무요원으로 병역을 마쳤다.
121,소집 해제 이후 20대 후반이 되며 살이 좀 쪄서 60kg를 넘기긴 했지만 그래도 저 체중이다.
122,프릭스 게이트 사건으로 인해 현재 회사에 복직을 하지 못하고 있다고
123,한다.
124,"사정을 처음으로 밝힌 영상 [72 ]에 따르면 이중선이 2019 시즌 2에 나올 수 있었던 이유는 회사 사장님이 좋은 분이라서 리그 시즌에는 휴직계를 내고, 리그에 집중할 수 있도록 계약 직을 뽑았다고"
125,한다.
126,"하지만 위에 서술된 사건으로 리그에 나가지 못하게 되었고, 회사에 다시 복직을 하게 되면 현재 회사에서 뽑은 계약 직사원은 하루아침에 실업자가 될 수도 있기 때문에 2020년 8월까지 는 회사에 복직을 할 수 없다고 한다."
127,"덕분에 유저들과 팬들, 카트 라이더 커뮤니티 등은 유 튜브라도 키워 놔서 다행이라는 반응을 보이고 있다."
128,"손 흥 민에게 "" 달리기가 빨라서 가망이 없다"" 고 했다."
129,"[73] 자신의 유 튜브용 녹화 컨텐츠 진행 중에 신종 민이 저격해 들어왔는데, 신종 민의 실력을 보고 "" 오 저 분 되게 잘 달리 신다."
130,"근데 달리는 걸 보면 프로는 아니고... 일반인 최강자 정도?"" 라고 하며 자기도 모르게 신종 민을 디스해 버렸다."
131,"또 저격당했다는 사실을 알자 자기도 내심 신경 쓰였는지 그 다음에 올린 영상 인트로에 "" 밥 종 민 같은 애들이 저격할 수도 있기 때문에"" 라고 말하며 확인 사살(...) [74] 카트 선수들 중에 호감 가는 선수를 꼽을 때 다섯 손가락 안에 든다고 한다."
132,카트 리그 관계자들이나 팬들이 카트 판에서 손에 꼽는 보살 중 한 명이다.
133,"본인이 "" 남에게 피해를 주는 것을 싫어한다"" 고 말하기도 했었고 수많은 통수를 당했지만 트리플 퍼펙트나 프릭스 관련 일을 빼면 최대한 사건을 키우지 않는 편에서 해결하려고 했으며, 항상 몇몇을 제외한 악플이나 생방송 분탕 채팅에도 매우 관대한 편이기 때문. 최근에는 자신이 불쾌할 수도 있는 ' 식칼 좌' 같은 별명도 "" 여러분이 웃기기만 하면 저는 괜찮습니다."
134,"""라고 하며 인성을 다시 한번 확인하였다."
135,골든 파라 곤 SR-R을 가지고 있다.
136,연타 드리프트를 2 달 반동안 쉬지 않고 약 47만 번을(...) 한 적이 있다고
137,한다.
138,[75] 크로노스 X를 뽑을 때 1 단계를 싹쓸이했다... 유 튜브 업 로드 속도가 말이 안 될 정도로 빠르다.
139,"프로 라이센스, 신 차 리뷰 등 패 치가 되면 방송으로 패치 내용을 리뷰를 한 뒤 얼마 되지도 않아서 유 튜브에 해당 영상이 업 로드 된다."
140,이 때문에 사장님 닮아서 편집자도 편집 속도로 타임 어택을 한다는 드립도 있다.S1
