,sentences
170,"[28] 특히 2018년 현재 국제대회에서 대다수 한국 팀 정글 러의 부진이 두드러지고 있는 바람에 중국 팀의 강세가 지속되고 있는데, "" 한국 팀 정글 러는 모두 예상가능하고 뻔한 플레이를 한다"", "" 플레이 메이킹을 할 줄 모른다"" 라는 혹평을 받는 점을 생각하면 극단적인 공격성과 갱 킹 성공률, 한 타에서 예상치 못 한 이니 시 등 상대의 허점을 찌를 수 있는 강점을 지닌 그의 빈자리가 어쩌면 더더욱 아쉽다."
171,왜 은퇴한 거야 2016.01.14 아프리카 TV Best BJ 자격을 얻었다.
172,[29 ]2016.01 .22 아프리카 TV 프로 게이 머 BJ 등극 2016.04.03 아프리카 TV 랭킹 1위를 달성했다.
173,매번 2등만 하다가 드디어 1등을 헀 다 .2016.07 .29 아프리카 TV 파트너 비제이자격을 얻었다.
174,의외로 담담하게 반응하였다.
175,미리 알고 있다는 듯한 반응이었다.
176,시작 방제도 중대발표라고 썼다.2016
177,"년도 아프리카 BJ TOP20 게임부분 수상 2017 아프리카 TV BJ 멸망 전 준우승 2017.12.29 아프리카 TV e 스포츠 부분 올해의 BJ 수상 2018 아프리카 TV BJ 멸망 전 시즌 3 ' 호진 민 교 꿀 데 지' 정 글러로 출전, 생애 첫 우승 달성 문화 체육관광 부& 한국 콘텐츠 진흥원 소재 e 스포츠 명예의 전당 선정 2018 아프리카 BJ 멸망 전 올스타 IN 지스타 준우승 2018.12.28 아프리카 TV e 스포츠 부분 올해의 BJ 수상 보통 오전 10 ~ 11시 사이에 방송을 켜면 시청자 분들이 "" 호하"" 로 도배하며 반겨 준다."
178,이때 챗으로 답장을 해 준다.
179,무요 팍 씨 ㅡㅡ 그리고 방송 시작은 항상 시청자 참여 컨텐츠로 시청자와 함께 롤을 한 두 판 플레이한다.
180,"손 풀기 이후 쭈욱 롤을 플레이하는 경우가 대부분이며, 중간 중간에 먹 방과 토크방송을 진행하기도 한다."
181,"롤 챔 스가 있는 날에는 5 ~ 6시에 롤을 종료하고, 중계를 하거나 다른 게임을 하거나 방송을 종료한다.2018"
182,멸망 전 시즌 3 이후로 컨텐츠와 방송시간에 변화가 있게 되었다.
183,"주로 저녁방송을 하며, 저녁부터 시작해서 아침까지 오래 방송하는 편이다."
184,이전만 해도 홀로 솔 랭 방송하는 것이 주 컨텐츠였으나 멸망 전 이후로는 다양한 BJ 분들과 어울리며 게임을 하는 편이다.
185,"특히 같은 멸망 전 팀 앵 지, 데스 티니, 민 교 등과 스팀게임 등 다양한 게임을 하며 놀았는데, 많은 인기와 호평을 끌었다."
186,형님들 말 끝마다 붙인다
187,"예 에에 에에 ↗↗? 대가 뤼!!! 시 X, 이게 무슨 게임이야 형님들 이게 사람 새 x 들입니까?"
188,개 트롤 그냥 어( 씨익 씨익) 이게 이게 그... 오호... 억울합니다.
189,저는 피해자입니다.
190,[30] 특유의 입담과 게임 내 상황이 워낙 다양한 지라 방송은 매우 재밌다.
191,"[31] 다만 비속어 사용으로 점철되고, 자극적인 컨텐츠로 별 풍을 유도하는 방송은 아니라는 것. [32] 모 탈: 말 그대로 이다."
192,문어: 모 탈 조 토 진: 프레이가 처음 불렀다고
193,한다.
194,"이후 프레이, 스멥, 쿠로가 자주 부르는 별명이 되었다."
195,아사다
196,마 오: 인 벤 기사에 의하면 아사다
197,마 오와 붕어빵이라고 한다.
198,참고로 이 기사의 제보자는 친목 왕 고릴라로 추정된다.
199,이재 균: 전 웅진 스타 즈 감독이 자 현재 케 스파 경기 위원회 위원장을 맡고 있는 이재 균과 닮았다는 소리를 듣는다.
200,다만 스 1을 보지 않은 사람들에게는 익숙하지 않은 사람이기 때문에 전용 준 캐스터 정도가 언급하는 정도이다.BJ
201,노 스마
202,: 용싸움이나 바론 싸움이 열릴 때마다 스마
203,가 없거나 스마
204,싸움에서 진다.
205,2020 봄 시즌 멸망 전 때 붙여진 별명이다.BJ
206,고치 킹: 엘리스로 좋은 모습들을 많이 보여주어서 붙여진 별명이다.ㄴ
207,"ㄱ ㅈ ㅇ ㅅ, ㅇ ㅁ ㅇ ㅅ: 2020 봄 시즌 멸망 전 때 스멥과 프레이가 많이 쓰던 말이 이제는 호진 방송의 채팅 창에서 하나의 밈이 되었다."
208,임 혜 진: 불편한 발언 [33 ]으로 인해 그것을 메우라고 수정하였는데 시청자들이 이것을 참조하여 이 호진에서 호를 메로 바꾸어 이 메 진이라 불리게 되었다.
209,어느 순간 이 메 진에서 임혜진으로 변형되었다.
210,"모기: 주로 합방 없이 혼자서 방송하다가 2020년 상반기부터 대기업들과 합방을 하고 탐방을 하게 되었는데, 그 부분에 대해서 의식하고 있는지 자기 자신을 모기라고 칭하고 있다."
211,하지만 시청자들은 극락을 외칠 만큼 이러한 컨텐츠를 즐겨 보고 있다.
212,시청자 수도 그전에 비해 눈에 띄게 상승했다.
213,"프로 게이 머 시절 때의 팬들은 그냥 노안, 그리고 이적 후 팀의 유니폼 등과 맞물려 교장 선생님, 도덕 선생님, 부장님 호부장 등으로 놀리고 있다."
214,"스멥, 쿠로, 위즈덤은 학생 혹은 신입사원 그러고 보니 셋 다 IM 출신 배틀 그 라운드가 흥행하기 전부터 배 틀 그라운드방송을 한 시초 격 이자 최초 BJ 이다."
215,"실력은 미필치고 상당한 수준이며, 미션 성공률이 높은 편이다."
216,여타 다른 배 틀 그라운드 BJ와는 달리 시청자 참여가 활발하게 이루어지는 편이다.
217,한 때 롤 방송과 비슷한 시청자 수를 유지하는 등 잠깐 흥했으나 본인이 어지러움을 많이 느끼는지 최근 들어서는 잘 안하는 듯하다.
218,배틀 그라운드와 마찬가지로 오버워치가 나오자마자 플레이하였다.
219,"게임에 재능이 있었던 건지, 시즌 1부터 바로 랭커를 찍었다고"
220,한다.
221,이후에도 아프리카 BJ 멸망 전에 활발히 참여했으며 방송적으로도 열심히 하였다.
222,"최근에도 롤 방송 종료 후, 오버 워 치를 플레이하는 등 컨텐츠적으로 이어 가고 있기는 하다."
223,"여담으로, 라인 하르트를 자신 있어 한다."
224,워낙 게임을 좋아하다 보니 본인이 게임을 이것저것 즐겨 보는 편이다.
225,"[41] 하스 스톤, 스타 크래프트, 포트 나이트, 스팀게임 ( 그림 던, 데드 바이 데 스트, 아웃 라스트 ,VRchat 등등), 월드 오브 워크 래프트, 디아블로, 라 그 나로 크, 검은 사막 모바일 등등 안 해본 게임이 없을 정도로 왠 만한 게임은 다 방송에서 손을 대봤다."
226,특히 RPG 장르 게임을 굉장히 좋아한다.
227,문제는 빠른 손 절.... 하루 이틀간 다 ㄹ ㅇ 진성 마니아 여서 인지 손대는 게임마다 발군의 게임 센스와 재능을 보여주는 편이다.
228,[42 ]2020 년 7월부터 는 VR 장비와 함께 VR 컨텐츠를 진행 중이다 아노쨩을 찾아서
