,sentences
456,"플레이 도중 지금까지 플레이했던 캐릭터끼리 싸우는 상황이 생겼는데, 여기서 플러리는 이기게 해 줄 캐릭터를 골라 QTE를 성공시키는 선택을 한 게 아니라 질 캐릭터를 골라 QTE를 모조리 다 실패하는 발상을 보여주며 트수들이 뒤집어 졌다."
457,스타 크래프트도 2020년 하반기에 들어서 플레이하는 빈도가 늘어난 편이다.
458,"상술한 헬 포 디부터 시작해 11월에 진행된 철 플록과, 블 리 자드 트라이 애슬 론을 기점으로 래더 또는 유즈맵을 종종 플레이하기도 한다."
459,"김 명운의 유 튜브나 방송을 챙겨 본다고 방송에서 언급한 적도 있으며, 크랭크 피 셜로는 카드 쟁이 들 중에서 스타를 가장 좋아한다고 말할 수 있는 수준. 팬 덤의 이름은 응애 세력 [27] 낮의 하스 스톤 시간에는 주로 돌 크리 트들이 자리를 잡는다."
460,"어느 방에서 나 보이는 돌크리트의 특징인 서 순에 민감하다는 것, 아만 보, 물음표 채팅 등등이 똑같이 드러난다."
461,"추가적으로, 플러리가 유행어 메이커이다 보니 물타기와 도배가 흔하다."
462,"사실 유행어 메이커가 본인이 되고 싶어서 그런 게 아니라 말을 하다 보면 시청자들이 특정 단어나 대사에 꽂혀서 그걸 계속 채팅과 도네로 난 사해 반 강제로 유행어로 만들어 버린다 [28]. 다만 꾸준하게 등장하는 플러리가 싫어하는 채팅이나 도네 [29] 도 있는데, 이 경우는 진짜로 유행어가 된다."
463,플 러 리가 유행어나 추임새를 말할 때도 마찬가지로 다같이 그 단어를 친다.
464,"소 솨 소 솨, 이히히 등등 2 부 게임 인기와 딴 겜 무 새/ 노 잼 무 새의 수는 비례하는데, 그 수가 너무 많아 지면 플러리가 한 소리 하게 된다."
465,"방송 시청자가 늘어 남에 따라 어 그로가 많아 졌지만, 채팅 방 룰을 만드는 등 플러리는 그런 변화에 점차 대처하고 있다.2020"
466,"년 7월 기준으로 ' 노자리', ' 훌렁이', 자는 이모 티 콘 (ResidentSleeper )를 치면 자동 채금이니 주의하자 .2020 년 8월부터 윗 상단에 제시된 자는 이모 티 콘 (ResidentSleeper) 이 금지어에서 풀려 다시 사용할 수 있게 되었다."
467,하지만 너무 남발하지는 말자.
