,sentences
0,레고 창작가 겸 유 튜브 크리에 이 터. 과거 아프리카 TV에서 활동을 시작했으며 현재는 유 튜브에서 활동한다.
1,"게임, 만화, 웹 툰, 애니메이션 등지의 각종 캐릭터를 레고로 창작하고 조립 팁 등을 소개하며 각종 패러디를 넣어 재미있게 리뷰하는 컨텐츠를 제작한다."
2,""" 채소 골 렘"" 은 BJ 은 제 골 렘이 지어 주었으며 과거 서로 같이 아프리카 TV 방송을 몇 번 했었다."
3,본인의 닉네임이 없어 고민하던 중 그 당시 아는 지인 분의 채소가게에서 알바를 뛰고 있던 때 라 지어 주었다고.
4,"과거 주식도 하고 돈 좀 만지던 시절 인터넷 쇼핑을 하던 중 비싼 장난감이라는 게시 글을 발견하게 되고 레 고가 단종되면 가격이 뛴다는 내용을 보게 되고 비싸거나 잘 팔리는 제품위주로 구입해, 가격이 오르면 되파는 레 테크를 했었다."
5,그러다 그리드라는 창작가의 다 간 X 창작품 게시물을 보게 되며 레고에 대한 새로운 인식이 박혀 사재기를 청산하고 창작을 시작하였다.
6,팀 레 크닉이라는 레고 창작 팀 소속이었으나 팀이 공중 분해된 것이나 마 찮 가지인 현 상황에서는 의미가 없어 보인다.
7,스트 리머 우왁굳의 팬이다.
8,#
