,sentences
0,""" 아 늑한"", "" 친밀한"", "" 은밀한"" 이라는 의미의 영어 단어. 주로 영국에서 사용되며, 미국에서는 Cozy 라는 형태로 사용된다."
1,"일본어로 누룩.' 곶' 의 제주 방언 앞 한자는 弘, 耕, 浩, 幸, 光, 孝 등등. 뒷 한자는 二, 司, 次 등등 수많은 한자를 코 우지라고 읽을 수 있다."
2,물리 엔진 유 튜버 코지가수 와 다 코지게임 음악가 하야 마 코지 게임 음악가 콘도 코지게임 제작자 이 가라 시 코지 니트 인터넷 방송인 나가 이 코 우지 고전 만화 리뷰 유 튜버 코지만 화가 세 오 코지만 화가 쿠메 타 코지 만화 잡지 편집자 요 시다 코지배우 나 카 무라
3,코지 셰프 나 카 무라
4,코 우지 [1] 배우 세 토 코지 야구 선수 아 키 야마 코지 야구 선수 야마 모토 코지 성우 이시이 코 우지 성우 유사 코지 성우 츠지타니 코 우지 성우 토 타니 코지 성우 하라 마 키 코지 코메디 언 나 카 모토 코지 KUSH 가면 라이더 J의 세가와 코 우지 모형 전사 건 프 라 빌 더 즈 : 비기 닝 G의 코 우지 마 츠 모토 신혼합체 고단 나의 코 우지 테 츠야 나의 히 어로 아카데미 아의 코다 코지도 박 묵시록 카이지의 이 시다 코지 디지몬 프론티어의 미나 모토 코 우지( 한 국명: 선우 현) 마 징 가 Z의 카 부토 코 우지 무장연금의 로쿠 마스 코 우지 무한의 리 바이어스의 아이 바 코 우지 바람의 계승자의 사이죠
5,코 우지 바쿠만의 요시다 코지 바텐더의 소마 코지 사야의 노래의 토 노오
6,코 우지 아이 실드 21의 쿠로 키 코 우지 에어 마스터의 오가 타 코 지영 제로의 오가 타 코 우지 다이아( 걸 그룹) 메인 보컬 이주 은의 샴 고양이 코 지용과 같이 시리즈의 신도 코지 외모 지상주의의 코 우 지은 혼의 요 시다 코지 절대 무적 라이징 오의 호시 야마 코 우지카드 파이트!! 뱅가드/ 코믹스의 이부 키 코 우지 코드: 브레이커의 코지 (C ØDE :BREAKER) 토라도라!
7,의 하루 타 코지 프리티 리듬 레인 보우 라이브의 미 하마 코 우지 피아 캐롯에 어서 오세요!
8,2의 마에다 코 우지 X-Change의 쿠도 코 우지 Yes! 프리 큐어 5의 코 코다 코지
