,sentences
0,아프리카 TV 와 유 튜브에서 활동하는 인터넷 방송인이다.
1,前 NNA[6] 소속 하스 스톤 게이 머. 前 트위치 스트 리머. 종합게임 방송을 주력으로 다양한 게임을 시도하고 있다.2014
2,"년 11월 13일, 게임 부문( 하스 스톤) 베스트 BJ2016 년 3월 1일, 아프리카 TV 컴백 .2016 년 7월 15일, 게임 부문( 하스 스톤) 베스트 BJ2016 년 12월 15일, 2016 아프리카 TV BJ 대상 대표 BJ 50 인 .2017 년 6월 7일, 파트너 BJ 2017년 12월 29일, 2017 아프리카 TV BJ 대상 종합게임 부문 수상 .2018 년 12월 28일, 2018 아프리카 TV BJ 대상 종합게임 부문 대상 수상 .2019 년 12월 27일, 2019 아프리카 TV BJ 대상 종합게임 부문 대상 수상 .2020 년 6월, 샌 드박스 네트워크에 합류 .2020 년 12월 24일, 2020 아프리카 TV BJ 대상 종합게임 부문 대상 수상. 내가 재능은 없지만 근성이 승리한다는 걸 꼭 보여줄게."
3,"엑스 컴 2: 선택된 자의 전쟁 전설 철인 켠 왕 중 100 번째 지구 [7 ]를 들어가며 선견자, 맘 가 비룡과 정자 말리, 거 흑 장인으로 유명하다."
4,"또 한 방송을 할 때 예능덱을 자주 만들어서 인지 덱 짜는 실력도 상당히 좋은 편. 주로 시즌 초 전설을 달 때는 어 그로 스랄이나 토큰 드루, 정규 전 전에는 미드 노루, 멀 록 기사 등 최상위덱이 아닌 덱으로 1 급 5 성을 달성한다."
5,그 후 전설 승강 전은 2017년 정규 전 기준 성기사의 죽음의 기사를 이용한 덱( 통칭 - 액 조 디아 덱 )으로 전설을 달성한다.
6,단 후에는 자신이 직접 덱을 만들어 다양한 덱을 돌린다.
7,"1991년 생으로 따 효 니와 룩 삼, Dawn, 얍 얍 과 나이가 같다."
8,심지어 룩삼과는 생일도 같다고
9,한다.
10,방송시간은 특별한 일이 없을 경우 오후 8시부터 새벽 2시 ~3 시까지 진행한다.
11,[8 ]2017 년 주 방송 컨텐츠는 하스 스톤이다.
12,하스 스톤 비제이라는 강박관념과 다양한 게임을 하는 종합게임 BJ로 발돋움하기 위해 다양한 게임을 한다.
13,2018년에는 하스 스톤의 비중이 조금씩 줄어들다가 본인이 유 튜브에 하스 스톤을 완전히 끊는다고
14,영상을 올리며 이제는 종합게임만을 하고 있다.
15,그리고 고양이 두 마리를 키우며 가끔 고양이 방송도 진행하기도 한다.
16,스팀 평가가 안 좋은 게임똥겜들을 진행하기도 한다.
17,"채팅 창은 매니저를 갈아 넣어서 클린한 편이지만 일종의 "" 선을 넘지 않은"" 어 그로 성 글을 자주 읽기 때문에 이에 따른 물타기가 많은 편이다."
18,가끔 이러한 물타기가 심각 해져서 일이 터지는 경우가 있는데 물타기로 번졌을 때에도 빠른 채팅 중에 어 그로 성 글을 읽거나 일종의 관심을 주기 때문에 잘 진압이 안되기도 한다.
19,"이런 면에선 대처가 미흡한 편. 최근 이러한 어 그로 끌림이 심해 지고 있어 팬들 입장에서는 불안한 상황. 게임 중이나 한 게임이 끝나고 다른 게임으로 넘어갈 때 "" ㄴ ㅇ ㅂ ㅈ""( 내일 보자) 채팅을 보면 힘이 빠지며 ' 방 종을 해야 하는 건가?"
20,' 같은 생각이 든다며 자제를 부탁했으나 이때 방송을 보지 못한 시청자나 봤음에도 신경을 쓰지 않는 시청자들은 여전히 이를 사용한다.
21,일부 시청자들은 이를 놀아 보자 라며 타요를 달래기도 한다.
22,최근 보면 당시 만큼 크게 신경을 쓰지는 않는 듯 보인다.
23,타 새요 끼 : 타요
24,새끼를 변형한 단어. 턱 돌이 : 자세한 것은 위의 사진 참조. 타요
25,"본인도 자신의 운을 시험할 때 "" 나는 턱 돌이다!"
26,"""를 말한 적이 있다."
27,자매 품으로는 룩삼의 코가 있다 맘 가 비룡 : BJ 리그에서 슬 시호를 상대 하는 중에 맘 가를 사용 후 전력 질주가 아닌 비룡을 사용하는 클릭 미스로 인한 별명. 길 잃은 타요
28,: 하수인 카드 길 잃은 타조의 이름에서 따옴. 블 로 우잡 타요
29,"[23] : B-blow J-job 타요에서 따옴. 불꽃의 토템 : HCC에 차 봉으로 참여하여 본인은 패배하고 선 봉과 중견이 이겨, 양옆의 하수인은 공격력 +2를 주고 본인은 아무런 데 미지도 없는 불꽃의 토템을 연상시킨다고 지어 진 별명. 10월 6일 NNA와 Overload 팀의 경기에서 타요를 제외하고 3:1 로 모두 이기면서 다시금 버프를 증명하였다."
30,뒤틀린 오지호 : 연예인 오지호를 미묘하게 닮았다고
31,하여 붙여진 별명. 도마뱀 새 x : 졌을 때에 이런저런 변명을 하며 말 돌리는 것이 도마뱀 꼬리를 자르는 듯 하다 하여 룩 삼이 붙여 준 별명. 선견자 타요
32,": 2014년 한중 마스터 즈 국가 대표 선발전 1 일차 경기에서 ' 페가 소스' 심규성 선수를 상대로 필드에 많은 하수인을 전개하고 8의 체력과 3의 마나를 남겨 둔 상태로 대지 고리 회 선견자를 내지 않고, 20% 의 확률을 뚫고 본체를 가격한 라 그나 로스에게 패배한 아쉬운 사건 이후 불리게 된 별명 타개 소환 사 : 9월 21일 HCC, 하필이면 타 요가 직관을 한 날 NNA 선수들이 미친 경기력으로 승리해, 마치 주술사 전설 카드 안개 소환 사처럼 팀원에게 버프를 준 것 같다고"
33,"하여 얻은 별명. [24] 타 완 용 : 블 리 즈 컨 아시아 국 대 선발전에 진출한 크라 니 쉬가 일본의 Kno 선수와 대결 할 때, Kno가 승리 시엔 신나 하고 크라 니 쉬가 이길 땐 시무룩 한 행동을 보이는 것을 보며 시청자들이 매국노-> 타 국 노-> 타 완 용으로 이어진 별명. 우리 일본이라는 말을 사용하였다."
34,[25] 전설 측정기 : 매 시즌마다 빠르게 전설을 찍고 예능덱을 플레이하는 타 요의 특성 상 날이 갈수록 등수가 떨어지는지라 [26] 레벨 업 타 요가 3000등이라면 전설은 3000명이 있다는 단순한 공식으로 전설등급의 유 저수를 측정이 가능하다 하여 붙게 된 별명. 내열 빛 폭 : 10월 12일에 있던 인 벤 HCC 경기에서 4 세트 Nuguya를 상대로 필드에 이 세라가 홀로 남은 상황에서 내열을 사용하고 필드를 정리하려는 듯이 빛 폭탄을 핸드에서 필드까지 거의 내놨다가 정신을 차리고 내려놓은 타요를 말한다.
35,"빛 폭탄을 사용하고 내면의 열정을 사용했다면 추가 드로 우인 깨어난 이 세라로 이길 수 있는 판이었지만, 이 실수로 살아남은 상대의 하수인들의 공격력에 영웅의 체력이 정확히 0이 되면서 패배했다."
36,하지만 5 세트라면? 타방 망 : 타요
37,방송 망했음 의 줄임말로 방송을 켠지 얼마 되지 않아 시청자가 적은 상태에서 타요를 놀리기 위해 채팅 창에 자주 나오는 별명. 착한 어린이라면 하지 말자 안 창살 : 본인의 이름 안 창현을 변형한 별명. 학창시절에 불렸다고
38,한다.X
39,밥 타선생 : 마스 카 개인방송에서 마스 카가 계속 지자 채팅으로 약올리던 타요를 증오의 8 인에서 가장 먼저 떨어진 걸 들먹이며 마스 카가 장난 식으로 집 밥 백선생을 패러디해 응수 했다.
40,창 내 : 고등학교 때 불렸던 별명. 등교하다가 지각을 했는데 날이 더워서 냄새가 심해서 이렇게 불렸다 한다.
41,"타 오후 : 하스 스톤 대화 해설을 맡게 되어, 방송을 통해 타 요의 본 모습을 볼 수 있는데 살이 꽤나 찐 모습을 본 시청자들이 타요"
42,+ 파오 후= 타 오후라고 부르고 있다.
43,배비 : 트위치 미국에 갔다온 사이 베스트 BJ를 잃자 다시 베스트 BJ가 되고 싶다며 노래를 부르자 시청자들이 지어 준 배신자 비제이 or 배 나온 비제이를 줄인 말 .100o : 별 풍 1000개 미션에서 선입 금으로 100개를 받은 후 기적 같은 승리로 입금을 기다리는데 미션을 제안한 청자가 오지 않았다.
44,알고 보니 100o 개 미션 였다 고... 타기 견 : 위에 서술된 별 풍 1000개 미션에서 통수를 당한 후 현실도 피로 주인님은 올 거라는 맹목적 믿음으로 생긴 별명이다.
45,타 읍 : 트위치에서 많을 때는 4000명이 보는 스트 리머였던
46,타 요가 트위치를 놔두고 아프리카로 이적하여 언급을 할 때 타 요가 아닌 타 읍이라 불렀다.
47,정자 말리 : 9 코스트 때 킬 각이었으나 정신 자극을 쓴 후에 말리고 스를 내서 1 코스트가 부족해 킬 을 내지 못했다.
48,그리고는 코스트가 안되잖아
49,애들 아 라고 외쳤다... ㅋ ㅅ ㅌ ㄱ ㅇ ㄷ ㅈ ㅇ ㅇ ㄷ ㅇ # 마법의 주둥아리 ( 마 조동)( ㅁ ㅈ ㄷ): 타 요가 말하는 대로 족족 카드가 나와서 생긴 별명이다.BJBlow
50,Job 싸 요 : 하스 스톤 하다가 가끔 씩 이길 확률이 높은 판 도중에 이 게임을 패배하면 닉네임을 싸 요로 바꾸겠다고
51,한다.
52,하지만 아쉽게도 그런 선언을 했던 게임은 다 이긴다 ..BJ 육 변기 : 다음 배신할 장소로 옮길 때 쓰는 닉네임이라고 한다.
53,트위치 최 자타 요 : 오현 민 과의 오버 워치 1:1 대결 닉네임변경 빵을 패한 후 블 리 자드 닉네임을 트위치 최 자타 요로 변경한 것이다.
54,자신은 최강자라는 뜻의 최 자라고 하지만 사실 모두가 알고 있듯이... 다른 닉네임으로 바꾸는 걸 허락 받았으나 하스 스톤에 돈 쓰기가 싫어서 안 바꾼다고... 싸 요 : 틈만 나면 방송 도중 영상 틀고 화장실을 가거나 하스 스톤 멀리 건 화면이 멈춘 걸 보면 자주 화장실을 가서 붙인 별명. 턴 종 킬 각 : 타 요가 핸 파도적을 하다 딜 계산을 잘못하여 그만 부 끄사 해서 붙인 별명 타용 준 : 전용 준 이 게임 시작할 때 시작~~~~ 합니다
55,"하는 걸 타 요가 따라하면서 생긴 별명게임 엔딩 마스터, 게임 운전사 : 2018 아프리카 티비 BJ Awards에서 대상 수상을 할 때 소개 문구로 나온 별명 던 파 맨 : 던 전 앤 파이터를 즐기는 남자 타 요의 부캐 닉네임, 마미 손처럼 정체 분명의 비제이로 소개한다."
56,최근 부캐방송이 금지되어 던 파 맨의 정체를 밝혔다고.
57,타 요의 냥 스타 그램에서 볼 수 있다.
58,하스 스톤 방송을 할 당시 타 요의 예능 덱은 타요
59,본인의 입담과 개 드립의 엄청난 시너지를 일으켜 하스 스톤 방송으로 순간적으로 시청자가 1만명을 넘기는 기염을 토했다.
60,이 시청자 수는 종합게임을 하는 요즘도 유지된다.
61,[9] 대부분의 어 그로엔 관대하지만 자체적으로 어 그로 성을 띄고 있는 트위치 색 채팅은 금지하고 있다.
62,하스 스톤 하수인들의 성대 모사를 잘 한다.
63,그 중에 특히 잘 하는 건 미치광이 과학자. 별 풍선을 받으면 이해할 수 없는 리액션을 한다.
64,"물을 입에다 머 금고 바닥에 뱉는 꼬부 기, 에프 킬라를 이용해 화염 방사를 하는 파이 리, 침대에 누워 팔딱거리는 잉어 킹 등 제정신이 아닌 것 같은 모습을 보여준다."
65,이러한 리액션은 요즘은 하지 않는다.
66,하스에 비중을 크게 두었던 과거에 비해 종합 게임 BJ를 선언한 후 여러 장르의 게임을 하고 아프리카 내의 활동도 참여하다 보니 새로운 시청자들과 어 그로들이 많아 졌다.
67,그 때문인지 하루에 한 번 이상은 짙은 어 그로 성 채팅에 의해 짜증을 내곤 한다.
68,그 후에 내려간 분위기를 띄우려 하지만 캠을 켠 방송이다 보니 텐션이 낮아 진 게 눈에 보인다.
69,[10] 특히 재미에 관해 신경을 많이 쓰는 편인데 타 요의 말에 따르면 노 잼이라는 채팅이 조금만 보여도 밤에 잠을 못 이룰 정도라고.. 2 부 컨텐츠 게임을 선정할 때도 자신의 재미보다는 방송용 게임을 선호하는 편. 위의 문제만 제외하면 여러 장르의 게임과 활발한 유 튜브 활동으로 방송의 질 자체는 올라가고 있으며 다른 BJ 와의 교류도 시도 하고 있다.
70,방 밖으로도 나오고 있다.
71,위의 문단에 첨 언하자면 최근 들어 스스로 방송의 질을 떨어뜨리지 않기 위해 노력한다고 언급한 것처럼 과거 하스 스톤을 할 때보다 방송 중 텐션 유지에 노력하는 게 눈에 보인다.
72,어느 순간부터 살이 찌기 시작하여 현재 속칭 돼지라고 놀림 받는 수준까지 도달했다.
73,몇 년 전 방송의 타요
74,와 비교해 보면 상당히 많이 찐 것을 확인할 수 있다.
75,다이어트를 몇 번 선언하고 헬스장을 다녀 보기도 했지만 전부 실패하고 여전히 몸무게를 유지 중이다.
76,종합게임 방송을 하면서 게임 가뭄에 시달리기도 한다.
77,쉽게 말해 할 게임이 없다는 것. 방송을 안할 수는 없기 때문인지 여러 가지 똥게임을 가지고 와서 해보기도 한다.
78,주로 5 분하다가 끈다 이 때문에 얻은 별명이 똥 뮬 리에 종합게임 방송인으로서 후원을 받는다.
79,스팀 지갑에 게임 비용을 매달 100만원 가량의 지원금을 받는다고
80,한다.
81,사실상 종합게임 방송에서 게임 구매비용으로 지출이 아에 사라졌다고
82,해도 무방. 방송에서 진행한 아이 큐 테스트의 결과 상위 60% 인 IQ 96 / 94 / 95 이 나왔다.
83,"하위 40% 문제가 된다고 생각되는 특정 시청자를 지목해서 매니저로 올리고, 그 시청자를 공개적으로 심문하여 다른 여러 시청자들에게 뭇매를 맞도록 유도하는 행위, 일명 마녀 사냥이 논란이 되고 있다."
84,"채팅 창이 타요를 비판하는 쪽으로 물타기 되거나 한 시청자가 어 그로 성 채팅을 한 경우 방송 도중 그 사람을 매니저로 올리고 무엇을 어떻게 왜 해야 하는지 육 하원 칙에 맞춰서 말하지 않거나 수차례 질문의 답변에 대한 역질 문을 하다가 조금이라도 틀린 구석을 발견했을 시, 혹은 어법이 맞지 않거나 본인이 해석하지 못할 시, 그 사람을 시청자들의 마녀 사냥감으로 유도하면서 시청자들의 여론을 그 사람한테 쏠리게 한다."
85,인기 방송인으로서 이러한 패턴은 본인의 방송 진행 중 막히는 감이 있거나 실수를 해서 시청자들의 여론이 타요
86,"에게 부정적으로 바뀌었을 때 주로 나타나고, 한 번 이러면 끝도 없이 이어지게 되며, 결과적으로 본인의 텐션이 그날 방송을 유지 못할 정도까지 내려가는 경우가 다반사이다."
87,"최초로 이러한 매니저 지목행위를 한 것은 타 요가 방송국 게시판을 볼 때에 어떤 유저가 북한에 관한 게시물을 올린 것을 보고 타 요가 ' 북한은 우리의 주적이다' [11] 라고 한 것에 대해 또 다른 시청자가 그런 말은 조심해야 한다고 지적하면서 부터 시작되었으며, 이런 매니저 지목행위는 게임에 악성 훈수를 하는 시청자를 지목하는 행위로 퍼지게 되었다."
88,"[12] 만약 해당 게임을 잘 아는 유저가 지목당한 후 훈수를 했다면 그 채팅이 자신이 이해하기 엔 너무 어려운 일명 ' 고인물' 들만의 언어 [13] 라며 쉽게 풀어서 설명해 주지 않았다며 몰고가고, 정확하게 알지 못하거나 그저 다른 동영상 정도만 보고 그런 채팅을 쳤다면 게임에 대해 제대로 알지도 못하면서 잘못된 과정을 알려줘서 방송의 흐름을 끊기게 했다며 끝없이 몰아간다."
89,"이런 경우가 되면 채팅 창의 여론은 순식간에 지목된 사람에게 적대적, 심지어는 악의적이라고 할 정도로 바뀌며 마치 그 사람은 어 그로를 끌기 위해 뻘 짓을 한 인물이 되어 버린다."
90,그 말이 설렁 사실이라 할 지라도 말꼬리를 잡던가 말을 이상하게 한다는 등의 이유를 대며 상대를 비난한다.
91,이때 감정이 격화되어 반말이나 심하면 욕설을 하기도 하며 언급한 바와 같이 채팅 창의 여론은 그 사람에게 매우 적대적인 상태를 유지하며 욕설과 비난이 엄청난 속도로 도배되게 된다.
92,시청자들의 욕설은 지목 받은 사람이 강 퇴당할 때까지 멈추지 않는다.
93,[14] 결국 BJ 타 요의 팬클럽층은 단단한 콘크리트층이기 때문에 모든 시청자들은 타 요의 편만 들어주면서 매니저로 지목당한 사람을 일방적으로 비난하기 때문에 이런 식의 대처는 마녀 사냥이 될 수밖에 없다.
94,"또 한 그 사람에 대한 시청자들의 비난 욕설 등을 전부 다 방치하며, 이에 대해 매니저 지목을 당한 시청 자가 채팅으로 조금이라도 비난 조의 채팅을 치면 분위기에 휩쓸린 시청자들과 열혈 팬, 심지어 고정 매니저에게까지 뭇매를 맞고 강 퇴당하게 되며, 제대로 된 해명을 한다 하더라도 같이 편을 들어주는 시청자나 매니저는 거의 없기에 사실상 여기까지 오면 옳고 그름에 관계없이 오직 수천명에게 공개적인 비난과 심지어 귓속말로 패 드립까지 받는 엄청난 수치심과 함께 잘못된 훈 수라며 블랙리스트에 등재되는 결말만 남아 있다."
95,또 한 위의 문제와 더불어 채팅 창의 악순환을 유발하는 행동이 있는데 여러 가지 의견을 따로 받아들이지 않고 비제이 본인이 이해되는 부분만 따로 모아 엉뚱한 말을 만드는 것이다.
96,가령 시청자 1은 'A를 하면 B가 되기에 C 해야 한다.
97,"', 시청자 2은 'D를 하면 E가 되기에 F 하면 안된다."
98,' 고 언급했다고
99,하면 그것을 'A를 하면 E가 되기에 C 하면 안된다.
100,' 같은 이상한 결론( 논리적 왜곡) 을 도출한 후 그게 마치 한 사람이 언급한 것인 마냥 반복적으로 얘기하고 채팅 창 여론을 몰아간다.
101,이후 채팅 창 여론이 극에 달했을 때 시청자 1을 위의 문단에서 와 같이 마녀 사냥하게 되고 시청자 1은 십자 포화 속에서 얼토당토 않은 의견을 반박해야 함과 동시에 자기 의견이 틀리지 않았다라고 길지 않은 시간 내에 입증해야 하기에 보통은 위와 같은 최후를 맞이하게 된다.
102,"실제로 던 전 앤 파이터를 플레이 하다가 그러한 사례가 있었는데, 타 요가 만렙을 찍고 뭘 해야 하냐고 질문을 하자 어떠한 시청자가 무슨 던 전을 돌으라"
103,"고 강요를 했고, 거기에 대해 타 요가 그 던 전이 뭐냐고 하자 다른 시청자가 거기에 대해 강요 없이 구체적으로 어떤 던 전이라고 만 설명을 했는데, 타요"
104,에게 억지로 특정 행위를 강요한 시청자는 지목당하지 않고 오히려 친절하게 알려준 시청자가 지목 당해서 왜 강요를 하냐
105,면서 뭇매를 맞게 된 경우가 있었다.
106,"해 당 시청자의 채팅 로그를 보면 제대로 설명했음에도 불구하고, 일단 매니저로 지목당하자 마자 다른 시청자들은 사실관계를 전혀 확인하지 않고 일방적인 비난을 퍼붓는 모습을 볼 수 있다."
107,[15] 또한 본인이 시청자들한테 장난스럽게 욕을 하거나 시비를 거는 것에는 관대하지만 막상 시청자들이 본인에게 장난스럽게 시비를 걸거나 훈수를 두면 이를 갈며 심판대에 올려서 갈구거나 블랙을 하는 편이다.
108,"물론 시청자의 과한 피드백이 방송을 망칠 수 있는 것은 사실이나, 유동 시청자가 없어 질 수는 없는 방송 특성 상 타 요의 이러한 배타적인 태도는 방송이 장기적인 관점에서 오로지 BJ 와 고인물만을 위한 그들 만의 방송으로 전락해 버릴 수 있는 위험이 있다."
109,"결국, 특정 유저에게 마녀 사냥을 유도하는 타요"
110,"와 더불어, 지목당한 사람에게 끊임없이 비난을 하는 시청자들 또한 비판의 대상인 셈이다."
111,"[16] 여기에 대해서 타 요가 방송 상에서 반박한 바에 따르면, 한 명을 골라서 매니저를 주는 것은 그 사람이 지속적으로 같은 내용을 훈수를 두었을 때, 매니저의 경우 채팅이 잘 보이며, 일반 시청자와 달리 채팅을 많이, 빠르게 쳐도 도배 (30 초 채팅 금지 )에 걸리지 않기 때문에 무슨 얘기를 하고 싶어 하는 것인지 제대로 확인하기 위해 매니저를 주는 것이며, 그저 공개 처형을 위한 마녀 사냥을 하는 것이 아니라 훈수를 제대로 듣기 위한 행동이라는 것이다."
112,"실제로 매니저를 주었을 때 맞는 훈수가 아니라면 강 퇴하는 것은 사실이지만, 제대로 된 훈수를 할 경우 퀵 뷰를 주고 해당 게임의 전문가로 인정하여 진행하는 동안 지속적으로 훈수를 받아들이는 경우도 많다."
113,[17] 그리하여 타요
114,는 앞으로도 이러한 방식의 매니저 지목행위를 바꿀 생각이 없다고 말했다.
115,또 한 몇몇 시청자들은 거기에 대하여 앞으로 매니저로 지목된 사람에게 지나치게 공격하지 않도록 주의하겠다고
116,했다.
117,"그렇기에 앞으로 시청자에게 매니저를 주는 행위를 통하여 좋은 훈수를 들을 수 있다는 점도 기대되지만, 또다시 타요"
118,와 시청자들 로 인하여 또다시 사람을 공격하게 되는 마녀 사냥 행위가 계속될 가능성도 있다.
119,인 벤 하스 돌 방송에서 덱을 구성하기 위해 타 요가 황금 티 리 온 폴 드링을 갈아서 해골 기사 카드를 만들었다.
120,"집안의 가보라 카더라 [18] 하지만 세 판 내내 게임에서 토 미는 눈을 씻고 찾아봐도 볼 수 없었고 무단 결근, 결국 타요"
121,는 희대의 사람이 언제 죽는지 아나? 그건 황금 티 리 온을 갈아서 만든 해골 기사를 갈아 버릴 때다.
122,"라는 말을 남기며 해골 기사에게 토 미라는 이름을 붙였고, 그를 떠나보내 주었다. 이 때, 바꿔 둔 덱의 이름이 안 습이었는데, 바로 Remember tomi... 3200가 루가 400 가루로.. 6 분짜리 영상이다."
123,"웃지 못 할 이야기를 한 번 씩 꼭 보자. 직후, 해골 기사가 빠져 버린 덱이 미완성 상태가 되어 대전 탭에서 붉게 X 표시가 되었는데, 이를 보고 동료의 표시라"
124,"하여 토 미에게 ' 우리는 다시 만날 것이다', ' 토미가 다시 나오면 채팅에 동료의 표시로 X를 쳐 달라' 고 말했다."
125,"그런 데 며칠 뒤, 개인방송 중 정말로 토 미를 뽑았다!"
126,"이 때 채팅 창에는 X 표시가 도배되었음은 물론이고, 타 요가 해골 기사를 획득했다는 메세지를 받은 NuGul 역시 귓속말로 X 표를 보내줬다."
127,이 때 타 요의 답장까지 전문은 이러하다.NuGul
128,: ;;NuGul : X 타요
129,: X 타요
130,: 우린.. 타요
131,: 동료다..
132,"참고로 집안의 가보인 황금 티 리 온 역시, 다시 3200 가루를 들여 되찾았다."
133,"이후, 어느 방송이든 해골 기사가 등장할 경우 채팅 창에 X 표시가 올라오거나, 대놓고 해골 기사를 토 미라고 부르는 등 아예 별명으로 고착화 되었다."
134,그리고... 타요
135,는 토 미와 혈투를 벌이는데... 다른 스트 리머들도 이 유행이 나름대로 영향이 있는지 토 미라는 별칭도 다른 BJ 방송에 종 종 언급되긴 한다.
136,나무위 키 내에서는 이 유행어 때문에 문서에서 무단 수정이 가한 흔적이 보였다.
137,빠돌이 취급하며 수정을 가한 흔적이 있는데 일전에 토론도 안하고 무단으로 지운 유저들도 마찬가지다.
138,이 일로 무단으로 진행하는 유저들 관련하여 고발하게 되었고 이 유행어와 관련하여 토론을 진행하게 되었다.
139,이 후 관련이 가장 깊은 해당 별칭 창시자의 문서로 옮기는 것으로 일단락 되었다.
140,"이딴 드립이 눈꼴사나운 건 사실이다 이 문서의 내용 중 전체 또는 일부는 하스 스톤/ 카드 일람/ 대 마상 시합/ 전설 등급 문서의 r96 판, 번 문단에서 가져왔습니다."
141,이전 역사 보러 가기 이 문서의 내용 중 전체 또는 일부는 다른 문서에서 가져왔습니다.
