,sentences
0,역대 키 비주얼 1차 공식 티 저 物語はすべてのポケモンの 世界へ 이야기는 모든 포켓 몬의 세계로 포켓 몬스터 애니메이션의 신작. 포켓 몬스터 소드· 실드를 기반으로 했다고
1,"추정되지만, PV에서 대놓고 모든 포켓 몬의 세계라고 언급하기 때문에 사실상 포켓 몬스터 게임 시리즈 전체 [6 ]를 원작으로 삼는다고"
2,여겨 진다.
3,지난 시리즈 인 썬& 문에서 지우가 드디어 리그 우승을 차지했기 때문에 향후 전개가 어떻게 될지 주목되었다.
4,결국 리부트가 아니라 같은 세계관으로 밝혀졌다.
5,일본어 원제는 무인 편의 원제와 동일한 ' 포켓 몬스터' 이다.
6,[7] 다만 이렇다 보니 제목에서 오해할 여지가 많아서 국내 제목은 포켓 몬스터 W. [8] 미국 판 제목은 'Pok émon Journeys' [9 ]라고 하는 등 각각 개별적으로 부제가 붙어 있다.
7,이렇다 보니 포켓 몬 시리즈 중 유일하게 3 국 부제가 제각각인 사례가 되었다.
8,"정식 PV 꿈과 모험과, 포켓 몬스터의 세계로, Let's Go!( 일본 PV 기준) 새로운 꿈과 모험, 새로운 포켓 몬 세계로 GO!( 한국판 포스터 기준)ポケットモンスター、 縮めてポケモン。この 星の 不思議な 不思議な 生き 物。 空に、 海に、 森に、 街に、 世界中の 至る 所でその 姿を 見ることができる。これは、ポケモンバトルで 最強を 目指す 少年“サトシ”と、すべてのポケモンをゲットするという 夢をもつ 少年“ゴウ”の 物語である。サトシのパートナー“ピカチュウ”、ゴウのパートナー“ヒバニー”をはじめとするたくさんのポケモンたちとともに、 今、 無限に 広がるポケモン 世界への 冒険がはじまる。さぁ… 夢と 冒険と！ポケットモンスターの 世界へ！レッツゴー！ 포켓 몬스터, 줄여서 말하면 포켓 몬이 별에 사는 신기하면서도 신기한 생명체 하늘에, 바다에, 숲에, 마을에, 세계 중 온갖 곳에서 그 모습을 볼 수 있다."
9,"이것은, 포켓 몬 배 틀에서 최강을 꿈꾸는 소년 "" 한 지우"" 와, 모든 포켓 몬을 잡겠다는 꿈을 지닌 소년 "" 고우"" 의 이야기이다."
10,"지우의 파트너 "" 피 카 츄"", 고우의 파트너 "" 염 버니 ""를 시작으로 수많은 포켓 몬들과 함께 지금, 무한히 펼쳐지는 포켓 몬 세계로의 모험이 시작된다."
11,"자… 꿈과 모험과! 포켓 몬스터의 세계로! 레 츠고 !TV 도쿄의 공식 사이트에 업 로드된 시리즈 소개글. 보면 알겠지만, 게임을 처음 시작할 때의 대사에 극장 판의 단골대사를 섞어 놨다."
12,정식 PV 23월 27 일 포켓 몬 코리아 유 튜브 공식 채널에서 포켓 몬스터 W 한국어 공식 티 저 영상이 공개되었다.
13,4월 8일 오후 6시부터 투니 버스 첫 방송을 시작으로 차후에 다른 애니메이션 채널에서도 공급 방영된다.
14,"한국어 공식 PV2019 년 8월 30일, 포켓 몬스터 공식 트위터에서 티 저 정보가 일부 유출이 되었다는 루머가 돌기 시작. [10 ]2019 년 9월 1일 썬& 문 137 화 방영 종료와 맞춰서 방송과 인터넷을 통해 1차 티 저 공개. 동시에 한정된 기간 동안만 트위터에 포켓 몬스터 애니메이션 정보만을 다루는 채널이 오픈된다."
15,"공식 트윗에 따르면, 포켓 몬스터 소드/ 실드의 배경이 되는 가라 르지방뿐만 아니라 역대 모든 지방을 무대로, 각 지방에 서식하는 포켓 몬 들이 등장할 예정이라고 한다."
16,정작 본가에서 등장하는 포켓 몬을 대거 삭제해 놓고 오히려 이후 시리즈에서도 이 방침을 이어 가겠다는 무책임한 태도로 일관하며 원래 취지를 전면 부인하고 있는 것과는 대조적이다.
17,"게임과 애 니의 설정이 차이가 많이 나는 사례는 예전에도 있긴 했지만, 캐릭터가 아닌 세계관의 설정이 다르게 된 적은 이번이 처음이다."
18,[11] 그리고 그에 걸맞게 8 화에서부터 화려한 자연 배경과 가라 르도 감에 누락된 포켓 몬 들을 포함한 다양한 포켓 몬 들이 출연하면서 호평을 받았다.9
19,월 27일에 가능성이 높아 보이는 포스터가 유출되었다.
20,"한 지우와 피카츄는 그대로 등장하며, 첫 방송 날짜와 함께, 동료 중 한 명으로 추정되는 염 버니를 가진 트레이너인 고우 [12] 가 같이 공개되었다."
21,특히 배경에 반시계 방향으로 성도- 호연- 신오- 하나- 칼 로스- 알로 라 지방과 각 지방의 대표적인 포켓 몬 들이 그 려져 있어서 눈길을 끌었다.2019
22,"년 9월 29 일 포켓 몬 공식 트위터에 올라온 정보에 따르면, 이 작품은 지우와 함께 ' 고우' 라는 염 버니를 파트너로 하는 캐릭터가 더블 주인공으로 등장하여 포켓 몬 세계의 모든 지역을 여행하는 이야기라고 한다."
23,[13] 고우는 일본어 판에서의 이름으로 다른 언어 판에서의 이름은 9월 29일 기준으로 공개되지 않았다.
24,"이 외에도 히로인이나 고우를 제외한 남자 동료의 합류 여부는 아직 까지 정보가 없었으나, 10월 11일에 공개된 정보로는 채 하루라는 고우와 연관 있는 히로인이 등장한다고 공개되었다."
25,각 지방을 여행한다는 점에서 전 편 등장하던 인물들도 다시금 등장할 수도 있다.
26,[14] 그리고 7 화의 선행공개된 각본을 통해 지우가 피 카 츄 이외의 포켓 몬을 사용할 수도 있다는 암시가 나오면서 이전세대들의 지우 포켓 몬들도 재등장할 가능성도 생기게 되었다.
27,"전 세계를 여행한다는 컨셉은 썬 문 145 화에서 지우와의 배 틀을 마친 키아웨가 섬의 왕을 목표로 한다는 말에, 심판을 봐 주고 있었던 라이 치가 그러면 바깥 세상을 보고 오는 게 좋다 라면서 견문을 넓히는 것을 추천하는데, 이 말에 반응한 지우가 에피소드 마지막에 일단 태초마을로 돌아가서 보다 넓은 세계를 보자고"
28,결정하면서 이루어졌다.
29,"갈색 시티에 위치한 채 박사의 연구소에서 지우와 고우가 산다는 정보로 보아 [15], 모든 지방이 배경이란 말은 썬& 문 이전처럼 여행하는 구성이 아니라 울트라가 디 언 즈처럼 한 장소를 거점으로 삼고서 사건이 발생할 경우 파견되고 돌아오는 구성으로 추정된다.10"
30,월 17일 트위터에서 이번 작의 오프닝을 After the Rain이 담당한다는 정보가 공개되었다.
31,"정확히는 마 후 마 후가 프로 듀스, 작곡, 작사, 편곡을 담당하고, 노래를 After the Rain( 소라루× 마 후 마 후) 가 담당하는 형식. #10 월 20일 방영 분 후 공개 정보에서 로켓 단 삼 인방이 계속 출현한다는 것이 확정되었다."
32,새로운 메카를 들고 나온다고. 또 한 배경이 관동에서 시작하는 만큼 등장 대사도 극 초기 무인 편 대사로 돌아간 것으로 보인다.10
33,"월 25일, 로켓 단 삼 인방의 성 우진들이 차기 작에 대해 팬들에게 인사카드를 올렸다."
34,특히 더 이상 게임에 애니메이션의 스토리가 얽매이지 않는다고
35,해석될 수 있는 발언이 있다.
36,"로사 역 하야시 바라 메 구미로 이 역 미 키 신이치로 나 옹 역이 누 야마 이 누 코 구석구석 청소부터 시작해서, 때로는 피 카 츄 잡으려 다 머리를 태워 먹고 찌릿찌릿 거리기도 하고, 뭐하면 나 옹은 해루 미라도 된다고요!"
37,[16] 새로운 「 포켓 몬스터」 의 세계에 우리 로켓 단도 한번 더 물고 늘어질 수 있다니
38,기쁘네요
39,"( 웃음). 이제부터 여러분이 어떤 로켓 단을 보고 싶을지 모집!( 웃음) 변장했을 때에는 성별이라도 바꿔 대니까, 여러분의 목소리로 얼마든지 재미있는 로켓 단을 보실 수 있습니다."
40,"그리고 로켓 단의 등장 때는 "" 기대"" 되는 부분이 있으니, 앞으로도 주목해 주셨으면 하네요."
41,"게임과 링크되지 않는 만큼, 여러분들이 말씀해 주시면 로켓 단의 "" 볼만한 점"" 이 잔뜩 늘어날 거라"
42,"생각하니까, 부디 로켓 단을 응원해 주세요!"
43,( 웃음) 잘 부탁합니다!
44,이를 통해 해석하면 매번 게임이 바뀔 때마다 애니 시리즈도 그에 맞춰 바뀌는 것이 아닌 더 이상 게임이 바뀌어도 이 애니 자체로 계속 유지시킬 것으로 보인다.10
45,"일 27일, 이이 토요 마리에 가 공식 서포터로서 11월 10일 TV 도쿄에서 본 애 니의 1 화 선행 공개 설명을 진행한다고 한다."
46,11월 1일. 주제가 이름이 공개되었다.
47,"주제가 이름은 「１・２・３(ワン・ツー・スリー)」/「１・２・３( 원・ 투・ 쓰리)」 [17] 또한 같은 날, 1 화의 대략적인 정보가 공개되었다.11"
48,월 10일 엔딩 곡을 마스 다 준이치가 담당한다는 정보가 공개되었다.11
49,월 13일 새로운 PV가 공개되었다.1
50,년이 지 나 2020년 10월 9일부터 포켓 몬스터 시간대가 금요일 오후 6시 55분으로 바꾼다는 소식이 나온다.
51,"新アニポケ 第１ 話「ピカチュウ 誕生！」のあらすじを 大公開👀カントー 地方にあるどこかの 森に、ひとりぼっちのピチューがいた。まだ 幼いそのピチューは、ある 出会いと 別れを 経験する。サトシと 相棒のピカチュウが 旅に 出る、その 少し 前。すべてのはじまりの 物語📖 신 애니메이션 포켓 몬스터 제 1 화「 피 카 츄 탄생!」 의 줄거리를 대공개👀 관 동지방에 있는 어 딘 가의 숲에, 외톨이 피츄가 있었다."
52,"아직 어린 그 피츄는, 어느 모험과 이별을 경험한다."
53,"지우와 파트너인 피카츄가 여행에 나서는, 얼마 전의 이야기. 모든 시작의 이야기📖― 공식 트위터에 올라간 1 화의 간단 줄거리   자 세한 내용은 포켓 몬스터 W/ 등장인물 & 포켓 몬 문서를 의 번째 문단을의 부분을 참고하십시오."
54,  자 세한 내용은 포켓 몬스터 W/ 주제가 문서를 의 번째 문단을의 부분을 참고하십시오.
55,전 작인 썬 문 애 니의 더빙 판이 2020년 1월 14일 종영하면서 본 작의 국내 판 더빙 방송 여부가 자연스럽게 관심사에 오르내렸다.
56,"일단 포켓 몬스터 애니메이션 더빙은 SBS에서 방영하던 시절 일색으로 인해 결 방되었던 에피소드를 제외하면 한 번도 거르지 않고 방영했을 뿐만 아니라, AG 이후로는 일색으로 인해 결 방 [41] 되었던 에피소드도 전무하기에 그렇다.2020"
57,"년 1월 17일, 포켓 몬스터 W 라는 이름으로 2020년 봄에 방영이 확정되었다는 소식이 떴다."
58,그리고 2020년 4월 8일부터 오후 6시에 투니 버스에서 방영되고 있다.
59,오프닝 곡은 이전처럼 원곡 번안이 아니라 한국에서 자체 제작한 ' 여행의 시작 '으로 교체되었다.
60,엔딩 곡은 끝말 잇기가 아닌 이름 외우기로 바뀌었고 [42] 성우 캐스팅도 전작의 뒤를 이어 나름 호평을 받고 있다.
61,"[43] 예전처럼 번역은 이선희, 연출은 XY 때부터 담당하였던 계인 선. 참고로 2020년 6월 10일 20 화 방영을 마지막으로 1기 방영이 끝났는데, 20 화까지 방영되는 것을 모른 어린이들과 부모님들이 왜 6월 17일에도 방영을 안하냐"
62,"는 글이 쇄도로 이어졌고, 포켓 몬스터 애 니의 여전한 인기를 증명하듯 잠시나마 실 검에 올라왔다."
63,그러다 2020년 10월 공 홈 소식에 신 에피소드로 다시 방영한다는 소식이 떴다!
64,주제가는 TULA 콘서트 당시 나 오미가 부른다고 선 공개되었다.25
65,화에 나오는 코 르 니의 성 우도 김율을 그대로 캐스팅했다.
66,덕분에 썬 문의 마 오와 버넷박사도 그대로 유지되었다.
67,"현재까지 재등장한 인물들 중 XY 이후로 나온 인물들의 성 우진은 그대로 유지 중이지만, 그 이전에 등장한 인물들( 목 호, 사도) 은 전부 변경되었다."
68,"다만 이번 시즌에서도 수련은 김 하영이 슈퍼 시크릿으로 정상적으로 복귀하였으나, 여전히 강은 애가 맡고 있다."
69,"여담으로, 26 화의 A 파트에서는 I LOVE 잉어 킹, B 파트에서는 야 돈의 노래(どないやねん ヤドン) 가 BGM으로 삽입되었는데, 야 돈의 노래 쪽은 사상 처음으로 번안되었다.2020"
70,년 12월 16일 Part 2 방 영이 끝났으며 2021년 3월에 part 3가 방영 예정이다.
71,국내 방영은 20 화를 기준으로 시즌을 나누며 시즌이 끝나면 신작 에피소드 방영을 멈추고 충분히 분량이 쌓이면 새로운 시즌을 들고 오는 식으로 방영 중이다.
72,  자 세한 내용은 포켓 몬스터 W/ 비판 및 논란 문서를 의 번째 문단을의 부분을 참고하십시오.
73,"각 화 별 아이 캐치 제 1 화: 피 츄 제 2 화: 루 기아 제 3 화: 이상해 풀제 4 화: 염 버니 제 5 화: 잠만 보제 6 화: 스라크 제 7 화: 그 라에 나 제 8 화: 팽 도리제 9 화: 깨비 드릴 조제 10 화: 망 나 뇽 제 11 화: 코 일제 12 화: 리 자 몽제 13 화: 갈 가부 기제 14 화: 골루 그제 15 화: 탕 구리제 16 화: 팬 텀 제 17 화: 불비 달 마제 18 화: 라이 츄 제 19 화: 메타 몽 제 20 화: 파 오리제 21 화: 럭키제 22 화: 뷰티 플라이제 23 화: 탐 리스제 24 화: 나 옹( 로켓 단) 제 25 화: 거북손 손제 26 화: 잉어 킹제 27 화: 두랄루 돈제 28 화: 울 머 기 제 29 화: 콩 둘 기제 30 화: 마임 맨제 31 화: 빈티나 제 32 화: 해루 미제 33 화: 헤라 크로스제 34 화: 리 오 르제 35 화: 피 카 츄( 암 컷) 제 36 화: 톱 치제 37 화: 알로 라 닥 트리 오제 38 화: 투구 푸스제 39 화: 케오퍼스 제 40 화: 썬 더 제 41 화: 늪 짱이 제 42~45 화: 없음 [44] 제 46 화: 갸 라 도스제 47 화: 모 르 페 코제 48 화: 에이스 번제 49 화: 이브 이제 50 화: 암 트르 제 51 화: 제 52 화: 제 53 화: 에피소드별 배경 지방 (3 ~4 개마다 줄을 바꾼다) 메인 지방관 동지방 성도지방 호연 지방 신오지방 1, 2, 3, 6,11, 15, 16,17, 18, 19,20, 21, 23,26A, 29, 30,33, 34, 35,38, 40, 41,47, 49, 519, 32, 397, 22, 31, 368, 24하나 지방 칼 로스지방 알로 라지 방가 라 르지방 14, 4825374, 5, 12, 1327, 28, 42,43, 44, 45,50 기타 지방 10( 망 나 뇽의 섬) [45], 26B (야 돈의 섬) [46], 46( 세로 아일랜드) 특이사항으로, 이번 작은 간접적인 시간 흐름 변화가 묘사된다."
74,"이 전작 까지는 계절의 변화 같은 것보다는 그냥 "" 추운 지방이라 눈이 내리고 춥다"" 라는 식이었으나, 갈색 시티에 겨울이 왔다는 것을 보여주면서 계절의 변화를 나타내고 있다."
75,"또 37 화에선 버넷박사의 아이가 태어나 꽤 자란 모습을 보면, 지우가 알로 라지 방을 떠난 당시에 임신 초기였음을 감안해도 적어도 2년 이상은 지났음을 알 수 있다."
76,하지만 지우의 나이는 여전히 공식적으로 10살이다.
77,사실 이전에도 시간이 흘렀다는 언급은 수도 없이 나왔으니 특별히 설정이 바뀔 확률은 낮다.
78,해 당 작품의 제목이 아무런 추가 용어가 없이 그냥 ' 포켓 몬스터' 로 명칭해 놓았기에 이 작품을 지칭하는 명칭이 제각기 다르게 불러 지고 있다.
79,"일본과 국내 방영 제목이 나오기 전 한국에선 그냥 ' 포켓 몬스터 2019', ' 포켓 몬스터 신 무인 편' 이라고 불렀으며, 서양권에선 무인 편이라는 단어를 잘 안 쓰기 때문에 [49] 그냥 'Pokemon 2019 Anime' 또는 'Pokemon Sword Shield Anime'라고 부르고 있다."
80,"국내 방영 제목은 ' 포켓 몬스터 W'. 그리고 영미권에서 Pokémon Journeys 라는 이름으로 방영을 예고함에 따라서, 한미 일의 타이틀이 전부 다른 최초의 시리즈가 되었다."
81,"[50] 또한 이번 시리즈부터 북미, 유럽, 대양주에서는 TV 방영이 아니라 넷 플릭스 방영으로 전환했다."
82,기존 시리즈와 달리 본가 타이틀과 연동되는 수식어 없이 제목이 ' 포켓 몬스터' 그 자체라는 점에서 미루어 보아 포켓 몬스터 애니메이션 시리즈의 타이틀 변경은 이번이 마지막 일 수도 있다고
83,추측하는 사람도 있다.
84,지우와 고우의 더블 주인공 체제에 옴 니 버스 식에 가까운 구성이다 보니까 이전 시리즈에서 한 명 이상은 있던 식사를 만들어 주는 멤버는 없다.
85,"그렇다 보니 숙식은 주로 채 박사 연구소에서 해결하는 대신 관동지방을 둘러본다면 당일에 활동을 끝내는데, 다른 지방에 가게 되거나 부득이 하게 다른 도시에서 하루 이상을 보내야 한다면 주로 선박이나 비행기 같은 이동수단 안에서 숙식을 해결하거나, 포켓 몬 센터 및 기타 숙식 시설에서 숙식을 해결하고 있다."
86,"즉, 이전 작품처럼 야영을 하는 모습이 나오질 않는다."
87,"거기에 스마트로 토 무의 등장으로, 전화를 하거나 포켓 몬 정보 이외에도 포켓 몬 센터의 위치 같은 필요한 정보를 인터넷에서 바로바로 얻는 모습도 나온다."
88,"의외로 현실의 지역의 모티브를 반영한 거리 묘사가 잘 되어 있는데, 성도 지방은 차를 타고 갈 수 있을 정도로 가깝고, 호연 지방과 신오지방 역시 그리 멀지 않은 곳이라 기차나 선박을 이용해서 가지만, 하나지방, 칼 로스지방, 알로 라지방, 가라 르지방은 상당히 먼 지역이 여서 그런지 비행기를 타고 간다.1"
89,"화가 방영되고 오프닝에 같이 나온 스탭 롤에서 캐릭터 원안에 종사한 스태프 리스트 마지막에 & 모든 『 포켓 몬스터』 시리즈의 캐릭터 원안 스태프라는 부분 [51] 이 있는데, 역대 시리즈의 캐릭터들이 전부 나오는 거 아니냐"
90,는 해석이 있다.
91,"참고로 썬& 문, XY 등의 이전 시리즈에서는 캐릭터 원안 스태프 리스트에 저런 구절이 나온 적이 없다."
92,"그리고 20 화 방영 후 공개된 PV에서 코 르 니의 등장이 확정되었고, 32 화부터 바뀐 오프닝에서 바로 이전 작의 동료들 [52] 이 비춰 졌고, 37 화에서 알로 라지 방으로 가는 게 확정되었다."
93,50 화에서 오프닝이 바뀌었는데 오바람과 아이리스의 재등장이 확정되었다.
94,전작에 이어 이번 작품도 지우가 체육관 순례를 하지 않는 것으로 보인다.
95,"이후에 라도 가라 르지방에 여행을 떠나 체육관 순례를 시작할 가능성이 없는 것은 아니지만, 현재까지 공개된 정보를 보면 가능성은 낮다."
96,"[53] [54] 썬 문의 경우 애초에 게임에서도 체육관이 없었고, 체육관을 대체하는 섬 시련을 돌았던 것을 생각하면 이번 시즌은 게임의 스토리라인을 전혀 따르지 않는 첫 작품이 되는 것이다."
97,또 한 기존 포켓 몬의 60% 가 삭제되고 이후로도 모든 포켓 몬이 등장할 가능성은 없다고 못박은 게임판과는 별개의 노선을 걷겠다는 다짐을 증명하듯 보란 듯이 삭제된 포켓 몬 들이 에피소드의 주역으로 대거 등장한다.
98,아예 가라 르지방 에피소드인 4 화에서는 엑스트라의 포켓 몬 이기는 해도 모 부기가 등장했을 정도 .4 월 4일부터 포켓 몬 애니 공식 트위터에 4 컷 만화가 올라오고 있다.
99,모자 쿠키가 그리는 외전 애 니가 아닌 본 편 애 니와 관련한 4 컷 만화가 나온 것은 사실상 처음이라고 할 수 있으며 반응도 좋아서 본방이 중단된 이후에도 몇 편 올라왔다.
100,본 작의 히로인 채 하루는 특이하게도 주인공인 지우와 계속 거리감을 두는 모습을 보이는 것이 특이점. 하지만 현재까지 는 지우 일행과 동행하고 있지도 않기에 히로인이라 기보 단 박사 딸 정도의 조연 포지션에 가까운 편이다.
101,"하지만 오프닝에서 같이 동행하는 장면이 나오기 때문에 나중에 나올 가능성이 있으며, 일단 6 화에서 지우와 조금은 가까워 졌다.12"
102,"화에서 "" 포켓 몬 월드 챔피언십"" 이라는 대회가 공개되었는데, "" 세계 최강의 트레이너를 정하는 대회"" 라는 설명답게 챔피언인 단 델 과 목 호가 대결한다."
103,"또 한 전작에서 지우가 마침내 챔피언 자리에 오른 만큼, 이 대회가 이번 작품의 지우의 목표가 될 가능성이 높다."
104,또 한 13 화에서 지우와 단 델 이 배 틀한다는 것이 에피소드 타이틀로 공개되었다.
105,"다만, 작중 언급된 참가 조건이 포켓 몬 배틀 커미션이라는 단체에서 선정한 랭킹 상위 8명( 마스터 즈 에이트) 이라고 제한된 것을 보면, 지우의 랭킹에 따라 참가 조건이 성립될지 아닐지 갈릴 것으로 보인다."
106,"해 당 리그의 자세한 내용은 해당 항목 참조. 18 화부터 지우의 도전이 시작되며, 참가를 위한 첫 배 틀 상대인 갈색 체육관의 체육관 트레이너를 상대로 화려한 배 틀과 승리를 거머쥐며 단숨에 3000위대로 뛰어오른다.26"
107,화에서는 특별 편을 제외하고는 처음으로 10분 분량으로 두개의 A/B 파트로 나뉜 각기 다른 에피소드를 보였다.
108,분량이 워낙 짧아 뭔 가를 보여주기 힘들기 때문에 여타 다른 에피소드와는 다르게 개그에만 크게 집중했다.
109,처음부터 로켓 단 3 인방이 제 4의 벽을 깼을 정도. 이후 41 화에서도 같은 방식을 선보였다.37
110,"화에서 알로 라지 방으로 다시 가는데, 알로 라지 방은 지우가 상당한 유명인사 [55] 다"
111,보니 관련 에피소드가 나올 가능성이 존재. [56]... 하지만 지우의 포켓 몬 들을 보고도 그냥 넘어갔고 지우의 전적에 대해서 듣는 일도 없었다.
112,알로 라지 방에 다시 갈 것이라고 하니 그 때를 기대할 수밖에. 꽤나 이른 시점에서 매우 메이저한 포켓 몬 파티를 짠 데다
113,다른 시리즈와 다르게 최종 진화 포켓 몬이 많다.
114,"이후에 얼마든지 파티가 변할 수 있다지만 꽤나 파격적인 행보. 그동안 여자 조연이 호감을 갖지만 천연의 지우가 전혀 눈치를 못 채거나, 조연의 시나리오를 통해 클 리 셰 적인 연출로 회 차를 잡아먹는 모습은 전혀 보이지 않고, 꽤나 단순하면서 빠르게 얘기가 진행되는 편이다.32"
115,화에서 고우 단독으로만 진행된 에피소드가 나오면서 사이드 스토리나 스페셜 에피소드를 제외하고 포켓 몬 애니 사상 처음으로 지우와 피카츄가 본 편에 출현을 하지 않았다.
116,이후 41 화 A 파트에서는 반대로 고우가 출연하지 않는 에피소드가 나왔다.
117,도감 고증을 하려는 것인지 36 화에서 톱 치가 개미 지옥으로 사람들을 함정에 빠트려 잡아먹으려고 하는 연출이 나와 큰 충격을 주기도 하였다.
118,"코로나 바 이러 스감 염증 -19로 인하여 일본에 내려진 비상사태에 근거하여, OLM에서 일부 에피소드에 대한 제작환경에 신경을 쓰기 위해서 4월 19일 방영된 22 화 이후의 에피소드는 한동안 방영을 중지, 재방송으로 변경한다고 공지했다."
119,"#＜ 番組からのお 知らせ＞ 新型コロナウイルスの 感染拡大にともなう「 緊急事態宣言」の 発出を 受け、 安全に 十分配慮した 上での 番組制作を 行うため、 一時的に、 一部の 制作作業を 見合わせることにいたしました。これに 伴い、 来週以降の「ポケットモンスター」は 再放送となります。< 방송 공지> 코로나 바 이러스 -19 감염확대에 동반하여 "" 긴급사태선언"" 이 발령되었기에, 안전에 충분히 배려하며 방송을 제작하기 위해, 일시적으로 일부 제작작업을 보류하기로 했습니다."
120,"이로 인하여, 다음주 이후의 "" 포켓 몬스터 W"" 는 재방송이 됩니다."
121,다행히 2020년 5월 31일 공식트윗으로부터 긴급사태선언이 해제됨에 따라 6월 7일부터 최신 편 진도를 재개한다고 밝혔다.
122,"공식 트위터 트윗 애니메이션 공식 트위터 - 본래 2019년 9월부터 기간한 정으로 운영될 예정이었으나, 팔로 워 11만 명이 넘어가고 포켓 몬 애니메이션이 트위터에서 큰 인기를 끌게 되자 계정을 유지하기로 결정했다."
123,"제목이 리부 트 극장판과 같은 양식인 것과 지우의 모 자가 리 부트 때처럼 C 라는 점, 이전과 달리 전 지방을 무대로 한다는 점. 새로 공개된 포스터 배경에도 지우와 고우만 있고, 좋은 홍보요소가 될 이전 세대의 캐릭터들이나 로켓 단 삼 인방은 없는 등, 이런 요소 때문에 기존 애 니와는 상당히 다른 전개를 가지거나 아예 리부트로 추측하고 있었다."
