,sentences
0,"전 리그 오브 레 전드 프로 게이 머, 전 카카오 TV PD, 현 트위치 TV 파트너 롤, 메이 플 스트 리머. 본명 박 종우. [3] 과거 'AP Innovation' 과 ' 해 적' [4] 이라는 닉네임으로 시즌 3 챌린저 1위를 찍기도 했으며, 애니 비아 장인 아마추어 고수로 유명했다."
1,[5] 여러 인터넷 방송이나 인터넷에 ' 박 종우! 박 종우! 박 종우!' 가 도배되는데 그 박 종우가 바로 이 피닉스 박이다.
2,"본래 닉네임 ' 해적 '으로 유명했으나, 지금은 쓰지 않는다."
3,방송 인원이 적 던 시절 방송을 켜 놓고 닉변을 하다가 한 시청자가 가로 채 아직도 구할 수 없다고.
4,이 계정 주 인은 롤도 하지 않음에도 불구하고 휴면 계정이 되는 것을 피하기 위해 몇 달마다 한 번 씩 AI 전을 돌린다고 한다.
5,"한번은 그 닉네임으로 "" 줄까?"
6,""" 라고 메시지가 와서 박 종우가 달라고 했더니 "" 싫어 ""라고 답장이 와서 쌍 욕을 퍼붓고 차단을 박은 적이 있다."
7,"현재 해적 계정은 영정을 먹은 듯 하다. 원래는 PD 해적 계정으로 노 마이크 방송을 하다가 마이크를 켜고 방송을 하기 시작했는데, 팀이 똥 쌀 때마다 욕을 쉴새없이 내뱉는 바람에 정지를 받은 계정이 수도 없이 많다."
8,박 종우는 이에 굴하지 않고 정지를 당할 때마다 재가입을 반복하며( 피닉스 박 1 피닉스 박 2 피닉스 박 3...) 계속 부활해 사람들이 그를 피닉스 박으로 부르기 시작한 것이 지금 닉네임의 유래이다.
9,"당시 저격하던 유저가 박 종우와 같은 팀이 되었는데, 박 종우 본인이 푸짐하게 싸 재껴 버리는 바람에 점점 패색이 짙어 지는 상황에서 이에 빡 친 저격 러 가 채팅으로 ' 니가 무슨 피닉스 박이냐"
10,하기스박으로 바꿔 라 XX 놈 아' 라는 명언이 방송 화면에 강렬하게 꽂히자 시청자들은 폭소와 함께 깊은 감명을 받아 그 뒤부터 ' 하기 스박' 이라고 불러 주게 되었다.
11,저격 안 하면 되잖아 이것이 'OO 박' 의 형식으로 ' 박' 의 앞에 아무 거나 갖다 붙이는 문화의 시작이다.
12,방송시간은 랜덤이지만 주로 저녁에 방송하며 방송 시작 전 굽게 더에 방송 시작 시간을 공지하는데 보통 언급한 시간에서 1 시간 ~2 시간 정도 이후에 오면 알맞게 시청할 수 있다.
13,가끔 10분 정도의 오차만 가지고 켜기도 하는데 빨리 켜는 일은 사실상 없다고 봐도 무방하니 넉넉하게 와서 시청하는 게 좋다.
14,굽 청자들은 이를 원주시 차라고 부르며 굽 네 단의 해석 본을 참고하면 된다.2013
15,년 삼성의 전신인 MVP에서 연습생 활동 경력이 있다.
16,자신 있는 애니 비아로 LOL 클럽 마스터즈에 딱 한판 출전하였으나 KDA 2를 넘기지 못하고 패배한 이후 한번도 출전하지 못했다.
17,이후 박 종우가 빠진 MVP는 우승을 하게 된다.
18,MVP 방출 이후 Team NB 라는 아마 고수들 로 꾸려 진 팀 [6] 의 미드라 이너로 HOT6 Champions Summer 2013 예선전에 출전했지만 Xenics Blast에게 광 탈당하고 해체됐다.
19,그 후로는 중국의 3부 리그에서 미드라 이너로 활동했다.
20,"초기에는 팀의 에이스 역할을 하며 시드권 확보의 주역이 되는 등 맹활약했으나, 점점 나태 해져 매일 같이 연습도 안하고 배달 음식을 시켜 놓고 영화를 보며 놀게 된다."
21,결국 팀의 성적이 나빠졌고 방출을 당했다.
22,그럼에도 자신은 팀에게 통수를 맞아 월급도 제때 받지 못하고 한국에 왔다고
23,말한다.
24,박 종우가 말하길 본인의 프로 게이 머 시절은 운이 지독하게 없었다고
25,한다.
26,MVP 연습생 시절엔 다 데 와 이지 훈에게 밀려 경기 출전이 단 1회에 그쳤다.
27,"거기에 당시 최고의 OP 챔피언이었던 제드를 비롯한 AD 미드를 잘 다루지 못했고, AD 챔프를 연습하기보단 본인이 잘하는 AP 챔프를 고집 하다, MVP에서 방출당했다고"
28,말했다.
29,거기에 박종 우가 방출된 이후에 이지 훈이 SKT로 이적 해 공백이 생긴 자리는 다 데 혼자 메꾸게 된다.MVP에서
30,방출 이후 KT 롤스터에 테스트를 신청해 수많은 경쟁자들을 제치고 최종 테스트까지 갔었다.
31,"그러나 하필 최종 경쟁 자가 이후에 kt의 첫 LCK 우승과 LPL 최초의 롤 드컵 우승을 이뤄 낸 세 체 미 루 키 송의 진이었고, 탈락하고 만다."
32,루 키만 아니였다면 KT의 주전 미드라 이너는 박 종우 였을 수도... 이때는 그나마 챌린저였으나. 그 이후 상심했는지 마비 노기에서 게임 머니를 가지고 배팅하는 도박 딜러 따위나 하며 롤을 때려치기도 했으나 2015년 경 롤을 다시 시작했고 챌린저를 찍어 시즌을 마무리했다.
33,이때 다음 팟 방송은 노 마이크 실력방송으로 꽤 잘했으나 게임만 열시간 넘도록 하는 방송이라 시청자가 30명 대 수준에 그쳤다.
34,이를 비꼬아 한때 ' 속보) 해적 시청자 30억명 돌파!' 따위의 어 그로가 성행했다.
35,2016년 초부터 TSM Bjergsen 닉네임을 선점 후 한국 서버에서 연습하는 외국프로 콘셉트으로 방송을 진행했다.
36,"물론 진짜로 믿는 사람은 소수였으나 슈퍼 플레이 시 ' 와 역시 미국의 페 이 커 ㄷ ㄷ ㄷ' 따위의 콘셉트질 놀이, 게임 내 픽 창에서 짧은 영어로 미드를 양보해 달라고 하면 군말 없이 내주는 모습과 BJ 억 슨 드립 등의 모습이 이 웃음을 자아내 시청자를 꽤나 모으기도 했다."
37,후반기로 갈수록 마이크를 키고 숨겨 왔던 찰진 입담을 과시하자 팟 통령 자리에 취임하게 되었다.
38,그 후 2000명 가량의 많은 시청자들을 데리고 챌린저를 목표로 시즌 말 잠과 밥을 제외한 모든 시간을 롤에 쏟아부었으나 P1 ~D2 구 간의 지 박 령과 광대역할을 겸업하다 결국 마스터로 마무리했다.
39,이때 나온 명대사 우 맘 챌 과 오열이 아주 강렬한 인상을 남겨 아직도 자주 언급되는 편. 2017년부터 는 카카오팟에서의 팟 통령 자리를 굳건히 하고 그를 추종하며 박 종우 이름 석자를 외쳐 대는 팬 덤도 생기는 등 성공 가도를 달렸다.
40,박종 우의 추종자들이 카카오 닉 뿐만 아니라 롤 계정 닉까지 바꿔 가며 친 추 테러를 하고 챌린저나 프로들이 그를 먼저 알아보는 등 굉장히 유명세도 떨쳤다.
41,"시즌 7 종료 일이 다가오자 여느 때와 다름없이 광대 짓을 일삼다 이번엔 다르다며 마음을 다잡고 랭크 게임을 시작. 두 달 가까이 잠자는 시간 빼고 롤에 인생을 갈아 넣은 결과, 시즌 마감 2 주전에 챌린저를 달성하고 시즌을 마감했다."
42,광대 짓을 일삼는 박 종우라도 1년 간 챌린저를 갈망했던 진심만은 느껴졌기에 시청자들은 다같이 진심으로 축하해 주었다.
43,일부 시청자들은 김 무진과 듀오를 해서 올린 거고 순전히 박종 우의 실력이 아니라고 하는데 이것은 사실이 아니다.
44,당시 무진과 듀오를 한 게임은 10판 이내였고 그 마저도 다 이긴 것도 아니다.
45,( 본인 피셜로 6승 2패) 유 튜브에 돌아다니는 챌린저 승격 전 마지막게임 영상만 봐도 무진의 아이디는 눈 씻고 찾아볼 수가 없다.
46,2017년 말 시즌 7가 종료되고 나서 대만 쪽 프로 팀 [7 ]에게 프로 제의가 왔었다.
47,예전부터 프로 생활을 다시 하고 싶다고
48,얘기해 입단이 확실시 되는 듯 했으나 구단 측에서 제시한 연봉에서 네 고 [8 ]를 해 상금 전액 본인 소유 등의 추가 조건을 얻었으나 거기서 멈추지 않고 더 네 고를 하다가 퇴짜 맞았다.
49,후에 그 전 조건으로 그냥 들어가겠다고
50,했음에도 받아 주지 않아 또한 번 비웃음거리가 되었다.
51,사 딸라 박 그리고 G-Rex 는 롤 드컵에 진출했다.
52,박종 우가 방송을 하며 플레이한 게임의 목록이다.
53,리그 오브 레 전드: 방송에서 주로 하는 게임이다.
54,추가 콘텐츠로 굽챔스를 2019년 2월 26일에 맛보기로 시작했다.
55,오버 워치: 트위치 이적 후에 롤 게임 큐를 잡으며 했던 게임이다.
56,롤과는 다르게 골드다.
57,로스트 아크: 오픈 초반에 잠깐 했던 게임이다.
58,지금은 방송 중에 하지 않는다.
59,리틀 나이트 메어: 공포게임으로 굽 네 단의 이목을 끌었다.
60,섯 다: 리그 오브 레전드와 메이플을 제외하면 그나마 많이 플레이한 게임. 시참은 패 시브이다.
61,오토 체스: 굽 블 린( 고 블 린) 조합을 주로 한다.
62,"전략적 팀 전투: 리그 오브 레전드를 시작하기 전에 1,2 판 하면서 손을 풀던가 연패를 해서 멘 탈이 갈렸을 때, 왠지 솔 랭을 더 하면 안될 것 같다는 생각이 들 때 자주 한다."
63,티어는 2019년 8월 기준 플 레 티 넘 4. 썸 썸 편의점: 무려 20만원 도네를 받고 황급히 게임을 닷 지하여 시작한 게임이다.
64,주인공의 대사를 읽어 준다.
65,게임 도중 달달 한 대사나 부끄러운 그림이 나오면 스트리머의 얼굴이 빨개지는 것을 목격할 수 있다.
66,박 종우 특유의 씹덕스러움으로 롤 붕 이와 메 붕 이의 화합을 이끌어낸 게임. 기적의 분식집: 레 전 드들이 모인 씹덕 게임이다.
67,박종 우의 웃음 참기 또한 레게 노. 전염병 주식회사: 코로나 바이러스로 인해 나라 전체가 들썩이던 당시 잠시 했던 게임 박 종우한 폐렴으로 세계시민을 몰살하는 모습이 아주 인상 깊었던 게임이다.
68,"영원 회귀: 블랙서 바이 벌: 박 종우를 28 시간 노 방종으로 이끈 게임. 파카와 듀오도 하는 등, 2020년 11월 말에 들어서 박 종우가 아주 재밌게 하고 있는 게임. 메인 컨텐츠인 롤보다도 시청자가 더 잘 나올 정도다."
69,그만큼 저격 유저들을 많이 만나는 중. 하지만 블 서는 저격 유저들에게 무관용 정책을 펼치므로 몇몇 악질 저격 유저들이 밴을 먹은 적도 있다.
70,그러다가 2020년 연말쯤에 스트 리머 대회에서 다주와 김뿡과 팀이 되면서 박 종우가 슬슬 양지로 진출하게 된 계기를 마련해 준 게임이다.
71,어 몽 어스: 블 서에 이어서 박종 우가 본격적으로 양지로 나가게 된 게임이다.
72,초대 : 우_ 종 박 (2018 년 8월 17일 ~12 월 21일 )2 대 : 유진( 본명) (2018 년 12월 23일 ~2020 년 1월 1일 )3 대 : 김원 숭 (2019 년 6월 25일 ~2020 년 1월 1일 )4 대 : 우_ 종 박 (2020 년 1월 1일~ 2020년 4월 3일) [16 ]5 대 : 빨간 눈알 6대 : 김 스팀 ( 언제부터 인지는 정확하게 파악이 되지 않음) 왕을 도와 방송을 매끄럽게 해 주는 진은 검( 방송 매니저) 을 기리기 위한 문단 내가 바로 박 종우 통 칭 내 바 박으로 박 종우의 오래된 충신이다.
73,방송 초기부터 매니저를 담당했다.
74,"특기는 씹덕도 네 재 슥 짱 A.K .A. 자 이 스키 군으로 노랑 시티에서 이주해 온 3 인방( 이 재석, 박 종우, 정 영우) 중 한 명이다."
75,"영우 쿤 A.K .A. 파 영우, 그라 가스로 노랑 시티에서 이주해 온 3 인방( 이 재석, 박 종우, 정 영우) 중 한 명이다."
76,우 종 박 1대 편집자였다.
77,나름의 채금기준을 정해 두고 채팅 방 관리를 한다고 하니 참고 바람. 진은 검 채금기준 probe3028 박 종우 방의 큰손. 회장님이시다.
78,회장님일 뿐만 아니라 진은 검 역할도 굉장히 잘 수행하고 있다.
79,특기는 씹수 솎아 내기 예시 1 예시 22018.12.13 ~2019.2 .12 라는 제목으로 트게 더 에서 퇴임식을 진행했다.
80,원래는 1 달만 하려고 했으나 어쩌다 보니 오랜 기간 봉사했다고...
81,퇴임 식 커 세어 박진은 검 공채를 합격한 인물. 한 달 정도 관리 하다 경질되었다.
82,스트리머와 진은 검 간의 마찰이 있었다고
83,트게더에 글이 올라왔었다.
84,"박 종우가 먼저 커 세어 박에게 일을 똑바로 안한다고 몇 번 욕설을 했고, 커 세어 박은 이에 화가 나 흑 화했다."
85,결국 진은 검을 단 상태 애서 박 종우 방송에서 도배를 하는 등 어 그로를 끌다가 짤렸다.
86,"이후에 짤린 검 어 그로를 피하기 위해 트위치에서 본인의 프로필을 세탁했지만 꼬리가 밟혔고, 악성 굽 네 단이 되어 있었다고"
87,한다.
88,쟈 킹 추가로 채용된 진은 검이다.
89,본인의 의사로 퇴직하였다.
90,믹스 종우라
91,떼일 일진은 검이다.
92,2019년 2월 20일에 진은 검을 잠시 맡았다승우얌추가로 채용된 진은 검이다.
93,원래는 진은 검을 뽑지 않으려 했으나 어 그로가 너무 심해 져서 새롭게 선발했다.
94,찌끄 레 기진은 검 공채는 더 이상 없는 듯하다.
95,캬 하하 2013년 Team NB에서 만 나 같이 롤 챔스 예선에 나간 것을 인연으로 친해 졌다고
96,한다.
97,캬하하와 박 종우 서로 입으로 본인들만큼 친한 친구가 없다고 말할 정도로 가까운 사이이다.
98,"듀오는 솔 랭에서 우연히 만나면 그대로 듀오로 이어 가는 편인데, 매번 베스트 프렌드답게 꿀케 미를 시청자들에게 선사해 준다."
99,"듀오할 때 박종 우방 시청자들이 캬하하를 "" 그 별명 ""으로 부르면 박 종우가 그러지 말라며 커버해 주는 훈훈한 모습도 자주 연출된다."
100,굽 청자들이 애칭으로 캬하하를 사단장님이라고 부르기도 한다.
101,"논란이 되는 비인가 프로그램 사용 여부에 관련해서는 박 종우는 "" 자기는 아니라고 하는데... 친구 이긴 해도 그 건 아니야"
102,"ㅋㅋㅋㅋㅋㅋ 내가 보기엔 맞아 ㅋㅋㅋㅋ ""라고 언급했다."
103,뒷통수 박 캬하하의 슈퍼 플레이가 나오자 도네로 캬하하에게 ' 그것' 켰냐고 물어보면 3천원을 준다고 하자 ' 석현아... 너 그거 켰어?
104,' 라며 장난치는 모습도 보인다.이
105,재석 같은 다음 팟 팟 통령 출신이며 다음~ 카카오 팟 지옥의 수라장을 함께 한 사이이다.
106,영우 쿤 미 드정 글 듀오를 자주 하는 편이다.
107,굽 튜브에 듀오 동영상이 올라와 있으며 서로에게 농담하는 것을 보면 꽤 친한 듯 하다. 같은 다음 팟( 카카오 TV) PD 출신이다.
108,"괴물 쥐 괴물 쥐도 방송할 때 피닉스 박 관련 얘기가 나오면 ' 종 우형' 이라고 하고, 박 종우 본인은 ' 이이 잉~ 기모 링' 을 시전한 적이 있다."
109,2020년 박 종우와 괴물 쥐 모두 크로 아 서버에서 메이플을 하는 중인데 겨울에 검 마 격파를 목표로 하고 있다고.
110,가끔 방종하고 찾아와 채팅을 치기도 한다.
111,시간이 되면 괴물 쥐랑 같이 하드 보스 트라이팟을 하는데 괴물 쥐만 데카 아웃하고 깨는 경우가 많다.
112,(...) 최근에는 같이 블랙서 바이 벌을 즐기는 중이며 PAKA도 함께 하여 스쿼드를 돌리는 경우도 많다.
113,[17 ]2021 년 1월 7일에서 신라 호텔에서 만 나 같이 자기도 하였다.
114,"꿀 탱탱 캬 하하 와 함께 몇 없는 친한 아프리카 TV BJ 중 한명, 같이 아프리카 TV 멸망 전도 두 번 참가할 정도로 친분 있는 사이다. 신해 조 검마"
115,팟의 일원으로 새벽에 박종 우가 메이플스토리를 하고 있으면 채팅을 치는 모습이 발견되고 있다.
116,치킨 쿤검마팟의 일원으로 같은 원주인이라는 공통 분모가 있다.
117,파카 가끔 롤 듀오를 하거나 서든 어택을 같이 하는 등의 모습을 보여줬었고. 최근에는 블랙서 바이 벌을 같이 즐기는 중이며 괴물 쥐도 함께 하여 스쿼드를 돌리는 경우도 많다.
118,츄 르 밍 박종 우의 여자친구로 굽 비 [18] 님이라고 불린다.
119,최근 방송을 시작했고 박 종우 와의 달달 한 여행도 츄르밍의 방송에서 진행했다.
120,운전은 츄르밍이 다했다 고... 랄로 같은 다음 팟 향우회 출신으로 매니저를 달고 종종 방송 댓 글 창에 출연해 소소한 재미를 주고 간다.
121,김 뿡 2021년 1월 3일 진행된 제 3차 따 효 니 배 블 서 대회에서 6 라운드 중 4 라운드 우승을 함께 한 우승 멤버로 음지 탈출(?) 프로젝트에 동참했다.
122,다주 2021년 1월 3일 진행된 제 3차 따 효 니 배 블 서 대회에서 6 라운드 중 4 라운드 우승을 함께 한 우승 멤버로 음지 탈출(?) 프로젝트에 동참했다.
123,탬 탬버린 김 뿡을 통해 친분이 생긴 사이. 방송에 나타나 채팅 치면서 노는 모습을 종종 볼 수 있다.
124,시청자들의 악명과는 다르게 논란은 없는 편이다.
125,근접 챔피언( 밀리
126,챔피언) 을 심각하게 못 다룬다.
127,"본인도 근접 챔프엔 전혀 재능이 없다고 인정할 정도. 애초에 본인이 MVP 연습생에서 방출 당한 이유도 당시 최강 OP 챔피언인 제 드가 근접 챔피언이라 못 다뤄서 인데, 이것은 아무리 노력을 해도 바뀌지 않는 점. 특히 시즌 8,9 에서는 미드에서 최고의 픽으로 통하는 챔피언들( 갈리오,"
128,"아 칼리, 아트 록스, 이 렐 리아) 이 전부 근접 챔피언이라 티어를 올리지 못하고 있다."
129,"하지만 시즌 10에서 부터는 라인 전 반반 챔 들이 하나씩 무너지기 시작하면서 박종 우도 아 칼리, 키 아나, 이 렐 리아 같은 챔피언들을 열심히 다루는 모습이다."
130,"본인의 플레이 중 AP 메이지 챔피언에 대한 자부심이 상당한 데, 실제로 박종 우의 최대 장점은 AP 원거리 챔피언을 다룰 때 보여주는 거리 조절 능력이다."
131,"현재는 나이 때문에 피지 컬 이 상당히 많이 떨어졌지만, 가끔 씩 나오는 번뜩이는 거리 조절 능력은 보는 사람이 감탄할 정도로 뛰어나다."
132,사실상 거리 조절 능력 하나만으로 챌린저에 올라 섰다고 평가할 수 있을 정도 .도 라에 몽을 닮아서 별명이 도라에몽이다. 개요의 세 번째 사진이 도 라에 몽 코 스프 레. 배 쪽의 낙서는 4 차원 주머니 한때 왕좌의 게임 BGM을 틀고 가 오를 잡으며 게임했었던 적이 있다.
133,하필 그때 플레이하던 챔피언이 아지 르. 그래서 슈퍼 플레이를 보였을 때 왕이 시여.. 라고 부르는 밈이 있다.
134,카카오 TV에선 온 게임 넷 롤 챔스 중계가 계약되어 있지 않아 가끔 롤챔스를 같이 보기 위해서 만 방송을 켰던 트위치임에도 불구하고 첫 방송 때 알아보는 이들이 굉장히 많았는데 이는 카카오 TV에서 온 게임 넷을 볼 수 없었던 박 종우 추종자들이 트위치로 온 게임 넷을 시청하며 박 종우와 연관된 것이 나올 때마다 채팅 창에 박 종우 세 글자를 빽빽하게 도배했기 때문. 뿐만 아니라 ' 박 종우였으면 ~~ 했다' ' 박 종우 VS ( 미드라 이너) 누가 이기냐?
135,' 따위의 어 그로도 같이 성행했다.
136,같은 맥락으로 페 이 커 와 솔 큐에서 몇 번 만난 것 이외에 아무런 접점이 없음에도 불구하고 트위치 개인방송에서 박 종우 세 글자를 입력하면 자동 밴을 당한다.
137,이 모든 것이 트위치 이적을 고려조차 안 한 몇 달 전부터 이뤄 지던 것. 카카오 TV 내에선 Dopa 의 채팅 방에서 박 종우가 도배되었다.
138,카카오 TV는 금지어 기능이 없기 때문에 방송 화면에 출력하는 채팅 창에선 '♡' 로 필터링되고 매니저에게 강 퇴 당한다.
139,이는 다른 방송 다 그렇겠지만 처음부터 그런 것은 아니고 꽤 오랜 기간 동안 박 종우 언급을 허용했으나 박 종우 3 글자만 외치는 사람들이 너무 많아서 금지 어로 정해진 듯 하다. 때문에 그 전에 녹화된 방송분이 유 튜브에 업 로드되면 도대체 박 종우가 누구냐고 물어보는 이들이 영상마다 하나씩 댓 글로 달려 있을 정도였다.
140,롤 닉네임을 끊임없이 바꾼다.
141,"계정 수도 6개로 확인되는데, 주로 메 르 엠이나 에드워드 엘 릭 같은 소년 만화 등장인물들이나 애니메이션 명대사, 중 2 병스러운 닉네임을 자주 채용한다."
142,"최근 들어서는 방제도 중 2 병 티가 나는 방제로 매일 매일 바꾸는 추세. 미드 유저인데도 탑신 병자에 버금가는 멘 탈을 지니고 있으며, 팀이 의아한 플레이를 하면 마이크로 찰진 욕을 쏟아 내곤 한다 그러나 자신은 이를 보고 ' 욕' 이 아닌 ' 승부욕' 이라며 롤을 안 하면 순한 양이다, 롤하며 욕 안 해본 사람만 나에게 돌을 던져 라 따위의 추한 변명을 하곤 한다."
143,하지만 프 렌즈 마블이 유행할 당시 하루종일 할 때의 모습을 보면 순한 양이란 말이 거짓은 아닌 듯하다.
144,그래도 내로 남 불은 아닌지라 자기가 쌀 때 팀원에게 쌍 욕을 먹으면 호쾌하게 웃어넘긴다.
145,후원으로 신청을 받거나 기분이 좋으면 노래를 부르곤 하는데 의외로 가창력이 괜찮다 싶다가도 올리지 못하고 추해 지는 모습이 자주 목격된다.
146,"카서 스박 진혼곡. 순. 혈. 미. 드로서 미드에 상당한 자부심을 가지고 있어서 서포터를 ' 와 드쟁이', 정글 러를 개백정 XX라고 부르며 천시한다."
147,"때문에 서포터로 매칭이 되면 중국인 코 스프 레를 하며 미드 양보를 부탁하지만, 수틀리면 정화& 유 체화를 들고 치킨 게임을 한다."
148,그러나 탱크& 오 뀨 듀오가 잡혔을 땐 버스를 타기 위해 조용히 소라 카를 픽 했다가 졌다.
149,마스터 승급 4시간 만에 4 연 패를 박고 다이아 1로 강등된 적이 있다.
150,현재 다시 ' 량 현 량하' 라는 계정으로 마스터를 찍으며 회 장님들께 20만원을 후원 받았다.
151,하지만 올라간지 얼마 되지도 않았는데 마스터 100점 부근에서 욕을 엄청나게 해 정지를 받았다.
152,며칠 이상 제재를 받으면 시즌 마무리 보상을 받을 수 없다는 걸 안 해적은 홈페이지에 앙망 문을 작성하지만 답변이 없어 반쯤 포기한 걸로 보인다.
153,"그 후 귀신같이 다 2 계정으로 다시 마스터를 가기 위해 게임 중, 인 게임에서 정글 유저 탓을 하며 욕을 했었는데 그 정 글 유 저가 스코어의 부계 정이었다는 사실이 드러나 세"
154,"계정부 인 벤 에 박제가 되어 시청자들 사이에서는 루피 박, 오열 단, 초신성 박으로 오늘도 또 다른 별명을 생성 중이다."
155,"종우 방 채팅 창은 트위치( 다음 팟) 의 하수구, 임 펠 다운이라는 얘기가 나올 정도로 채팅 창에 어 그로, 친목 종자들이 많으며, 채팅 창이 매우 혼란스럽다."
156,"그게 어찌 보면 이 방의 매력이 기도 하다. 문서를 보면 알겠지만 이 방송인의 매력은 재 스기처럼 그 특유의 병신 멘 탈과 트롤링, 추잡함, 안 습함에 있으며 본인 자체가 리액션이 좋아서 광대라고 도 불리기도 하고 허세나 중 2 병 짓거리를 하지만 때때로 멋진 모습을 보일 때가 있어서 팟수들의 호응을 얻었다."
157,또 한 오열과 굽네
158,치킨 도게 자와 같은 갖은 사건 사고를 일으키는 등 온갖 병신 짓을 하면서 박 종우란 존재 자체가 카카오의 밈의 일종이 되게 만들었다.
159,속칭 굽 네 단( 굽 베) [22] 박 종우는 어지 간 하면 밴을 하지 않는데 그래도 시청자들이 채팅 창에 일 베 드립을 치는 걸 극혐 하여 밴할 정도다.
160,롤 스킨에 박 종우를 붙인 닉들이 다이아 랭크에서 클럽 명 하일 박 종우를 달고 활개치고 있다.
161,카카오 티비에서도 닉네임이 15 글자까지 되는 시스템을 이용해서 온갖 기괴한 닉네임을 달고 어 그로를 끄는 경우가 많다.
162,이상한 성적 취향에 박 종우를 붙인다 든지... 현재 박종 우가 트위치로 떠난 지 거의 1년이 되어가는데도 종우 어 그로 나 박종우닉이 간간히 보일 정도로 파급력이 컸다.PD
163,아무 무( 엄 준 식) 가 악질 닉네임을 달고 다니는 녀석들을 날 잡고 총살처분한 적이 있다.
164,그러나 이젠 자신의 이름을 닉네임으로 쓰는 악질들을 처분해야 할 마당이다... 악질들이 어 그로를 끌 때 닉에 박 종우를 달고 아이디를 파는 경우가 많다.
165,박 종우 본인은 그것은 문화 그 자체라서 어쩔 수 없다고 본인은 클린하게 방송하려고 노력하고 있다면서 억울함을 호소했다.
166,트위치로 새로 둥지를 틀면서 이를 뿌리부터 뽑아낼 것임을 다짐했다.
167,그러나... 2019년 3월 기준 트위치에서 닉에 박 종우를 달고 다니는 유저만 무려 650명이 넘게 확인되고 있다.
168,그리고 종 우방에도 조강현 닉네임이 가득 하다 공식 유 튜브가 생겼다!
