,sentences
169,"피닉스 박과 거 다이아 2 정도는 가볍게 찍어 누르고 , 시즌 말에는 적어도 마스터 200점 대는 찍었던 것에 반해 현재 팀 운과 폼 저하, 메타, 그리고 나이 등의 여러 요인으로 다이아 2 ~ 다이아 3에 머물고 있고 심지어 연패하는 날은 다이빙, 다 삼 빙 을 넘어 다 4 빙 을 하기도 한다."
170,시청자 수랑 구독자 수 등 방송은 흥하고 있는데 정작 본인은 슬럼프로 인해서 엄청난 스트레스를 받고 있는 듯하다.
171,연패 했을 때 성질 잘못 긁으면 밴 당하니 주의. 특히 게임 실력 관련해서 지적을 하거나 하면 쌍 욕과 함께 밴을 당할 수 있다.
172,굽게 더에 띵 작이 올라왔다.
173,링크 명절을 맞아 굽 독권 이벤트를 진행하였다.
174,주의해야 할 점은 팟 수 솎아 내기만 해당하며 아래 링크 글에 댓 글로 제보해야 한다.
175,자세한 내용은 링크를 참고 # 다음 팟 시절 과로 사의 여동생인 순 당무에게 라인 전에서 털린 적이 있다.
176,그런데 그 이후 굽 네 단에 의해 순당 무가 테러를 당해 방송을 접었던 적이 있다.
177,이는 과로 사가 뜨고 난 후에 알려 진 사실이다.
178,"[23] 잦은 지각과 휴 방, 저조한 텐션과 더불어 경쟁자들이 트위치로 넘어와 현재는 트위치 방송 시청자 수가 몇 개월 사이 절반 이상 줄어든 상황이다."
179,"본인도 이러한 상황을 인지, 방송에 임하는 태도를 달리하겠다 고 굽 네 단에게 약속했으나, 늘 그렇듯 그 다짐도 오래가지 않아 굽게 더 내 여론도 처참하다.2020"
180,년 4월 6일부터 메이 플 스토리 갤러리 개념 글에 피닉스 박이 박제되고 있다.
181,[200406] 요새 뜨고 있는.. 메이 플 루 키들 정리 ..jpg [200407] 팩트) 지금 크로 아 사태 정리해 준다.jpg
182,[200407] 4월은 피닉스 박의 거짓말 [200423] 크로 아 [INFINITER] 박 종우.. 핑크 빈 서버 [ 서 열정리] [200507] 크로아의 [ 초신성] 하일 박 종우의 이야기 들어볼래....?
183,[200515] 오늘 새벽 축축 게이 조만간 트위치 고티어 자낳대를 하는 것으로 추정된다.
184,6월 4일 방송에서 알만한 사람들이 다 나오는 트위치 고티어 자낳대를 할 예정이라고 말했다.
185,타 플랫폼과 하는 플랫폼대전에는 참여하지 않는다고.
186,멤버는 아래와 같다.
187,6월 5일 괴물 쥐 방송에서 확정.- 배 신 져스- 탑 자 이 스키 군 정글 발 칸 최 현진 미드 피닉스 박원 딜 괴물 쥐서 폿 희성에 몽 대회는 일주일에 1번 하며 자 낳대
188,가 아니라 도장 깨기 형식으로 5 인으로 배신 져스 팀에 도전하면 된다고 한다.
189,박 종우 방송 채팅 창에서 자주 볼 수 있는 드립들. 트게더에 있는 것을 보고 참고 했다.
190,시청자 수에 비해 파급력이 무시 무시하다.
191,"박 종우! 박 종우! 박 종우! 박 종우! 박 종우! 박 종우! 박 종우! 박 종우! 박 종우! 박 종우! 박 종우! 박 종우! 박 종우! 박종 우가 슈퍼 플레이를 하였을 때 채팅 창에 도배되는 특유의 밈. 박 종우 콘도 있어 굽 독자들은 박 종우 콘, 굽 독 못한 시청자들은 박 종우! 박 종우! 박 종우 !를 외친다."
192,변형으로 박종 우의 광대 본능이 튀어나왔을 때 박 종우? 박 종우? 박 종우 ?를 외치기도 한다.
193,과한 도배( 박 종우! 10개 초과) 는 ' 국 룰' 이라 칭하여 얄 짤 없이 밴을 한다.
194,다른 방에서 도배해도 박 종우에게 제보가 들어 가면 밴을 먹을 수 있기 때문에 조심할 필요가 있다.
195,최근에는 다른 롤 스트리머들에게도 본명을 부르면서 도배하는 문화가 퍼지고 있다.
196,박 종우 그는 신인가?
197,박종 우가 슈퍼 플레이를 하였을 때 도배되는 밈이며 신종 우 그는 박인가?
198,라는 형태로도 자주 사용되고 있다.
199,역시 롤 문화의 수장답게 아주 넓게 퍼진 밈으로 최근에는 스트 리머들을 넘어 해설자 까지도 사용하는 놀라운 수출력을 보여 준다.
200,"바리에이션으로는 ' 신종우, 그는 박인가?"
201,"' ' 박 종우, 그는 ( 병) 신인가?"
202,"' ' 박 종우, 그는 신인가?"
203,수'(...) 등이 있다.
204,원본은 파이어 펀치로 추정. 시참( 시청자 참여) 분명히 큐를 가리고 솔로 랭크를 함에도 매 번 저격이 있다.
205,마스터~ 다이아 구간은 전부 박 종우 저격 러가 아니냐
206,는 말이 나올 정도로 많다.
207,그래서 생겨난 별명이 다이 아의 아이 돌. 채팅 창에서부터 박 종우를 외치는 저격 러들을 볼 때마다 시참 ON이 도배된다.
208,"시청자와 매판 함께 소통하는 모범적인 스트 리머 한 게임에 저격 러가 1~2 명 있는 건 기본이고, 심하면 박 종우를 제외한 9명 전원이 저격인 경우도 종종 나온다."
209,아예 다이아 이상의 티어를 가진 팬들이 박 종우 저격이라는 클 랜을 만들어서 다이아 이상 고수 유저들이 수십명 모인 클 랜도 있을 정도. 이들은 정말 어디에 나 있다.
210,다이아 구간은 물론 챌린저를 가기 위해 마스터 중 상위권에서 솔 랭을 돌리는 박 종우를 수시로 저격해서 에코로 후 두려 패는 유저도 있었다.
211,"이 유저가 사이드 박, 2018년 케 스파 컵 keg 서울의 미 드이자 에코 장인으로 유명한 Plex 이다."
212,"이 때문인지 박 종우 자체의 인지도 때문인 진 몰라도, 게임을 하든 유 튜브 클립 본을 보든 ' 광 대' 라 던가 하는 박종 우의 밈까지도 알아봐 주는 사람들도 꽤 많이 있다."
213,"다만, 저격 러로 인해 게임이 엉망이 되는 일은 매우 드문데, 한번 트롤 러로 찍히면 무한 닷 지로 정상적인 게임을 하기 어려운 다이아 상위권 유저 들인 만큼 고의적으로 트롤을 하지는 않는다."
214,심지어 박 종우에게 관심을 받고자 미친 듯이 캐리하기 위해 서로 경쟁을 하는 훈훈한 모습을 보여준다.
215,물론 박 종우가 죽거나 이상한 플레이를 하면 아군이든 적이든 바로 박 종우에게 엄청난 비난을 내뱉는다.... 굽 1. 굿 2. 빼먹다 3. 횡령 4. 박 종우 1. 굽과 굿이 발음이 비슷하다.
216,"9006 등으로 쓰인다.2,"
217,"3, 4 : 박 종우를 상징하는 단어이다."
218,아래에 있는 굽네
219,"치킨 사건에서 유래했으며, 그로부터 파생된 말로 미 드오븐 (open- >oven) 이 있다."
220,"잘 쓰이진 않지만, ' 순 살 미드' 라는 단어도 있다( 순혈 미드). 팟수들이 쓰는 모 좀 드립은 얄쨜없이 밴이다."
221,국 룰( 굽 룰) 국민 룰이라는 뜻. 종우 방에서 통하는 암묵적인 규칙을 말한다.
222,현재는 채팅 창 규칙에 적혀 어느 정도 명 시화되었다.
223,"피닉스 박 채팅 방 규칙- 시청자 간의 싸움, 친목 X- 타 스트 리머 비하 X- 컴퓨터, 군대, 대학 어 그로 X- 질 나쁜 커뮤니티 용어 X [9]- 자기만 아는 드립 사용 X- 무분별한 박종 우도 배 X 10개 까지만- 손 투리 사용하지 말아 주세요."
224,[10]- 재미있게 봐주시고 매너 채팅해 주세요
225,^^ 이 외에 박 종우 방에서 밴을 당했을 때 2만원을 내면 밴을 풀 수 있다는 [11] 불문율이 있었으나 2020년에 랜덤 룰렛으로 바뀌었다.
226,드디어 박종 우가 채팅규칙을 트게더에 공지사항으로 올렸다.
227,현재 지켜 지는 규칙이 하나도 없다.
228,채팅규칙 왕이 시여 박종 우가 화려한 플레이를 했을 때 사용하는 말. 아지 르를 플레이하면서 왕좌의 게임 드라마 OST를 틀었던 것에서 유래했다고
229,한다.
230,가끔은 비꼬기 위해 왕 대신 다른 단어를 붙이기도 한다.
231,"(ex. 광대 시여, 졷이 시여) ㅇ ㅇ 박 유래는 상단 참조. 해 당 행위나 명사의 뒤에 박을 붙이면 된다."
232,"예를 들어 럼 블 박( 열관리), 사이드 박( 사이드 운영을 주로 함), 하기 스박, 광대 박( 개그) 등. 슈퍼 플레이를 시도 하다 처 참하게 망했을 때나 우스꽝스럽게 죽었을 때 앞에 각종 ㅇ ㅇ 시리즈들을 붙인다."
233,라 노 벨 메자 이의 영혼 약탈자를 뜻하며 25개의 스택을 다 채웠을 때 완독했다고
234,하며 스택을 다 잃었을 때 찢어졌다거나 분서 갱유 되었다고
235,한다.
236,그 외에도 ' 자서 전' 이라는 표현이 있다.
237,ㅇ ㅇ 마이 정글 러를 백정으로 보는 순혈 미드 박 종우가 싫어하는 정 글러로 rpg 하는 정글 러를 보통 지칭하며 그냥 그 챔피언을 지칭하는데 사용하기도 한다.
238,마스터 이 문서에도 서술되어 있다.
239,"총 든 마이 : 그레 이브 즈 , 낫든 마이 : 케인 , 칼 든 마이 : 마스터 이, 활 든 마이 : 이즈 리얼 , 몸짱 마이 : 문도 박사 . 번 외로 창 든 소라 카 : 니 달리 가 있다."
240,종우가 매우 싫어하는 챔피언이라고... 내 바 박' 내가 바로 박 종우' 의 줄임말로 두 가지 의미를 담고 있다.1.
241,뽀삐 2. 매니저 3. 씹덕도 네 보통은 매니저인 ' 내가 바로 박 종우 '를 지칭하는 것으로 뽀삐 장인으로 유명하다.
242,대표적인 박종 우의 충신으로 나 겜 장인 어른에 박 종우와 듀오로 출연한 적도 있다.
243,최근 들어 씹덕들이 박종 우의 충신 ' 내가 바로 박 종우 '를 사칭하여 씹덕 영상을 도 네이션하는 일이 잦아지자 씹덕 영 상도네를 내 바 박이라고 부르기 시작했다.
244,"다 2 빙 다이아 2로 강등 되면 쓰는 용어. 변형으로 다 3 빙, 다"
245,4 빙도 있다.
246,다 4 다 난이라는 말도 있다.
247,광대' 니들 재밌으라고 그러는 거야 '에서 유래하였으며 추하게 죽거나 웃기게 죽었을 때 사용한다.
248,"변형시켜 ' 팡 머', ' 팡 머 박' 등으로 사용한다."
249,드입 달' 드디어 입구에 달했는 가' 의 줄임말. 백문이 불여 일견이라고 영상을 보자. 드입 달 리무진프로 게이 머 Moojin을 뜻한다.
250,무진이 와 듀오를 하는 경우 리무진 탄다고 부르기도 한다.
251,이런 발언은 ' 왕' 의 자존심을 상하게 하여 ' 너 나가 '를 시전할 수 있기에 주의해야 한다.
252,"영우 그라 가스를 지칭하는 말로, 친한 친구인 영우가 뚱뚱 한 이미지를 가지고 있어서 유래했다."
253,그 시간방송을 보면 알 수 있다.
254,특정한 시간에 월등히 자주 죽는데 보통 15분 언저리에 튀어나오는 광대를 주체하지 못하고 죽는다.
255,"이 15분 근처를 ' 그 시간' 이라고 부르며, 15분까지의 플레이는 정말 한없이 완벽에 가까워서 15분 이전에 킬 을 따면 15분 페 이 커라 고도 불린다."
256,젠장!!! 믿고 있었다고!!!!
257,"씹덕 드립의 일종인데, 용법은 박 종우! 드립과 유사하다."
258,리스크가 심각하게 높은 슈퍼 플레이를 해냈을 때 쓰면 적절하다.
259,굽 네 단 굽네의 이름 아래 모인 왕의 신하들을 말한다.
260,' 굽 민' 이라고 불리기도 한다.
261,예전 노랑 씨티 시절엔 워낙에 악질 시청자가 많아서 일 베 충에 빗 대어 ' 굽 베 충' 이라고 불리기도 하였다.
262,뭐 하 노누?
263,"하하 하하 하하 하하~ 예 전 아프리카 TV, 현재 유 튜브에서 방송을 하고 있는 커 맨 더지 코( 본명 박광우) 가 했던 대사로, 지 코 특유의 찰진 말투와 웃음 때문에 박 종우나 그 팀원, 상대팀이 팡 머 짓을 하면 이 대사로 도배되는 경우도 잦다."
264,유 튜브 영상 도네와 결합되면 그야말로 금상첨화. 카팟에서 도랄팤을 중심으로 유행을 타는 중이다.
265,"원본은 ' 뭐 하 노?' 지만, 손 투리 금지가 국 룰에 추가된 관계로 그대로 채팅 창에 쳤다간 밴을 당하니 ' 누' 로 바꿔 쓰자. 아기적 편집 악 의적 편집을 소리나는 대로 읽은 것으로 baby 적 편집이라고 부르기도 한다."
266,박종 우가 본인이 보기에 부끄러운 영상이 도네
267,되었을 때 아기적 편집 좀 그만 하라고 말한다.
268,"미친년, 미 친련 정말 미친 짓을 하는 대상을 보거나 어이 없는 상황이 나왔을 때 혹은 보잘것없는 대상이 대단한 일을 해냈을 때, 도 네이션( 대개 성적인 부위가 비정상적으로 부각돼 있거나 신체 비율이나 상황, 목소리 등이 헛웃음만 나오는 등장인물 [12] 이 나오는) 등을 보았을 때 박 종우가 자주 사용하는 대상을 지칭하는 단어이다, ~~ 하네?"
269,미 친련.. 의 형태가 주를 이루며 굉장히 찰지다.
270,원본은 랄로로 추정. 대개 패도 파가 방송에서 언급한 내용으로 피닉스 박의 방송에 자주 도 네이션된다.
271,뜻은 “ 게임 시작하고 인 베 안 보는 애들 대가리 개 패고 싶다” 라는 뜻. 박 종우는 항상 게임 시작 이후 담배를 피우러 가기 때문이다.
272,이때 도파 음성 도 네이션과 대화를 하듯 다이아에선 이렇게 해도 된다고 말했다가 이어지는 도파 목소리로 ' 응 그게 딱 니 수준이다' 까지 물 흐르듯 대화가 이어지는 클립이 있다.
273,한번 찾아보자 .MDCM 이 D 진 C( 챔프) 라는 뜻으로 그냥 답도 없는 사기 챔프를 의미한다.
274,박 종우는 MDC가 뭐냐고 물어보는 신규 시청자들에게 Most Disgusting Champion 이라고 순화해 설명한다.
275,"최근 그 플랫폼에서 시작해서 엄청나게 유행 타는 중... 대표적인 MDC로는 아트 록스, 조이, 카 밀, 아 칼리, 이 렐 리아 등이 있다."
276,ㅏㅑㅑ 종 우가 담배를 피러 자리를 비운 사이에 대개 패와 함께 가장 많이 도 네이션되는 씹덕 영상. 금빛 모자이크에서 쿠죠
277,카렌이 아야 야를 외쳐 대는 장면이다.
278,박 종우 방송 진입 장벽 1호. 예전에는 이 도네가 나왔다 하면 시청자들이 200 명씩 떨어져 나갔다.
279,시청자들을 몇 명이나 쫓아냈는지로 이어지는 드립은 덤. 시청자들의 거센 항의에도 불구하고 꾸준히 도 네이션되었고 결국 시청자들도 이 영상이 나오면 ' ㅏ ㅑㅑ '를 채팅 창에 도배하며 호응해 주는 지경이 되었다.
280,네네 키 미( ㅖ ㅖ) 자주 도 네이션 되는 씹덕 영상. 처음에는 굽 네 단이 욕을 하며 오열하였으나 이제는 포기했는지 다 같이 ㅖㅖ를 도배하며 호응하는 지경이 되었다.
281,ㄹ ㅇ ㅋㅋ 레 알 ㅋㅋ 라는 뜻으로 동의를 의미하는 단어이다.
282,그러나 종 우방에서는 할많하않의 용도로 사용되는 경우가 많다.
283,팟 수 문서에 서술되었듯 ' 니가 그러면 그런 거지 ㅋㅋ' 이라는 의미를 내포하는 것이다.
284,원작은 치민. 바리에 이 션으로 루 컨 마가 터진 박 종우를 기리기 위한 ㄹ ㅇ ㅋㅋ 루 컨 마 ㄹ ㅇ ㅋㅋ 루 컨 마 깃 안이 있다.
285,"레이저~ 박종 우가 빅토르 e 쓸 때마다 입버릇처럼 외치는 말. 특히, 팔이 짧은 챔피언( 애니, 카 사 딘 등등..) 을 상대할 때 그 어느 때보다도 행복해 보인다... 자주 나오는 도 네이션 영상이다."
286,카카오 TV에서 방송했던 영상은 도네로도 밴당할 수 있으니 주의 바람 가능하면 카팟영상은 도네
287,하지 말자 ㅏㅑㅑ 아야야 태보 태보 대개 패 : 도파 버전 14분 20초 대개 패 2 : 캬 하 하 버전 사단장님의 대개 패 프로듀서 상 드입달 : 종우 기분에 따라서 밴 당할 수도 있으니 주의 드입달ㅃㅉㅃㅉㅃㅉ 시청자 분쇄기 새로운 씹덕 영상 후지 와라 치 카 시청자 분쇄기 박 종우는 씹덕 2D 생 파? 굽 서트 요즘 메이플스토리를 하면서 경 손실로 인해 밴을 하지 못하고 있다.
288,눈치껏 도 네이션 할 것 박 종우 애인 있어요
289,"박 종우 내일을 찾아( 디지몬 ost) 굽 렁 큰 타이거, 박 종우 다 줄 거야 백 굽 디스코 굽 피 언 굽 렌 드서 바이 버루? 종 스노우 레이션 백 굽 디스코 변화구 굽 젤 릭 버스터 굽서 트쟈 킹님 네네 키 미 네네 키 미세 글자 방송 박 종우 외치면 강화 성공 가능 강화 성공 가능 개 못 하니까 개모 타니까 딥 페이크 영상 박 종우 본인은 하지 않았다고"
290,부정하는 잘 만든 영상 판단은 독자들에게 맡긴다.
291,박 종우 안녕 하살 법 굽 네 냥이 굽크 타운 최근 굉장히 빠져 있는 모습을 보인다.
292,당초 시작할 때엔 시청자들의 반응은 얼마 안 가겠거니 했지만 막상 하고 나니 몇 백만 원짜리 아이템을 사는 등 점점 메 창의 길을 걷고 있다.
293,방송에서 메이 플 위주로 하는 걸 보아 반 주력 컨텐츠로 자리잡고 즐기는 중. 트위치 메 부통령으로 불릴 정도. 첫 캐릭터는 엔젤 릭 버스터로 시작했다.
294,그러나 스펙 업 한계 등의 이유로 본캐를 모험가( 썬 콜) 로 새로 만들어 육성하다가 불독으로 자전하였다.
295,이후 닉네임을 ' 마 법력 '에서 ' 피닉스 박 '으로 변경 [13] 하였다.
296,크로 아서 버에 서식하며 굽 네 단들을 몰고 다닌다.
297,길드도 보유하고 있는데 길드 명은 ' 하일 박 종우' [14] 이다.
298,검은 마법사 격파 목표로 육성하고 있다.
299,"주요 멤버는 피닉스 박 본인을 포함하여 괴물 쥐, 꼴랑이, 치킨 쿤. 위 멤버들이 검은 마법사 격파를 위해 어느 정도 스펙을 갖추면 신해 조도 참여 예정이라고 한다."
300,[15] 메 린이 시절 미라클 타임을 이용해 시청자들 템도 좋은 옵션을 뽑아 주기도 했고 자신도 템을 완성하다 보니 아직도 직 작맛을 못 잊고 박 종우는 직 작을 하고 있다.
301,( 정신 못 차리고 있다.)2020
302,년 7월 12일 썬 콜로 자전하였으나 얼마 안가 불독으로 다시 자전하였다.
303,여러 가지 직 작이 있지만 큼직하거나 의미 있는 직 작만 일단 작성하였다.
304,앱 솔 랩스 파이 렛페도 라 : 앱 솔 해적 모자로 천사 소녀 종우로 22 성을 보냈다.
305,중간에 몇 번 터졌던 것으로 추정된다.
306,앱 솔 랩스 파이 렛 글러브 : 앱 솔 해적 장갑으로 천사 소녀 종우로 22 성을 보냈다.
307,1 트로 17 성부터 22 성까지 25억메 소만으로 성공했다.
308,"타일 런 트헤 르 메스 벨트 : 흔히 탈 벨이라고 부르며 보스를 돌다가 벽에 막혔는지 갑자기 12 성이 부른다고 벨트를 돌렸으나, 하락만 하다가 DESTROYED. 루즈 컨트롤 머신 마크 : 흔히 루 컨 마라고 부르며 마법력으로 2 트 천사소녀종우로 1 트 총 3 트 22 성 도전했으나, 실패했다."
309,DESTROYED. 3 트는 방패 에 디 뽑겠다고
310,통곡의 큐브 질 후 눈깔이 돌아 루 컨 마 21 성까지 갔으나 또 터졌다.
311,그러다 5월 14일에 완 작된 루 컨 마를 결국 사 버렸다.. 5월 23일 기준으로 일주일째 자시에서 환불을 사며 추옵을 돌리고 있다.
312,크로 아 명예 소방관 자시 환불 봇 5월 24일 결국 추옵 118 급 루 컨 마를 사용하기로 하고 에디
313,셔 널 큐브를 돌린 결과 인트 7% 인 16 올 탯 4% 로 마무리했다.
314,추석 때 제대로 인트 %가 아닌 인 16 같은 옵은 다 돌려서 3 줄을 저격하겠다고
315,한다.
316,앱 솔 랩스 메이지 슈즈 : 앱 솔 법사 신발로 마법력으로 22 성을 성공했다.
317,"몽환의 벨트 : 흔히 몽 벨이라고 부르며 극 추옵 아이템을 업어 왔으나, 1번 터지고 2 번째로 산 몽 벨 또한 ' 후회' 속 쉼터에서 DESTROYED. 5월 7일 고근이 터지자 리 린의 집에서 20 성까지 띄웠으나 결국 DESTROYED 5월 7일 저녁 8 시경 피폐 해진 박 종우에게 ' 하일 박 종우' 의 마음을 모은 몽환의 벨트를 기증 받았다."
318,이후 특유의 강 맥주( 보통 강소주 )를 마시며 강화를 했는데 금지된 절벽에서 22 성을 달성했다.
319,마력이 깃든 안대 : 흔히 마 깃 안이라고 부르며 휴방일에 추옵작만 6시간 이상 3월 31일에 메이플을 켜서 추옵작을 계속 진행했다.
320,"17 성을 성공했으나, 게이라고 놀리는 시청자들의 도발에 넘어가 22 성 도전을 하다가 ' 추억' 속 쉼터에서 DESTROYED. 2020년 4월 2일 금지된 절벽에서 드디어 22 성을 달성했다."
321,눈물을 흘리며 감격하는 모습을 3300 여 명의 굽 네 단이 함께 했다.
322,"고통의 근원 : 흔히 고근이라고 부르며 5월 7일 몽 벨, 재물과 함께 3 배 럭 강화를 돌렸다."
323,21 성까지 갔고 후회 속 쉼터에서 머리까지 박 아가며 여신님께 기도했다.
324,그러나 22 성은커녕 20 성으로 하락하고 말았다.
325,머리 안 박았으면 파괴였겠지?
326,후회 속 쉼터에서 고집을 부려 가며 계속해서 강화를 시도하다가 결국 DESTROYED 아케 인 셰이드 메이지 케이프 : 5월 7일 카르마 놀 긍 리턴 작을 하였다.
327,마력 6 리턴 작을 리 커버리까지 발라 가며 진행했고 2작이 남았는데 실수로 리턴을 안 바르고 놀긍을 발라 버렸다.
328,하필이면 그 놀 긍이 성공했고 인트 2에 마력 1이 붙어 버리면서 망해 버렸다... 결국 현실부정을 하는 상황에 이 르 렀 고 긍 혼 리턴을 했다고
329,정신 승리를 하였다... 마지막은 마력 6에 인트 4가 붙어서 그나마 다행이라고 할 수 있겠다.
330,"윗 잠 인트 12% 9% 9% 밑 잠 인트 7% ,5% 마력까지 붙은 굉장히 좋은 템이라 더 오열 ...2016 년 들어 가장 인기 있는 롤 PD 중 하나다."
331,불 남이나 이 재석 같은 전 통의 롤 통령들보다 더 많은 시청자를 보유할 때가 적지 않다.
332,한 때는 박종 우가 짭재슥이었지만 이젠 이재 석이 짭적이라는 소리가 나올 정도다.
333,중국에서 귀국하고 방송할 때 < 속보) 해적 방 10명 돌파... 시청자들과 눈물의 강 강수 월래> 드립이 나올 때와는 격세지감 .6 월 11일에 랭크를 돌리다 멘 탈이 나가 또 계정을 버리고 새로운 아이디를 시작했다.
334,"통과의례로 아이디를 짓는 것부터 시작했는데 박종 우의 중 2 병 말기 회생 불가 급의 네 이 밍 센스에 보고 있던 팟 수, 박 사모들 마저도 기겁을 했다."
335,"그도 그럴 것이 "" 하늘은 비웃지 않아"" 같은 닉네임이 멋있지 않냐며 물어 보는 게 박 사모에게도 버거웠던 듯하다."
336,도중에 도저히 생각이 안 난다며 또 몸을 식히겠다 고 샤워를 하며 생각해 왔던 닉네임을 방송을 보던
337,누군가가 뺏어버리는 바람에 결국 오래전에 썼던 닉네임인 Gr22d를 다시 사용하기로 하고 골드부터 시작했지만 골드에 서조차 압도 적인 캐리를 못하고 버스를 타는 모습을 보여 갖은 조롱과 치욕적인 닉네임을 생성했다.
338,이로 미루어 볼 때 박종 우의 챌린저 도전과 아이디 버리기는 끝없이 반복될 전망이다 ..6 월 13일 방송에서 챌린저가 서울대보다 가기 어렵다는 논리로 시청자들의 머리를 갸우뚱 하게 만들었다.
339,"박사 모의 반응은 역시 중졸답다는 반응. 골드에서 미드 케일로 0/7 /1 의 스코어를 기록하고 완패했지만 박 종우스럽게 누가 와도 졌다, mmr은 다이 아다 라는 변명을 해서 나날이 추함을 더해 가고 있다.6"
340,월 17일은 방송을 켜자마자 담배를 사 오겠다며 켜 두고 나갔다 와서 시작한 게임 첫판 카 사 딘 부터 챌린저를 가겠다며 자기는 마스터는 원하면 언제든 올려놓는다 던 사람이 3/10 /2를 기록하며 최악의 플레이를 보여주며 평소와 같이 조롱당했다.
341,하지만 평소보다 조금 더 안 좋은 모습에 자기는 컨디션이 오늘 안 좋은 것 같은 느낌이 들었다며 시청자의 의 아함을 자아냈다.6
342,월 23일 자신이 태양인이라 열이 많아 매운 것을 잘 먹는다고
343,알 수 없는 주장을 하며 불 닭볶음 면 3개를 일정 시간 안에 다 먹겠다고
344,푸드 파이트를 했지만 택도 없이 두 개 먹고도 죽으려고 했으며 세 번째에서 올라오는 토를 막지 못해 GG 치고 토를 하고 와서 멘 붕 해 손을 들고 벌서는 모습을 잠시 보였다.
345,시청자들은 개꿀 잼 몰 카 드립을 치며 PPAP를 추라며 성원하고 이에 박 종우도 에라 모르겠다
346,PPAP~ PPAP 음악을 틀면서 PPAP를 추었다.
347,( 이 시기 박 종우는 채팅 창에 PPAP 드립이 눈에 띄면 가차 없이 칼 블랙 하던 때이다.)2017
348,년 7월 말 AP innovation으로 닉 변했다!8
349,월 1일 복귀하는 날 방송 켜기 전에 찍겠다고
350,몇 년 간 공언해 온 챌린저는 못 가고 마스터를 찍고 개선 장군이 금의 환향 하듯 돌아와서 방송을 시작했다.
351,채팅은 왕이시여... 로 도배되었다.
352,쉬는 동안 마스터를 찍고 무언가 달라진 모습을 보여주겠다는 듯이 그에 걸맞는 실력을 보였지만 몇 시간 안돼서 바로 예전과 같은 그 XX 와 광대가 튀어나와 채팅 창 반응을 뜨겁게 만들었다.
