,sentences
181,"반대로 상대가 코스트를 함부로 뺐을 때 ' 상대방 큰 실수 했다 '며 역공을 가는데, 가끔 역공은 상대에게 어이 없이 막히고 타워만 내주는 경우도 있다."
182,또 다른 특징으로는 플레이를 상당히 본능적으로 한다는 점이다.
183,무슨 말인지는 또 다른 클래 시 로얄 유 튜 버인 JUNE의 스타일과 비교하면서 설명하도록 하겠다.
184,"알다시피 JUNE은 그 스타일이 매우 침착하고 계산적이며, 치밀하다."
185,"즉, 상대의 패를 읽고, 항시 엘릭서 코스트 계산을 하며 기다리다가 자신이 이득 봤다는 확신이 들 때 밀고 들어간다."
186,그에 반해 하 창 봉은 상대의 엘릭서 계산을 실수하는 모습을 자주 보이는 편이다.
187,"그럼에도 불구하고 그는 특유의 본능적인 감각을 이용한 임기응변에 능하며, 환상적인 찌르기 타이밍을 보여주곤 한다."
188,이러한 특징 때문에 그의 플레이는 시청자로서 지켜보는 맛이 있다.
189,그가 조금 밀리는 상황에서도 시청자는 ' 어떻게든 이길 거야' 라는 믿음을 가지고 그의 플레이를 지켜보게 된다.
190,"정리해서 말하면, 즉 JUNE은 실수를 하지 않으려는 타입, 하 창 봉은 실수를 해도 실수에 대처하는 능력이 출중한 타입이라고 할 수 있겠다."
191,"클래 시 로얄을 배우려면 JUNE의 채널을, 클래 시 로얄을 즐기려면 PongTV 채널을 보는 것이 좋다고"
192,하겠다.
193,"[37] [38] 여담으로 크라운 컵 비버 vs JUNE 경기 전에 비버가 속해 있는 A 팀의 팀장인 하 창 봉이 JUNE이 빅덱유저임을 밝히면서 삼총사, 석궁이 나올 거라고 예측했고 실제로 두 판의 경기에서 정확히 석궁, 삼총사가 나오면서 비버는 바로 2승을 하게 된다."
194,영상 초반에 JUNE은 자신이 멘 사회원이라고 뿌듯 해했는데 영상 막판에 하 창 봉이 JUNE을 완전히 예측하면서 안 습... [39] 고여 버린 클래 시 로얄 내에서 신규 카드가 나오면 수많은 연구를 통해 폐 급이라도 실전성 있게 써먹을 수 있는 덱을 잘 내놓는다.
195,고 블 린 우리를 활용한 램 창 봉 변형덱이나 낚시꾼을 이용한 라 바 덱 [40] 그런 하 창 봉도 해골 돌격 병 만큼은 활용하지 못했다.
196,"랭킹 전까지 쓸 수 있는 덱을 만드려고 그랜드 도전에서 갖은 실험을 했지만, 해골 돌격 병은 번번히 막히거나 꺼낼 타이밍이 안 나오고, 다른 카드만 써서 실력으로 찍어눌러 이기는 모습만 나왔다."
197,가끔 성공해도 앞서 번번히 실패하는 걸 본 시청자들 반응은 ' 난 안 쓸란다
198,'(...) 식이라 결국 포기. 딜 다 들어가면 로켓 급인데 그게 유일한 장점이라 포장도 못하겠다고
199,폐 급 카드 라 선언해 버렸다.
200,"클래 시 로얄 리그 중계를 시작하면서 공식 해설 진들이 보지 못한 패인 분석, 플레이의 문제점 등을 짚어 내고 있다."
201,"같은 소속 사인 샌 드박스 게이밍을 향한 분노는 덤. Islaw 혼자 캐리하고, 준비를 제대로 안하는 현실을 깠다."
202,[41] [42] 라이브 방송에서 샌 드박스 선수로 뛰란 말은 하지 않는 게 좋다.
203,본인 왈 이제 30대인데 유튜버로서의 삶이 수익적인 측면에서 나 안정성의 측면에서나 더 낫다고.....
204,"[43] [44] 스파 키와 하도 많이 엮여서 스퐁 키, 퐁 파 키 로 불리기도 한다."
205,"이유는 스파 키가 무슨 주작을 부린 것 마냥 많이 나오기 때문. 일단 대리 깡을 할 때 스파 키 최소 1 장은 기본 이고, 슈마상과 전설 상자, 그랜드 12승 상자에서도 전설은 거의 죄다 스파 키만 많이 나온 것이 그 이유. 심지어 부계 정 첫 전설은 스파 키다."
206,"거기에다 리그 보상 드래프트 상자에서 일렉트로 마법사와 스파 키 둘 중 하나를 선택하라는 계시를 받기도... 게다가 한술 더 떠서, 옛날 1등 보상으로 카드 15000 장을 주던 골든 맨 토너먼트에서는 1등, 2등 보상으로 각각 스파 키 9 장 (16 :58 부터), 3 장을 뽑는 영상은 이미 전설의 레 전드. 방송에서의 엄청난 빡침을 보여주며 위엄을 선보였다."
207,"당시 스파 키 9 장이 나올 때 헤드폰을 던지는 장면은 지금도 아프리카에서 별 풍선을 보낼 때 나오는 화면이 기도 하다. 그리고 어느 날 상점에 스파 키가 떴는데, 때마침 4 레벨에 17/20이 여서 남아도는 골드로 스파 키를 바로 3장 다 사서 5 레벨을 만들었고, 세계 최초로 만렙 스파 키를 보유한 사람이 되었다."
208,0:09 부터 그리고 리 그제가 아직 없어 다 4000점으로 돌아가는 시절에 양학 아닌 양학을 스파 키로 시전... 자신이 스파 키와 무슨 인연이 있는 걸 인정하고는 개그 소재로 써먹기도 한다... 2017년 초에 2016년도 스파 키 뽑기 모음이라는 [45] 영상도 올렸다.
209,"전설 상자에서 스파 키가 뜨고 상점에 또다시 스파 키가 걸려 있자 운명인가 보다 라고 영상 제목에 붙여 놨다 ...2017 년 6월 5일 월요일 시즌 종료, 자신의 본 계정과 부계정의 시즌 보상인 얼 티 밋 드래프트상자에서 다시금 시청자들에게 레전드를 선사했다."
210,하 창 봉 본인이 직접 클래 시 로얄과 그것과 관련된 문제점을 지적하면서 해당 게임이 더이상 자신의 채널에서 주력 컨텐츠로 이용되기에 무리가 있음을 밝혔다.
211,[46] 따라서 방송 주력 컨텐츠를 배틀 그라운드로 전향한다고 이야기 했으며 이로 인해 구독자 수가 감소하기도 하였다.
212,[47] 아래는 ' 하 창 봉이 클래 시 로얄에서 배 그로 전향하는 이유' 이다.
213,시청자들 과의 소통 클래 시 로얄의 플레이 연령층은 초등학생부터 성인까지 넓게 분포하고 있다.
214,하 창 봉은 그중 상당수를 차지하고 있는 어린 시청자들 과의 소통이 더이상 감당되지 않는다고
215,이야기 했다.
216,"예를 들어 "" 창 봉님 제 이름 불러 주세요"", "" 창 봉님 무슨 무슨 덱 해 주세요"" 등의 부탁을 하 창 봉에게 하는 경우가 있는데, 이는 부탁에서 그치지 않고 만일 하 창 봉이 요구를 들어주지 않을 경우 욕으로 답하거나 안 티 팬으로 돌아서 기도 한다고. 하 창 봉 본인은 이러한 어린 시청자들의 잦은 요구에 지쳐 "" 유치원 선생님들을 존경한다"" 고 말하면서 까지 소통에서의 어려움을 토로 했다."
217,또 한 리 니지 와 같은 성인 시청자들과 소통하기 쉬운 컨텐츠를 주력으로 삼고 있는 방송인들이 부럽다고
218,밝히면서 다시 한번 클래 시 로얄 방송의 어려움을 이야기 했다.
219,"빈약한 게임 시스템 1년이 넘도록 클래 시 로얄을 해 온 유저로써 하 창 봉은 클래 시 로얄의 매칭 시스템, 바닥 난 컨텐츠를 지적했다."
220,"그에 따르면 클래 시 로얄의 최상 위권들 사이에서 성행하는 저격 논란을 잠재울 해결책을 슈퍼 셀이 시간이 아무리 지 나도 내놓지 않고 있으며, 이러한 문제점을 극복하기는 커 녕 터치다운 이나 드래프트 같은 소모적인 컨텐츠를 내놓는 슈퍼 셀의 태도가 다시 한번 하 창 봉이 클래 시 로얄에서 등을 돌리게 된 이유라고. 본인도 클래 시 로얄의 훌륭한 게임 성과 작품성을 인정하는 한편, 느리고 허술한 대처가 게임의 전반적인 재미를 반감시키는 결과로 이어졌기에 안타깝다고"
221,밝혔다.
222,하 창 봉은 본인이 원하는 방송의 모습이 현재의 클래 시 로얄이 나아가는 방향과 엇갈렸음을 이야기 하며 앞으로는 자신이 꿈꾸는 방향대로 방송을 이끌어 나갈 것을 밝혔다.
223,[48] 그런데 방송 2주년을 기점으로 클래 시 로얄 비중이 다시 늘어나고 있다.
224,최근에는 약 10개월 만에 다시 한번 챔피언 리그에 올라가기도. 그리고 멈추지 않고 트로피를 올려 그랜드 챔피언을 찍는 데 성공했다.
225,"그리고 결국 얼 티 밋 챔피언에 다시 올라가게 된다!!! 시즌 초기화로 그나마 올라가기 수월 해져도 다시 올라가게 된 건 대단한 것. 하 창 봉은 영상을 통해 클래 시 로얄의 매칭 시스템의 문제점 [49] , 맛이 간 밸런스 패치 [50] 등을 지속적으로 지적했지만, 이러한 부분들이 개선되지 않는 현 상황을 비판하면서, 유저 수가 점점 줄고 있는 썩은 동아줄 클 로얄 일변도의 방송에서 오토 체스를 시도할 것이라고 공언했다."
226,[51] [52 ]2019 년 4월부터 는 랭킹 전을 거의 돌리지 않는다.
227,"빡겜을 하면서 스트레스 받고, 자괴감을 느끼는 데에 대한 회의감이 밀려온 것 같다."
228,"[53] 다만, 덜 빡겜해도 되면서, 동기 부여가 되는 ' 도전' 들은 계속 플레이할 예정이라고 밝혔다."
229,[54] 다만 켠 왕 콘텐츠를 진행할 정도로 나름의 애정을 보였던 부 계정 렙 빨 극복 콘텐츠는 사실상 막을 내렸다.
230,계정을 잃어버렸다고
231,5월 말부터 7000점 찍 기 콘텐츠를 시작했다.
232,오랜만에 빡겜하는 창 봉 이의 모습을 볼 수 있을 듯.
