,sentences
359,"그리고 추가된 정황상 마이크허는 자진 퇴사가 아닌 불명예해고, 즉 짤린 것이므로 마이크허가 자신에게 유리할 증거를 가지고 있을 리가 만무하다."
360,4월 15일 유 튜브에 사과 영상을 올렸다.
361,하지만 해당 영상의 좋아요
362,보다 싫어 요의 숫자가 많다.
363,자숙기간 동안 서 새봄 이태준 등의 도움으로 뜨뜨뜨뜨와 릴 카 와의 만남이 주선되었다.
364,뜨뜨뜨뜨와 릴 카는 처음에 사과를 받지 않을 생각이었으나 만나서 얘기를 해보니 사건에 대해 잘 알지도 못하고 마이크 허와 딱히 깊은 관계도 아니고 무엇보다 여러 번 만나면서 진심으로 사과를 하여 결국 마음을 돌리고 사과를 받았다고
365,한다.
366,"이 후 한동 숙과 룩삼은 서 새봄, 소풍 왔니,"
367,따 효 니와 함께 트위치 코리아 본사에 찾아가 대
368,"표( 이하 경 )를 만 나 ' 뜨뜨뜨뜨와 릴 카의 밴을 풀어 달라', ' 왜 모든 스트리머가 운영자와 연락이 안되는가"
369,' 등 트위치 코리아의 문제점에 대해 항의하였다.
370,트위치 코리아는 추후에 뜨뜨뜨뜨와 릴 카 와 직접 만 나 이 문제를 해결하겠다고
371,밝혔다.
372,또 한 지적한 여러 문제에 대해 해명하고 또 고쳐야 할 점은 고치겠다고
373,말했다.
374,위의 스트 리머들은 추후 지켜봐야겠지만 만약 약속이 지켜 지지 않는다면 어떤 식으로든 다시 반발하고 항의할 것이며 플랫폼 이적이라는 강수도 생각에 있다고
375,한다.
376,이후 뜨뜨뜨뜨와 릴 카는 방송에서 위의 스트 리머들에게 감사 하다는 마음을 전했다.3
377,개월 가량의 자숙기간을 가진 후 5월 6일 트위치에 복귀하였다.
378,"자숙의 의미로 한동안 도 네이션을 받지 않으며, 자숙기간 중 받은 구독 수입은 모두 기부할 것이라고 밝혔다."
379,이 문서는 이 문단은 토론을 통해 해당 문단을 존치하기( 으) 로 합의되었습니다.
380,합의된 부분을 토론 없이 수정할 시 제재될 수 있습니다.
381,아래 토론들 로 합의된 편집방침이 적용됩니다.
382,합의된 부분을 토론 없이 수정할 시 제재될 수 있습니다.
383,"[ 내용 펼치기 · 접기 ] 토론 - 해당 문단을 존치 하기토론 - 합의사항 2 토론 - 합의사항 3 토론 - 합의사항 4 토론 - 합의사항 5 토론 - 합의사항 6 토론 - 합의사항 7 토론 - 합의사항 8 토론 - 합의사항 9 토론 - 합의사항 10 토론 - 합의사항 11 토론 - 합의사항 12 토론 - 합의사항 13 토론 - 합의사항 14 토론 - 합의사항 15 토론 - 합의사항 16 토론 - 합의사항 17 토론 - 합의사항 18 토론 - 합의사항 19 토론 - 합의사항 20 토론 - 합의사항 21 토론 - 합의사항 22 토론 - 합의사항 23 토론 - 합의사항 24 토론 - 합의사항 25 토론 - 합의사항 26 토론 - 합의사항 27 토론 - 합의사항 28 토론 - 합의사항 29 토론 - 합의사항 30 토론 - 합의사항 31 토론 - 합의사항 32 토론 - 합의사항 33 토론 - 합의사항 34 토론 - 합의사항 35 토론 - 합의사항 36 토론 - 합의사항 37 토론 - 합의사항 38 토론 - 합의사항 39 토론 - 합의사항 40 토론 - 합의사항 41 토론 - 합의사항 42 토론 - 합의사항 43 토론 - 합의사항 44 토론 - 합의사항 45 토론 - 합의사항 46 토론 - 합의사항 47 토론 - 합의사항 48 토론 - 합의사항 49 토론 - 합의사항 50 호스팅 오류 [22] 로 자동으로 방송이 켜져 사생활이 유출된 스트 리머 에 디린 이 2019년 연말 룩 공 얍 칸 합방 중 이상형 월드컵에 나오자 한 동숙이 ""에 디린 님 그 영상 잘 봤어요."
384,"그 수영복 입고."" 라는 말을 하였는데 그 부분을 한 시청자가 클립으로 편집하여 에 디린 에게 도 네이션을 보내고 스트 리머 갤러리에 글을 올려 불거진 사건이다."
385,"한 동숙의 해당 클립이 에 디린 에게 알려 지자 에 디린 은 #"" 저도 그거 알아요."
386,그 영상에 대해서 잘 봤습니다라고 하는 거. 근데 그거 비키니 영상이라고 후반에 얘기하셨잖아요?
387,비키니 영상이라고 했는데 거기다
388,대고 뭐라
389,"할 수도 없는 거고, 비키니 영상 잘 나왔잖아요."
390,"""라고 말하면서도 이 사건에 대한 트위치의 반응에 대해서 불만을 가졌다 고도 언급했다."
391,"발언 당시 (2019 년 말 )에는 별 논란이 되지 않았으나, 얼마 후 마이크 허 결혼식 참석 사건으로 인해 한 동숙에 대한 비난 여론이 커지며 과거 발언들이 재조명되는 과정에서 이 발언이 다시 수면 위로 올라왔다.에"
392,"디린 은 2020년 5월 경 아프리카 TV로 이적했고, 이 때 시청자가 한 동숙을 언급하자 # "" 언급해도 될 지 모르겠는데, 저는 한 동숙 님을 믿습니다."
393,그냥 그게 제 정신건강에도 좋구요.
394,왜냐면 그냥 한 동숙 님이 그렇게 안 좋은 분이라고 생각 안 해요.
395,그렇게 생각 안 하면 제가 너무 힘들잖아요?
396,"제가 그렇게 생각 안하면 제가 너무 힘드니까. 한 동숙 님도 아니라고 하셨고."" 라고 말했다."
397,"한 동숙은 자숙 후 첫 방송에서 "" 그 사건( 마이크 허 사건) 외에는 별 말 같지도 않은 소리밖에 없다"" 라며 언급할 가치가 없다고 논란을 간접적으로 부인했다.20"
398,년 7월 27일 방송에서 위 성희롱 논란을 직접적으로 부인하며 스트 리머 갤러리에서 날조로 자신을 성 추행범으로 몰아간다고 말했다.
399,또 한 그 과정에서 방송 영상을 악의적으로 편집하거나 전후 내용을 모르면 오해할 수 있는 발언만 편집해 타 스트리머에게 전달하여 의도적으로 관계를 무너뜨린다고 했다.
400,한 동숙은 자신에 대한 여러 억지 떡밥을 밈으로 넘어가려 했지만 성희롱이나 뷰 봇 같은 도가 넘는 것까지 사실인 양 여론 몰이를 하고 해명 하라고 강요하고 타 스트리머의 방송에서까지 여론 몰이를 한다며 스트 리머 갤러리를 강력히 비판했다.
401,자신들이 만들어 놓은 억지 떡밥을 무시하고 불편 해하면 비정상으로 몰아간다고 했다.
402,그러면서 그전 까지는 크게 일을 키워 봤자
403,스트 리머 간에 득이 없을 것 같아 직접적인 언급을 하지 않았으나 최근 여러 합동 게임 방송을 진행하면서 타 스트 리머 채팅 방에서 언급되고 이간질이 되는 것 때문에 이에 대해 직접적으로 발언한다고 했다.
404,또 한 자신이 뷰봇을 사용했다고
405,생각하면 트위치 신고기능을 사용하여 신고 하라고 말하였다.
406,"만약 자신의 언행에 문제가 있다면 처벌을 받을 것이니 제발 커뮤니티에 글만 생각 없이 적지 말고, 정말 사실이라 생각한다면 신고를 하라고 강력하게 부인하였다."
