,sentences
0,"게임 유 튜 버이자 트위치 스트 리머. 유 튜브 기준 최초 영상은 2016년 10월 31일이며, 페이스 북 롤 큐 페이지에 종종 나오면서 인기를 얻기 시작했다."
1,"주로 롤을 플레이하며, 공포게임이나 먹 방 등의 다양한 콘텐츠도 진행한다."
2,요즘 먹 방 영상이 많이 올라오고 있다.
3,과거에는 비니가 그의 상징인 것 마냥 매일 쓰고 나왔지만 한국으로 귀국한 뒤 부터는 잘 쓰지 않는 것으로 보인다.
4,요즘은 방에 모자 걸이를 한가득 만들어 놓고 거기에서 하나씩 뺴다가 쓴다.
5,지금은 치웠다.
6,한국 와서 이제는 어디서 사 온지 모르는 군밤 모자 [3] 와 티 모 모자를 번갈아 가면서 자주 쓰는 경향이 있다.
7,"컨셉을 ' 부모님 앞에서도 볼 수 있는 영상' 으로 정하고 욕이나 비속어를 거의 쓰지 않으며, 남 탓도 적은 편이다."
8,마 일드한 스타일의 유튜버를 좋아하는 사람에게 추천한다.
9,"블 개 - 2017년 경 영상을 보면 시청자 참여 때 상대편으로 플레이 하기도 하였으며, 허 샘은 탑 가렌으로 럼 블을 상대했고 블 개는 미 드르블랑으로 미드스웨인을 상대했다."
10,허 샘을 위해 집들이까지 까지 해 줄 정도로 친하다.
11,집들이 영상 얼마 전 같이 듀랭을 돌리며 짱 친 임을 다시 했다.
12,밥을 먹자고 예전부터 약속을 했으나 지금 까지도 안 먹었다고
13,한다.
14,꽈 뚜 룹 - 어느 때 부터인지는 모르나 친하다.
15,같이 롤을 하는 영상을 찍기도 하였다.
16,미국 친구와 함께 하는 롤 둘 다 영어를 잘해서 영어로 대화 하기도 한다.
17,꽈뚜룹이 아픈 형 앞에서 먹 방 찍는 영상을 찍을 때 도움을 주기도 했다.
18,유 준호 - 허 샘이 유학시절 방송을 할 때 방송에 찾아와 채팅에 남기며 친해 지기 시작하였다.
19,처음엔 사칭인 줄 알았습니다
20,한국에 들어온 뒤로 많이 친 해져 서로 걱정 쌍 욕을 하기도 한다.
21,꽈뚜룹과 같이 만 나 놀기도 한다.
22,최근엔 차돌 박이를 먹으러 새벽에 같이 나가기도 한다.와
23,나나 - 한 창 와 나 나가 괴 식대 전을 할 때 괴 식을 먹으러 간적이 있다.
24,하얀 눈밭의 와 나나. 와 나나 집들이에 초대되어 개 분장을 하고 가서 놀았다.와
25,나나 3 차 집들이 오요 - 키가 작다고
26,놀린다.
27,본인이 본 사람 중에 제일 작다고
28,했다.
29,오 요와 봇듀오를 같이 했었는데 어떤 분의 오해를 살까 봐 올리지 않았다.
30,가끔 채팅 창에 놀러와 채팅을 친다 몇 일 전 채팅으로 놀려먹으려 했으나 역공을 먹었다.
31,해당 영상 그리고 귀여워 했다.
32,모 카 형 - 과거 같이 게임을 한번 했던 경험에 친해 졌다고
33,한다.
34,실제로 본적이 없다.
35,트수들이 열심히 전서구 역할을 하고 있다.
36,허 샘은 이분을 만나기 어렵다고
37,하였다.
38,그 이유는 얼 공을 한 사람과 안한 사람이 같이 만나는 게 어렵다나
39,뭐라
40,나... 최근 모 카 형의 생일 때 축하 영상을 짧고 인상깊게 보내준 적이 있다.
41,악녀 - 양ㄲㅊ를 먹으려 했지만 먹지 못한 사이다 성시 훈 - 과거 같은 롤 큐 소속 크리에 이 터였다.
42,먹 방 유튜버의 음식을 뺏어 먹어 보았습니다
43,"개리 형 - 성시 훈과 마찬가지로 롤 큐 소속 크리에 이 터, 허 샘이 오른으로 매우 안 좋은 모습을 보이자 눈이 멀은 듯한 리액션을 보여 붰다."
44,박 나나 - 한 창 허 샘이 골드를 헤메고 있을 때 먼저 플레를 가서 놀림을 많이 받았다.
45,투보 - 투 보가 채널 좀비 왕 소속일 무렵부터 친해 졌다.
46,허 샘의 다리가 나가리
47,된 그 풋살클럽 골키퍼였다고
48,한다.
49,텔 론 - 같은 채널 좀비 왕 이젠 패러 블 소속이며 같이 플라잉 요가를 하러 가기도 했다.
50,새우 새우 - 최근 알게 된 사이이다.
51,"새우 새우가 생방송에서 과거 본인이 허 샘의 영상을 자주 봤었고, 탑 라이너, 티 모 유저도 아님에도 불구하고 즐겨 보았다고"
52,한다.
53,함 군 - 회사 사장님이다 집에 변변찮은 책상조차 없다(...). 이케 아 코리아에서 침대를 구매했는데 수시간 동안 노력해서 조립한 침대 프레임이 얼마 안 가 부러지고 말았다.
54,호주 퀸즈 랜드대학에서 심리학을 전공했다.
55,"유학파인 데 다가, 호주 퀀즈 랜드대학은 호주에서 알아주는 명문대이다."
56,이 덕분인지 영어나 공부 실력도 상당한 듯. 현재는 귀국해 집을 구해 살고 있다.
57,교정을 하면서 말할 때 발음이 새는 것을 볼 수 있다.
58,방음벽 설치하는 영상에선 컴퓨터에서 무려 서울대 자소서 가 발견되었다.2020
59,년 7월 13일 기준으로 아직 미필이다.
60,과거 기흉이 있던 경력이 있어서 4 급 면제를 받을 수 있었지만 군대에 가고 싶어서 서류 제출을 안 하고 시력으로 인한 2 급 현역 판정을 받았다고
61,한다.
62,"카투사, 특전사, 의경 등등을 지원해 봤는데 모조리 떨어졌다고"
63,한다.35
64,초부터 고양이가 잠깐 나오는데 고양이 이름이 ' 선생님' 이다.
65,이후로 영상에 가끔 씩 나타난다.
66,티 모하는 여성 게스트를 모셔 왔습니다
67,여자 게스트를 데려왔다면서 여장을 했다.
68,이름은 ' 알렉산 드라 '라고 한다.
69,가끔 유 튜브 영상 댓 글 창에서 보인다.
70,유 튜브 썸 네 일을 직접 제작해서 사용한다.2019
71,년 1월 29일에 새벽방송 중 100만 원 후원을 받았다.
72,"받고서 한참을 멍 때렸고, 후원자에게 설득을 시도했다."
73,"( 결국은 실패) 본인 얘기에 따르면 원래는 100만 원을 받으면, 그 즉시 바로 방송 종료하려 했었다고"
74,한다.
75,결국 해당 100만 원 후원한 후원자에게 후원 밴을 한 상태 [6] 백만원 리액션 클립 풀 영상 2019년 2월 1일 유 튜브에 공지 영상이 올라왔는데 풋살을 하던 도중 다리가 부러졌다고
76,한다.
77,본인의 얘기에 따르면 왼쪽 다리가 부러졌는데 액체 괴물에 비유했다.
78,2분 5초부터 자세한 건 영상을 한번 보자. 이 모임에 처음 나갔는데 다리가 부러졌다고
79,한다.
80,2018년 연말 파티에서 만 나 결성했다고
81,한다.
82,다이아 도 전기를 찍다가 플 레 4를 갔다 트위치 티어에서는 플 레 5로 나와 있는 걸로 보아 트위치는 거짓말을 하지 않는가
83,보다.
84,지난 시즌에도 세기말에 다이아를 갔으니 이번 시즌도 할 수 있을 것이라 장담하고 있다.
85,그러나 플 레 4로 시즌을 마무리 했다.
86,생방송 중에 똥을 자주 싸러 가서 허 또 똥( 허 샘 또 똥 싸러 간다) 이라는 단어를 탄생시켰다.
87,트위치 다시 보기에서 옥수수 일화도 참고 하자. 요즘 와우에 빠졌다고
88,한다.
89,"본격적으로 시작하진 않아서 허자들에게 어디를 선택할지 물어보고, 고민하고 있다."
90,최근 방송에서 얼 라를 선택했다고
91,한다.
92,클래식 서버에서 시작했다고
93,한다.
94,방송에서 치킨 먹 방을 진행했는데 앞으로 자신의 인생 치킨을 고추 바사삭으로 바꾼다고 했다.10
95,월 24 일부로 트위치 방송 종료를 공 지하였다.
96,방종 공지를 12시가 지난 후 일시 철회하였다.10
97,월 31 일부로 트위치 방송을 종료한다고 한다.
98,이유는 개인 적인 사정이라고. 하지만 10월 31일 방송에서 방종 공지를 철회하였다.
99,반려 묘 이름이 선생님이다.
100,매우 귀엽다.
101,방송 중 화장실을 간다는 이유로 선생님 캠을 켰을 때 허자들 반응이 놀라웠다.
102,메이 플 스토리를 생방송 중에도 켜 놓을 정도로 좋아한다 최근 시작한 새로운 롤 시즌에서 배치고사를 방송에서 했다.
103,레 전 더리 한 팀 운으로 배치 10승 0패를 기록하며 시청자들을 놀라게 했다.
104,팝콘 티비에서 시청자가 천명이 넘으면 갈 의향이 있다고
105,한다.
106,허 샘이 필요한 건 관심과 시청자라고 한다.
107,하지만 도네 받으면 좋아한다.
108,최근 유 튜브 구독자 13만명을 돌파했다 근래 방송에서 웃옷을 벗기도 했다 본인은 앙 빅을 잘한다고 자신했지만 약 1시간 정도( 그 이상?) 클리어를 하지 못하면서 현 타가 오기도 했다 쉬는 동안 플 레 1까지 찍었었다고
109,한다.
110,그러나 정신 차려 보니 플 레 3까지 떨어졌다고
111,한다.
112,트위치 생방송 기준 2020년 4월 25일 유 튜브 영상기준 2020년 4월 26일 휴식기를 선언했다.
113,관련 영상 영상 속에서 그는 유 튜브와 트위치 생방송에 너무 매달려 있었음을 깨달았다고
114,했다.
115,트위치 생방송에서 그는 인스타 그램이나 유 튜브 영상으로 가끔 찾아뵐 것을 언급했고 그의 일상은 인스타 그램을 참고 하면 좋을 듯 하다. 복귀 일자는 정해 놓지 않고 갔다.
116,최근 다리 수술을 했다.
117,인스타 다리의 철심을 뽑는 수술이라 한다.
118,현재는 수술을 마치고 요양을 하고 있다.
119,실밥이 아직 다리에 박혀 있다고
120,한다.
121,이를 통해 공익 판정이 났다고
122,한다.
123,언제 갈지는 모른다.
124,2020년 6월 13일 부로 트위치 방송에 복귀를 했다.
125,한 달 반동안 요양을 잘해서 돌아온 모양이다.
126,한 달 반동안 밖에 안 나가니 미백을 한 것처럼 하얘져서 돌아왔다.
127,복귀 방송 저번에 했던 임플란트가 제 역할을 못한다고 한다.
128,강력한 인간이 되어 복귀를 하였다.임
129,플 란 트가 달랑달랑 한 샘 관련 클립 2020년 6월 17일 치과를 가기 전 밥을 먹다가 임플란트가 빠졌다고
130,한다 클립 그는 지난 방송에서 트위치 시청자 500명이 목표라고 했다.
131,그 정도는 되어야 전업 스트리머가 가능하다고
132,말했다.
133,그러나 합방이나 이런 게 아닌 본인의 컨텐츠로 승부를 볼 것이라고 한다.
134,키 173.5에 몸무게 80(+@) 로 비만이라고 인정했다.
135,얼마 전 네이버에 프로필이 생겼다.
136,그러나 본인의 자랑이라 볼 수 있는 퀸즈 랜드 대학교 졸업이 없어서 아쉽다고
137,했다.
138,소속 사 사장님인 함 군님 방송에 호스팅을 보내려고 했으나 방송 팔로 우가 안되어 있었다.
139,또 얼마 전 같이 놀았다고
140,하는 김 갈치네에 호스팅을 보내려고 했으나 또 팔로 우가 안되어 있었다.
141,새우 새우 방송에 호스팅을 할 때도 팔로 우가 안되어 있었다.2020
142,년 9월 14 일부로 트위치 방송을 접는다고
143,선언하고 유 튜브 라이브를 켰다가 다시 트위치 방송을 켰는데 사람이 생각보다 많이 들어와 트위치 방송을 계속 한다고 하였다.
144,회사 이사님한테 도 트위치 안한다고 했는데 다시 트위치 방송을 한다고 하니 겁 나 깨질 거 같다고
145,하였다.
146,성급한 방종 공지를 사죄한다는 의미로 2020년 9월 15일 아침방송에서 정기 구독권 100+@ 개를 뿌렸다.
147,클립 다음달부터 더욱 추워 질 텐데 돈을 그렇게 쓰면... 그러다가 카드사한테 전화가 와서 돈 적당히 쓰라 고 혼났다.
148,클립 이걸 당일에 편집해서 유튭에 올렸다.
149,업보청산 2020년 9월 16일 17시부터 진행되는 Gen.G Esports와 HUYA TV 간 연습생 스크림의 해설을 맡았다.
150,후야 티비는 허 샘의 소속 MCN 인 패러 블 엔터테인먼트 소속의 연습생이 후야 티비에 있기에 진행을 한 거라고 하였다.
151,업보 청산을 한 뒤 아침방송을 하고 평 청자가 150명 이상이 되어 아침방송 위주로 돌린다고 하였으나 생활 패턴의 이상으로 랜덤방송으로 돌렸다.
152,저녁방송을 위주로 하지만 아침에도 방송을 한다고 했다.
153,소속 사의 사이트에 가면 크리에 이 터 각자의 영상이 하나씩 소개되었는데 허 샘은 먹 방영상이 올라 가있 다. 그는 역시 겜튜버가 아니라 먹 방 유튜버가 본체였던 것이다.
154,네이버에 허 샘을 검색하면 나온다.
155,그걸 알고 좋아했으나 학력이 없길래 본인이 직접 요청하여 학력을 추가했다.
156,본인 입으로 본인은 아이언에선 페이커고 골드에선 황태라고 하였다.2020
157,년 11월 10일 그는 리그 오브 레 전드 시즌 10 종료를 몇 시간 앞두고 방송을 켜서 본인이 그동안 방송을 왜 안했는 지에 대해 설명을 하며 전적을 보여주었다.
158,그는 대략 2 일간 60 경기가 넘는 게임을 했고 플 레 3으로 시작을 하여 플 레 2로 마무리 되었다고
159,한다.
160,그렇게 그는 시즌 10을 플레로써 마무리 하게 되었다.
161,또 한 이 폐관 수련 기간 동안 롤 실력이 매우 많이 늘었다고
162,했으며 그렇기에 다음 시즌을 기대 하라고 했다.
163,그리고 그는 군대에 간다.
164,또 한 프리 시즌 동안 열심히 미쳐 날뛰어 보겠다 고도 했다.
165,매우 비밀이지만 허 샘 트위치 방송의 매니 져가 제일 악질이다.
166,클립 각에 미쳐서 허 샘을 무자비하게 괴롭힌다.
167,유 튜브 영상의 재생 목록을 수일에 걸쳐 다시 조정하였다.
168,1000여개의 영상을 재조정 하는데 3~4 일의 시간이 걸렸다고
169,한다.
170,가만 보면 정리하는 거 참 좋아해 그의 유 튜브 재생 목록을 보면 수십개의 재생 목록이 있는 걸 확인 할 수 있다.
171,이 정리는 현재 진행형으로 더 추가할 사항이 있으면 팬 카페에 올려 달라고 하였다.
172,편집공부를 다시 하고 있다고
173,한다.
174,그 덕분에 유 튜브와 트위치는 개장 휴업과 비슷한 상태이다.
175,물론 간간히 영상과 방송을 하고 있지만 편집에 집중을 하고 있다.
176,탑신 병자 렛츠고! 개 머 시 썽 100 배 강 해졌습니다.
177,퍼 블 포탑을 먹으면 5 배 강해 집니다.
178,"느아 주로 티 모를 플레이하며, 로밍보다는 강한 라인 전과 스플릿 푸시로 상대를 압박하는 플레이를 즐긴다."
179,뽀삐 실력도 상당하다.
180,라인 전 상대를 압박하는 모습을 자주 보인다.
181,호주 섭에서 다이아를 찍었고 한국섭에서도 다이아를 찍었다.
182,본인은 강력히 거부하고 있지만 종겜스의 스멜이 많이 난다.
183,주로 쯔꾸 르 게임을 많이 좋아하며 플레이 한다.
184,공포게임을 할 때 맞는 맛이 매우 뛰어나다.
185,안녕 하세요 허( 약간의 공백) 샘입니다
186,2018년 4월을 전후해서 먹 방을 업 로드하기 시작했다.
187,원래부터 해오 던 볼 케이 노 먹 방은 덤. 볼 케이 노를 아주 좋아하는 듯 하다. 다른 먹 방 스트리머나 BJ 들에 비해 많이 먹는 편은 아니지만 그만의 매력 때문에 상당히 인기가 좋은 편. 라이브로는 잘 하지 않고 주로 유 튜브 영상 형태로 올라온다.
188,반응이 좋아 서인 만큼 롤 영상보다 많이 올라온다고 생각될 정도. 1 인 1 닭 1 밥의 위엄 치과 치료 때문에 먹 방을 잘 못 찍는다고
189,한다.
190,불쌍한 허 샘... 또한 교정기를 착용하고 있어서 먹 방 컨텐츠를 조금 고민하는 모습이다.
191,교정이 끝나면 맛깔 나게 찍을 듯 진정한 탑신 병자라면 올 챔으로 캐리할 줄 알아야지
192,( 탑에서) 극단적인 챔프 폭을 넓이는 의미로 시작한 컨텐츠다.
193,티 모와 뽀삐외에 스킬도 잘 알지 못한다.
194,[4] 이 덕분에 그때그때 알아 가는 과정을 보는 재미가 있다.
195,"허 샘의 주력 픽 인 티 모 플레이 외에 초가스, 갈 리 오등 평범한 탑 챔피언부터 아 이번(?), 라 칸(!), 나미(!!) 같은 서폿챔까지 무조건 탑으로 가서 플레이하는데 이게 바로 진탑올캐알이다. 진 탑 올 캐알은 시즌 2까지를 마친 후 약간의 휴식기간을 가진 후 시즌 3을 시작했다."
196,당시 진탑 올 캐알 시즌 2의 룰은 다음과 같다.1.
197,시청자가 댓 글에 추천한 챔피언을 골라 무조건 탑으로 플레이한다.
198,주로 유 튜브 댓 글 창에서 이전 화에서 좋아요를 가장 많이 받은 챔피언을 플레이한다.2.
199,"유 튜브에 플레이 영상을 올리고, 캐리인지 아닌지 시청자들이 투표를 진행한다.3."
200,찬성이 일정 비율 이상일 경우에만 다음 챔피언으로 넘어갈 수 있다.
201,4. 무한 반복사실 시즌 1 때는 캐리 실패시 벌칙도 했었는데 부담이 많이 간다는 이유로 폐지되었다.
202,진행했던 벌칙으로는 현재 진탑 올캐 알 룰루 편을 기준으로 시즌 3이 시작되었으며 다시 벌칙 제로 회귀했다.
203,아무래도 한 챔피언만 보고 싶어 의도적으로 캐리 실패에 투표하는 악성 팬들 때문으로 추측된다.
204,"( 대표적으로 시즌 2의 마지막 편인 티 모 편 )2019 년 2월 22일 기준 현재까지 올라왔던 시즌 1~3 까지를 퉁 쳐서 시즌 1으로 취급 한 뒤, 이전과는 차별화한 진탑 올 캐알을 새로 구성하여 시즌 2로 진행한다고 한다."
205,기존에 상대적으로 중구난방이었던 진행과 달리 비교적 깔끔하게 진행될 것으로 보인다.
206,아래는 영상에 제시된 계획이다.1.
207,"탑만 가 되, 전략을 미리 설정해서 진행한다.2."
208,"영상 말미의 캐리 투표 50% 가 넘어가면 캐리로 인정, 그렇지 못하면 벌칙을 진행하기로 한다.2020"
209,"년 방송 복귀 후, 진탑 올 캐알은 안할 것 같다는 말을 했다."
210,주력 픽 인 티 모로 라인 전 초반 상대 챔피언을 상대하는 장면을 모은 콘텐츠이다.
211,"겉으로는 공략을 표방하고 있지만, 사실은 예능 콘텐츠이다."
212,진 탑 올 캐알은 중단되었지만 티 모 보감은 계속 진행되고 있다.
213,이 컨텐츠도 관으로 가버렸다 고인은 내가 살린다.
214,고 내 살 소개 영상 GOINEN NEGA SALINDA DAN DAN DAN 뚜 둔 챔피언이 왜 고인이 되었는지 이해 해보고 직접 플레이를 해봄으로써 심 폐 소생이 가능한 지 체험해 보고 심 폐 소생하는 컨텐츠 op.gg 상에서 5 티어 혹은 사장된 챔피언들을 직접 플레이 해보고 그 챔피언들이 다시 협곡에서 보일 수 있도록 하는 그의 새로운 컨텐츠이다.
215,"현재까지 플레이한 챔피언은 마 오 카이, 애니, 오공, 트런 들 등이 있다."
216,진 탑 올 캐알과 마찬가지로 안 할 것 같다는 말을 생방송에서 언급하였다.
217,아오
218,오니 마녀의 집괴 이증 후군 - 상당히 찰진 반응으로 좋은 반응을 얻었다.
219,항아리게임 - 도전했.... 으나 결국 클리어하지 못한 것으로 추정된다.
220,앙 빅 - The Great Man을 5 성까지 클리어하는데 성공했다!
221,바이오 하자드 7 레지던트 이 블 - 클리어했다 그림자 복도 - 꽤 자주 플레이 한다.
222,진성 쫄 보인 탓에 공포게임의 리액션이 좋은 편. Last neighbor - 이 게임을 플레이 할 때 트수들은 즐거웠고 허 샘은 심장마비에 걸리는 줄 알았다고
223,한다.
224,고양이 마리오 홍 콩 실록 도트 코 이 스푸 키 점프 스퀘어 맨션 프 레 시 피스 SCPA Dance of Fire and Ice 직진 게임 I wanna be the bossyPogostuck: Rage With Your FriendsLEAVE 헬 테이 커 Cat in the Box 매 드파 더 어 몽 어스 DJMAX RESPECT V 디 이 블 위 딘 패드가 아닌 컴퓨터로 플레이하다가 조작 감에 불편을 느껴 바로 환불 했다
225,To the Moon 이 게임을 하다가 몰입을 너무 많이 한 나머지 허 샘은 눈물을 보이고 말았다.
226,허 샘의 눈물 사실 초반에 지루하다 했으나 결국 아이 작의 번제: 리버스 요즘 이게임만 한다 거의 Bayonetta 이 게임 하다가 텐션이 다 죽어 버렸다.9
227,시간 동안 했으니 그럴 만도 ...Saiko no Sutoka
